"No.","Time","Source","Destination","Protocol","Length","Info"
"1497","07:34:29.312799","ec2-52-78-59-78.ap-northeast-2.compute.amazonaws.com","166.104.142.150","TLSv1.2","128","Application Data"
"1498","07:34:29.317246","166.104.142.150","ec2-52-78-59-78.ap-northeast-2.compute.amazonaws.com","TCP","66","33900  >  https(443) [ACK] Seq=1 Ack=63 Win=5215 Len=0 TSval=167881 TSecr=749271643"
"1499","07:34:29.333999","166.104.142.150","ec2-52-78-59-78.ap-northeast-2.compute.amazonaws.com","TLSv1.2","113","Application Data"
"1500","07:34:29.339665","ec2-52-78-59-78.ap-northeast-2.compute.amazonaws.com","166.104.142.150","TLSv1.2","113","Application Data"
"1501","07:34:29.350286","166.104.142.150","ec2-52-78-59-78.ap-northeast-2.compute.amazonaws.com","TLSv1.2","113","Application Data"
"1502","07:34:29.356020","ec2-52-78-59-78.ap-northeast-2.compute.amazonaws.com","166.104.142.150","TLSv1.2","276","Application Data"
"1503","07:34:29.363978","166.104.142.150","ec2-52-78-59-78.ap-northeast-2.compute.amazonaws.com","TLSv1.2","113","Application Data"
"1508","07:34:29.394894","ec2-52-78-59-78.ap-northeast-2.compute.amazonaws.com","166.104.142.150","TLSv1.2","151","Application Data"
"1511","07:34:29.436972","166.104.142.150","ec2-52-78-59-78.ap-northeast-2.compute.amazonaws.com","TLSv1.2","113","Application Data"
"1513","07:34:29.485377","ec2-52-78-59-78.ap-northeast-2.compute.amazonaws.com","166.104.142.150","TCP","66","https(443)  >  33900 [ACK] Seq=405 Ack=189 Win=27 Len=0 TSval=749271815 TSecr=167891"
"1517","07:34:29.625019","166.104.142.150","ec2-52-78-59-78.ap-northeast-2.compute.amazonaws.com","TLSv1.2","113","Application Data"
"1519","07:34:29.629587","ec2-52-78-59-78.ap-northeast-2.compute.amazonaws.com","166.104.142.150","TCP","66","https(443)  >  33900 [ACK] Seq=405 Ack=236 Win=27 Len=0 TSval=749271959 TSecr=167912"
"8742","07:34:32.394954","ec2-52-78-59-78.ap-northeast-2.compute.amazonaws.com","166.104.142.150","TLSv1.2","162","Application Data"
"9204","07:34:32.512506","166.104.142.150","ec2-52-78-59-78.ap-northeast-2.compute.amazonaws.com","TCP","66","33900  >  https(443) [ACK] Seq=236 Ack=501 Win=5215 Len=0 TSval=168201 TSecr=749274725"
"9503","07:34:32.587843","166.104.142.150","ec2-52-78-59-78.ap-northeast-2.compute.amazonaws.com","TLSv1.2","113","Application Data"
"9523","07:34:32.592050","ec2-52-78-59-78.ap-northeast-2.compute.amazonaws.com","166.104.142.150","TCP","66","https(443)  >  33900 [ACK] Seq=501 Ack=283 Win=27 Len=0 TSval=749274922 TSecr=168202"
"13458","07:34:33.597176","ec2-52-78-59-78.ap-northeast-2.compute.amazonaws.com","166.104.142.150","TCP","66","[TCP Keep-Alive] https(443)  >  33900 [ACK] Seq=500 Ack=283 Win=27 Len=0 TSval=749275927 TSecr=168202"
"14278","07:34:33.804821","166.104.142.150","ec2-52-78-59-78.ap-northeast-2.compute.amazonaws.com","TLSv1.2","205","Application Data"
"14294","07:34:33.809267","ec2-52-78-59-78.ap-northeast-2.compute.amazonaws.com","166.104.142.150","TCP","66","https(443)  >  33900 [ACK] Seq=501 Ack=422 Win=27 Len=0 TSval=749276139 TSecr=168329"
"14298","07:34:33.810760","ec2-52-78-59-78.ap-northeast-2.compute.amazonaws.com","166.104.142.150","TLSv1.2","113","Application Data"
"14339","07:34:33.819446","166.104.142.150","ec2-52-78-59-78.ap-northeast-2.compute.amazonaws.com","TCP","66","[TCP Dup ACK 9204#1] 33900  >  https(443) [ACK] Seq=422 Ack=501 Win=5215 Len=0 TSval=168329 TSecr=749274922"
"14343","07:34:33.820853","166.104.142.150","ec2-52-78-59-78.ap-northeast-2.compute.amazonaws.com","TLSv1.2","397","Application Data"
"14344","07:34:33.820995","166.104.142.150","ec2-52-78-59-78.ap-northeast-2.compute.amazonaws.com","TCP","66","33900  >  https(443) [ACK] Seq=753 Ack=548 Win=5215 Len=0 TSval=168331 TSecr=749276141"
"14363","07:34:33.826881","ec2-52-78-59-78.ap-northeast-2.compute.amazonaws.com","166.104.142.150","TLSv1.2","113","Application Data"
"14435","07:34:33.845676","166.104.142.150","ec2-52-78-59-78.ap-northeast-2.compute.amazonaws.com","TCP","66","33900  >  https(443) [ACK] Seq=753 Ack=595 Win=5215 Len=0 TSval=168333 TSecr=749276157"
"18412","07:34:34.852918","ec2-52-78-59-78.ap-northeast-2.compute.amazonaws.com","166.104.142.150","TLSv1.2","447","Application Data"
"18514","07:34:34.877539","166.104.142.150","ec2-52-78-59-78.ap-northeast-2.compute.amazonaws.com","TCP","66","33900  >  https(443) [ACK] Seq=753 Ack=976 Win=5215 Len=0 TSval=168436 TSecr=749277183"
"18515","07:34:34.877695","166.104.142.150","ec2-52-78-59-78.ap-northeast-2.compute.amazonaws.com","TLSv1.2","113","Application Data"
"18531","07:34:34.883314","ec2-52-78-59-78.ap-northeast-2.compute.amazonaws.com","166.104.142.150","TLSv1.2","400","Application Data"
"18712","07:34:34.928228","166.104.142.150","ec2-52-78-59-78.ap-northeast-2.compute.amazonaws.com","TLSv1.2","113","Application Data"
"18727","07:34:34.933799","ec2-52-78-59-78.ap-northeast-2.compute.amazonaws.com","166.104.142.150","TLSv1.2","626","Application Data"
"18762","07:34:34.946606","166.104.142.150","ec2-52-78-59-78.ap-northeast-2.compute.amazonaws.com","TLSv1.2","113","Application Data"
"18943","07:34:34.993414","ec2-52-78-59-78.ap-northeast-2.compute.amazonaws.com","166.104.142.150","TCP","66","https(443)  >  33900 [ACK] Seq=1870 Ack=894 Win=27 Len=0 TSval=749277323 TSecr=168443"
"19088","07:34:35.033283","ec2-52-78-59-78.ap-northeast-2.compute.amazonaws.com","166.104.142.150","TLSv1.2","397","Application Data"
"19104","07:34:35.040043","166.104.142.150","ec2-52-78-59-78.ap-northeast-2.compute.amazonaws.com","TLSv1.2","113","Application Data"
"19135","07:34:35.044377","ec2-52-78-59-78.ap-northeast-2.compute.amazonaws.com","166.104.142.150","TCP","66","https(443)  >  33900 [ACK] Seq=2201 Ack=941 Win=27 Len=0 TSval=749277374 TSecr=168453"
"19136","07:34:35.045811","ec2-52-78-59-78.ap-northeast-2.compute.amazonaws.com","166.104.142.150","TLSv1.2","446","Application Data"
"19423","07:34:35.123530","166.104.142.150","ec2-52-78-59-78.ap-northeast-2.compute.amazonaws.com","TLSv1.2","113","Application Data"
"19583","07:34:35.163613","ec2-52-78-59-78.ap-northeast-2.compute.amazonaws.com","166.104.142.150","TLSv1.2","623","Application Data"
"19654","07:34:35.189370","ec2-52-78-59-78.ap-northeast-2.compute.amazonaws.com","166.104.142.150","TLSv1.2","146","[TCP ACKed unseen segment] , Application Data"
"19780","07:34:35.220435","166.104.142.150","ec2-52-78-59-78.ap-northeast-2.compute.amazonaws.com","TLSv1.2","113","[TCP Previous segment not captured] , Application Data"
"19960","07:34:35.265633","ec2-52-78-59-78.ap-northeast-2.compute.amazonaws.com","166.104.142.150","TCP","66","[TCP ACKed unseen segment] https(443)  >  33900 [ACK] Seq=3218 Ack=1082 Win=27 Len=0 TSval=749277595 TSecr=168471"
"20124","07:34:35.318492","166.104.142.150","ec2-52-78-59-78.ap-northeast-2.compute.amazonaws.com","TLSv1.2","463","Application Data"
"20139","07:34:35.322748","ec2-52-78-59-78.ap-northeast-2.compute.amazonaws.com","166.104.142.150","TCP","66","https(443)  >  33900 [ACK] Seq=3218 Ack=1479 Win=27 Len=0 TSval=749277653 TSecr=168480"
"20155","07:34:35.324254","ec2-52-78-59-78.ap-northeast-2.compute.amazonaws.com","166.104.142.150","TLSv1.2","113","Application Data"
"20341","07:34:35.373997","166.104.142.150","ec2-52-78-59-78.ap-northeast-2.compute.amazonaws.com","TCP","66","33900  >  https(443) [ACK] Seq=1479 Ack=3265 Win=5215 Len=0 TSval=168487 TSecr=749277654"
"20420","07:34:35.395553","ec2-52-78-59-78.ap-northeast-2.compute.amazonaws.com","166.104.142.150","TLSv1.2","159","Application Data"
"20445","07:34:35.406337","166.104.142.150","ec2-52-78-59-78.ap-northeast-2.compute.amazonaws.com","TLSv1.2","113","Application Data"
"20631","07:34:35.453326","ec2-52-78-59-78.ap-northeast-2.compute.amazonaws.com","166.104.142.150","TCP","66","https(443)  >  33900 [ACK] Seq=3358 Ack=1526 Win=27 Len=0 TSval=749277783 TSecr=168490"
"22943","07:34:36.078790","ec2-52-78-59-78.ap-northeast-2.compute.amazonaws.com","166.104.142.150","TLSv1.2","151","Application Data"
"23666","07:34:36.275121","166.104.142.150","ec2-52-78-59-78.ap-northeast-2.compute.amazonaws.com","TLSv1.2","113","Application Data"
"23682","07:34:36.279568","ec2-52-78-59-78.ap-northeast-2.compute.amazonaws.com","166.104.142.150","TCP","66","https(443)  >  33900 [ACK] Seq=3443 Ack=1573 Win=27 Len=0 TSval=749278609 TSecr=168577"
"27009","07:34:37.189539","ec2-52-78-59-78.ap-northeast-2.compute.amazonaws.com","166.104.142.150","TLSv1.2","146","Application Data"
"27067","07:34:37.205078","166.104.142.150","ec2-52-78-59-78.ap-northeast-2.compute.amazonaws.com","TLSv1.2","113","Application Data"
"27082","07:34:37.209869","ec2-52-78-59-78.ap-northeast-2.compute.amazonaws.com","166.104.142.150","TCP","66","https(443)  >  33900 [ACK] Seq=3523 Ack=1620 Win=27 Len=0 TSval=749279539 TSecr=168670"
"27788","07:34:37.398747","166.104.142.150","ec2-52-78-59-78.ap-northeast-2.compute.amazonaws.com","TLSv1.2","468","Application Data"
"27812","07:34:37.403530","ec2-52-78-59-78.ap-northeast-2.compute.amazonaws.com","166.104.142.150","TCP","66","https(443)  >  33900 [ACK] Seq=3523 Ack=2022 Win=27 Len=0 TSval=749279733 TSecr=168689"
"27813","07:34:37.404811","ec2-52-78-59-78.ap-northeast-2.compute.amazonaws.com","166.104.142.150","TLSv1.2","113","Application Data"
"27961","07:34:37.445545","166.104.142.150","ec2-52-78-59-78.ap-northeast-2.compute.amazonaws.com","TLSv1.2","259","Application Data"
"28124","07:34:37.493307","ec2-52-78-59-78.ap-northeast-2.compute.amazonaws.com","166.104.142.150","TCP","66","https(443)  >  33900 [ACK] Seq=3570 Ack=2215 Win=27 Len=0 TSval=749279823 TSecr=168693"
"30628","07:34:38.156689","ec2-52-78-59-78.ap-northeast-2.compute.amazonaws.com","166.104.142.150","TLSv1.2","399","Application Data"
"30675","07:34:38.173646","166.104.142.150","ec2-52-78-59-78.ap-northeast-2.compute.amazonaws.com","TLSv1.2","113","Application Data"
"30690","07:34:38.177841","ec2-52-78-59-78.ap-northeast-2.compute.amazonaws.com","166.104.142.150","TCP","66","https(443)  >  33900 [ACK] Seq=3903 Ack=2262 Win=27 Len=0 TSval=749280508 TSecr=168766"
"30691","07:34:38.179471","ec2-52-78-59-78.ap-northeast-2.compute.amazonaws.com","166.104.142.150","TLSv1.2","446","Application Data"
"30783","07:34:38.203250","166.104.142.150","ec2-52-78-59-78.ap-northeast-2.compute.amazonaws.com","TLSv1.2","113","Application Data"
"30966","07:34:38.253326","ec2-52-78-59-78.ap-northeast-2.compute.amazonaws.com","166.104.142.150","TCP","66","https(443)  >  33900 [ACK] Seq=4283 Ack=2309 Win=27 Len=0 TSval=749280583 TSecr=168769"
"30967","07:34:38.260158","ec2-52-78-59-78.ap-northeast-2.compute.amazonaws.com","166.104.142.150","TLSv1.2","712","Application Data"
"31045","07:34:38.280800","166.104.142.150","ec2-52-78-59-78.ap-northeast-2.compute.amazonaws.com","TLSv1.2","113","Application Data"
"31056","07:34:38.285147","ec2-52-78-59-78.ap-northeast-2.compute.amazonaws.com","166.104.142.150","TCP","66","https(443)  >  33900 [ACK] Seq=4929 Ack=2356 Win=27 Len=0 TSval=749280615 TSecr=168777"
"31370","07:34:38.395668","ec2-52-78-59-78.ap-northeast-2.compute.amazonaws.com","166.104.142.150","TLSv1.2","143","Application Data"
"31452","07:34:38.415150","166.104.142.150","ec2-52-78-59-78.ap-northeast-2.compute.amazonaws.com","TLSv1.2","113","Application Data"
"31454","07:34:38.419545","ec2-52-78-59-78.ap-northeast-2.compute.amazonaws.com","166.104.142.150","TCP","66","https(443)  >  33900 [ACK] Seq=5006 Ack=2403 Win=27 Len=0 TSval=749280749 TSecr=168791"
"34219","07:34:39.136961","166.104.142.150","ec2-52-78-59-78.ap-northeast-2.compute.amazonaws.com","TLSv1.2","113","[TCP ACKed unseen segment] , Application Data"
"34238","07:34:39.141500","ec2-52-78-59-78.ap-northeast-2.compute.amazonaws.com","166.104.142.150","TCP","66","[TCP Previous segment not captured] https(443)  >  33900 [ACK] Seq=5102 Ack=2450 Win=27 Len=0 TSval=749281471 TSecr=168863"
"34472","07:34:39.202992","166.104.142.150","ec2-52-78-59-78.ap-northeast-2.compute.amazonaws.com","TLSv1.2","113","[TCP ACKed unseen segment] , Application Data"
"34490","07:34:39.207261","ec2-52-78-59-78.ap-northeast-2.compute.amazonaws.com","166.104.142.150","TCP","66","[TCP Previous segment not captured] https(443)  >  33900 [ACK] Seq=5182 Ack=2497 Win=27 Len=0 TSval=749281537 TSecr=168870"
"34844","07:34:39.295849","166.104.142.150","ec2-52-78-59-78.ap-northeast-2.compute.amazonaws.com","TLSv1.2","472","[TCP ACKed unseen segment] , Application Data"
"34862","07:34:39.300337","ec2-52-78-59-78.ap-northeast-2.compute.amazonaws.com","166.104.142.150","TCP","66","https(443)  >  33900 [ACK] Seq=5182 Ack=2903 Win=27 Len=0 TSval=749281630 TSecr=168879"
"34864","07:34:39.301646","ec2-52-78-59-78.ap-northeast-2.compute.amazonaws.com","166.104.142.150","TLSv1.2","113","Application Data"
"35066","07:34:39.357853","166.104.142.150","ec2-52-78-59-78.ap-northeast-2.compute.amazonaws.com","TCP","66","33900  >  https(443) [ACK] Seq=2903 Ack=5229 Win=5215 Len=0 TSval=168885 TSecr=749281631"
"41919","07:34:41.190054","ec2-52-78-59-78.ap-northeast-2.compute.amazonaws.com","166.104.142.150","TLSv1.2","166","Application Data"
"41937","07:34:41.193522","166.104.142.150","ec2-52-78-59-78.ap-northeast-2.compute.amazonaws.com","TCP","66","33900  >  https(443) [ACK] Seq=2903 Ack=5329 Win=5215 Len=0 TSval=169069 TSecr=749283520"
"41984","07:34:41.203525","166.104.142.150","ec2-52-78-59-78.ap-northeast-2.compute.amazonaws.com","TLSv1.2","113","Application Data"
"42142","07:34:41.249390","ec2-52-78-59-78.ap-northeast-2.compute.amazonaws.com","166.104.142.150","TCP","66","https(443)  >  33900 [ACK] Seq=5329 Ack=2950 Win=27 Len=0 TSval=749283579 TSecr=169070"
"42258","07:34:41.283675","166.104.142.150","ec2-52-78-59-78.ap-northeast-2.compute.amazonaws.com","TLSv1.2","130","Application Data"
"42276","07:34:41.287839","ec2-52-78-59-78.ap-northeast-2.compute.amazonaws.com","166.104.142.150","TCP","66","https(443)  >  33900 [ACK] Seq=5329 Ack=3014 Win=27 Len=0 TSval=749283618 TSecr=169078"
"42289","07:34:41.289003","ec2-52-78-59-78.ap-northeast-2.compute.amazonaws.com","166.104.142.150","TLSv1.2","113","Application Data"
"42436","07:34:41.332985","166.104.142.150","ec2-52-78-59-78.ap-northeast-2.compute.amazonaws.com","TLSv1.2","462","Application Data"
"42455","07:34:41.338552","ec2-52-78-59-78.ap-northeast-2.compute.amazonaws.com","166.104.142.150","TLSv1.2","113","Application Data"
"42631","07:34:41.383052","166.104.142.150","ec2-52-78-59-78.ap-northeast-2.compute.amazonaws.com","TCP","66","33900  >  https(443) [ACK] Seq=3410 Ack=5423 Win=5215 Len=0 TSval=169088 TSecr=749283668"
"42680","07:34:41.395848","ec2-52-78-59-78.ap-northeast-2.compute.amazonaws.com","166.104.142.150","TLSv1.2","146","Application Data"
"42710","07:34:41.401150","166.104.142.150","ec2-52-78-59-78.ap-northeast-2.compute.amazonaws.com","TCP","66","33900  >  https(443) [ACK] Seq=3410 Ack=5503 Win=5215 Len=0 TSval=169089 TSecr=749283726"
"42727","07:34:41.406719","166.104.142.150","ec2-52-78-59-78.ap-northeast-2.compute.amazonaws.com","TLSv1.2","113","Application Data"
"42875","07:34:41.453372","ec2-52-78-59-78.ap-northeast-2.compute.amazonaws.com","166.104.142.150","TCP","66","https(443)  >  33900 [ACK] Seq=5503 Ack=3457 Win=27 Len=0 TSval=749283783 TSecr=169090"
"44666","07:34:41.932647","ec2-52-78-59-78.ap-northeast-2.compute.amazonaws.com","166.104.142.150","TLSv1.2","400","Application Data"
"44849","07:34:41.983155","166.104.142.150","ec2-52-78-59-78.ap-northeast-2.compute.amazonaws.com","TCP","66","33900  >  https(443) [ACK] Seq=3457 Ack=5837 Win=5215 Len=0 TSval=169148 TSecr=749284262"
"44865","07:34:41.987468","166.104.142.150","ec2-52-78-59-78.ap-northeast-2.compute.amazonaws.com","TLSv1.2","113","Application Data"
"44882","07:34:41.991750","ec2-52-78-59-78.ap-northeast-2.compute.amazonaws.com","166.104.142.150","TCP","66","https(443)  >  33900 [ACK] Seq=5837 Ack=3504 Win=27 Len=0 TSval=749284322 TSecr=169148"
"44886","07:34:41.993118","ec2-52-78-59-78.ap-northeast-2.compute.amazonaws.com","166.104.142.150","TLSv1.2","447","Application Data"
"44903","07:34:41.997047","166.104.142.150","ec2-52-78-59-78.ap-northeast-2.compute.amazonaws.com","TCP","66","33900  >  https(443) [ACK] Seq=3504 Ack=6218 Win=5215 Len=0 TSval=169149 TSecr=749284323"
"45365","07:34:42.123404","166.104.142.150","ec2-52-78-59-78.ap-northeast-2.compute.amazonaws.com","TLSv1.2","113","Application Data"
"45391","07:34:42.133142","166.104.142.150","ec2-52-78-59-78.ap-northeast-2.compute.amazonaws.com","TCP","66","[TCP ACKed unseen segment] 33900  >  https(443) [ACK] Seq=3551 Ack=6874 Win=5215 Len=0 TSval=169163 TSecr=749284459"
"45663","07:34:42.208370","166.104.142.150","ec2-52-78-59-78.ap-northeast-2.compute.amazonaws.com","TLSv1.2","113","[TCP ACKed unseen segment] , Application Data"
"45697","07:34:42.214276","ec2-52-78-59-78.ap-northeast-2.compute.amazonaws.com","166.104.142.150","TLSv1.2","159","[TCP Previous segment not captured] , Application Data"
"45713","07:34:42.218497","166.104.142.150","ec2-52-78-59-78.ap-northeast-2.compute.amazonaws.com","TCP","66","[TCP ACKed unseen segment] 33900  >  https(443) [ACK] Seq=3598 Ack=6967 Win=5215 Len=0 TSval=169171 TSecr=749284544"
"46296","07:34:42.374600","166.104.142.150","ec2-52-78-59-78.ap-northeast-2.compute.amazonaws.com","TLSv1.2","113","Application Data"
"46476","07:34:42.421442","ec2-52-78-59-78.ap-northeast-2.compute.amazonaws.com","166.104.142.150","TCP","66","https(443)  >  33900 [ACK] Seq=6967 Ack=3645 Win=27 Len=0 TSval=749284751 TSecr=169187"
"46492","07:34:42.426866","166.104.142.150","ec2-52-78-59-78.ap-northeast-2.compute.amazonaws.com","TLSv1.2","259","Application Data"
"46509","07:34:42.431285","ec2-52-78-59-78.ap-northeast-2.compute.amazonaws.com","166.104.142.150","TCP","66","https(443)  >  33900 [ACK] Seq=6967 Ack=3838 Win=27 Len=0 TSval=749284761 TSecr=169192"
"48434","07:34:42.957345","166.104.142.150","client.smartthings.com","TCP","74","52632  >  https(443) [SYN] Seq=0 Win=29200 Len=0 MSS=1460 SACK_PERM=1 TSval=169245 TSecr=0 WS=32"
"48449","07:34:42.961676","client.smartthings.com","166.104.142.150","TCP","74","https(443)  >  52632 [SYN, ACK] Seq=0 Ack=1 Win=26847 Len=0 MSS=1460 SACK_PERM=1 TSval=3394344552 TSecr=169245 WS=256"
"48482","07:34:42.966755","166.104.142.150","client.smartthings.com","TCP","66","52632  >  https(443) [ACK] Seq=1 Ack=1 Win=29216 Len=0 TSval=169246 TSecr=3394344552"
"48875","07:34:43.074682","ec2-52-78-59-78.ap-northeast-2.compute.amazonaws.com","166.104.142.150","TLSv1.2","151","Application Data"
"48879","07:34:43.077986","166.104.142.150","ec2-52-78-59-78.ap-northeast-2.compute.amazonaws.com","TCP","66","33900  >  https(443) [ACK] Seq=3838 Ack=7052 Win=5215 Len=0 TSval=169257 TSecr=749285404"
"48968","07:34:43.100277","166.104.142.150","ec2-52-78-59-78.ap-northeast-2.compute.amazonaws.com","TLSv1.2","113","Application Data"
"48986","07:34:43.104404","ec2-52-78-59-78.ap-northeast-2.compute.amazonaws.com","166.104.142.150","TCP","66","https(443)  >  33900 [ACK] Seq=7052 Ack=3885 Win=27 Len=0 TSval=749285434 TSecr=169259"
"49295","07:34:43.190411","ec2-52-78-59-78.ap-northeast-2.compute.amazonaws.com","166.104.142.150","TLSv1.2","165","Application Data"
"49341","07:34:43.203103","166.104.142.150","ec2-52-78-59-78.ap-northeast-2.compute.amazonaws.com","TLSv1.2","113","Application Data"
"49357","07:34:43.207439","ec2-52-78-59-78.ap-northeast-2.compute.amazonaws.com","166.104.142.150","TCP","66","https(443)  >  33900 [ACK] Seq=7151 Ack=3932 Win=27 Len=0 TSval=749285537 TSecr=169270"
"49613","07:34:43.274972","166.104.142.150","client.smartthings.com","TLSv1.2","303","Client Hello"
"49629","07:34:43.279442","client.smartthings.com","166.104.142.150","TCP","66","https(443)  >  52632 [ACK] Seq=1 Ack=238 Win=28160 Len=0 TSval=3394344869 TSecr=169276"
"49632","07:34:43.281685","client.smartthings.com","166.104.142.150","TLSv1.2","1514","Server Hello"
"49633","07:34:43.281810","client.smartthings.com","166.104.142.150","TCP","1514","https(443)  >  52632 [ACK] Seq=1449 Ack=238 Win=28160 Len=1448 TSval=3394344871 TSecr=169276 [TCP segment of a reassembled PDU]"
"49634","07:34:43.281966","client.smartthings.com","166.104.142.150","TLSv1.2","479","Certificate, Server Key Exchange, Server Hello Done"
"49658","07:34:43.293370","166.104.142.150","ec2-52-78-59-78.ap-northeast-2.compute.amazonaws.com","TLSv1.2","132","Application Data"
"49677","07:34:43.297396","ec2-52-78-59-78.ap-northeast-2.compute.amazonaws.com","166.104.142.150","TCP","66","https(443)  >  33900 [ACK] Seq=7151 Ack=3998 Win=27 Len=0 TSval=749285627 TSecr=169279"
"49690","07:34:43.298792","ec2-52-78-59-78.ap-northeast-2.compute.amazonaws.com","166.104.142.150","TLSv1.2","113","Application Data"
"49739","07:34:43.311843","166.104.142.150","client.smartthings.com","TLSv1.2","141","Client Key Exchange"
"49742","07:34:43.312116","166.104.142.150","client.smartthings.com","TLSv1.2","72","Change Cipher Spec"
"49743","07:34:43.312223","166.104.142.150","client.smartthings.com","TLSv1.2","111","Encrypted Handshake Message"
"49757","07:34:43.316420","client.smartthings.com","166.104.142.150","TCP","66","https(443)  >  52632 [ACK] Seq=3310 Ack=319 Win=28160 Len=0 TSval=3394344906 TSecr=169280"
"49758","07:34:43.316613","client.smartthings.com","166.104.142.150","TLSv1.2","117","Change Cipher Spec, Encrypted Handshake Message"
"49833","07:34:43.333405","166.104.142.150","client.smartthings.com","TLSv1.2","197","Application Data"
"49850","07:34:43.338850","client.smartthings.com","166.104.142.150","TLSv1.2","265","Application Data"
"49877","07:34:43.349538","client.smartthings.com","166.104.142.150","TLSv1.2","97","[TCP ACKed unseen segment] , Encrypted Alert"
"49878","07:34:43.349543","client.smartthings.com","166.104.142.150","TCP","66","[TCP ACKed unseen segment] https(443)  >  52632 [FIN, ACK] Seq=3591 Ack=526 Win=29184 Len=0 TSval=3394344939 TSecr=169284"
"49941","07:34:43.367278","166.104.142.150","client.smartthings.com","TCP","66","52632  >  https(443) [RST, ACK] Seq=526 Ack=3592 Win=40800 Len=0 TSval=169286 TSecr=3394344939"
"51269","07:34:43.725696","ec2-52-78-59-78.ap-northeast-2.compute.amazonaws.com","166.104.142.150","TLSv1.2","127","Application Data"
"51311","07:34:43.733271","166.104.142.150","ec2-52-78-59-78.ap-northeast-2.compute.amazonaws.com","TCP","66","33900  >  https(443) [ACK] Seq=3998 Ack=7259 Win=5215 Len=0 TSval=169323 TSecr=749286055"
"51328","07:34:43.737549","166.104.142.150","ec2-52-78-59-78.ap-northeast-2.compute.amazonaws.com","TLSv1.2","113","Application Data"
"51350","07:34:43.742983","ec2-52-78-59-78.ap-northeast-2.compute.amazonaws.com","166.104.142.150","TLSv1.2","113","Application Data"
"51379","07:34:43.751712","166.104.142.150","ec2-52-78-59-78.ap-northeast-2.compute.amazonaws.com","TLSv1.2","113","Application Data"
"51394","07:34:43.757210","ec2-52-78-59-78.ap-northeast-2.compute.amazonaws.com","166.104.142.150","TLSv1.2","275","Application Data"
"51438","07:34:43.766761","166.104.142.150","ec2-52-78-59-78.ap-northeast-2.compute.amazonaws.com","TLSv1.2","113","Application Data"
"51623","07:34:43.817203","166.104.142.150","ec2-52-78-59-78.ap-northeast-2.compute.amazonaws.com","TLSv1.2","113","[TCP ACKed unseen segment] , Application Data"
"51803","07:34:43.865304","ec2-52-78-59-78.ap-northeast-2.compute.amazonaws.com","166.104.142.150","TCP","66","[TCP Previous segment not captured] https(443)  >  33900 [ACK] Seq=7600 Ack=4186 Win=27 Len=0 TSval=749286195 TSecr=169331"
"51821","07:34:43.867990","166.104.142.150","ec2-52-78-59-78.ap-northeast-2.compute.amazonaws.com","TLSv1.2","113","[TCP ACKed unseen segment] , Application Data"
"51837","07:34:43.872277","ec2-52-78-59-78.ap-northeast-2.compute.amazonaws.com","166.104.142.150","TCP","66","https(443)  >  33900 [ACK] Seq=7600 Ack=4233 Win=27 Len=0 TSval=749286202 TSecr=169336"
"53758","07:34:44.396317","ec2-52-78-59-78.ap-northeast-2.compute.amazonaws.com","166.104.142.150","TLSv1.2","142","Application Data"
"53803","07:34:44.410128","166.104.142.150","ec2-52-78-59-78.ap-northeast-2.compute.amazonaws.com","TLSv1.2","113","Application Data"
"53834","07:34:44.414430","ec2-52-78-59-78.ap-northeast-2.compute.amazonaws.com","166.104.142.150","TCP","66","https(443)  >  33900 [ACK] Seq=7676 Ack=4280 Win=27 Len=0 TSval=749286744 TSecr=169390"
"56278","07:34:45.079488","ec2-52-78-59-78.ap-northeast-2.compute.amazonaws.com","166.104.142.150","TLSv1.2","143","Application Data"
"56314","07:34:45.087888","166.104.142.150","ec2-52-78-59-78.ap-northeast-2.compute.amazonaws.com","TLSv1.2","113","Application Data"
"56344","07:34:45.092485","ec2-52-78-59-78.ap-northeast-2.compute.amazonaws.com","166.104.142.150","TCP","66","https(443)  >  33900 [ACK] Seq=7753 Ack=4327 Win=27 Len=0 TSval=749287422 TSecr=169458"
"56744","07:34:45.203392","166.104.142.150","ec2-52-78-59-78.ap-northeast-2.compute.amazonaws.com","TLSv1.2","113","[TCP ACKed unseen segment] , Application Data"
"56772","07:34:45.207919","ec2-52-78-59-78.ap-northeast-2.compute.amazonaws.com","166.104.142.150","TCP","66","[TCP Previous segment not captured] https(443)  >  33900 [ACK] Seq=7853 Ack=4374 Win=27 Len=0 TSval=749287537 TSecr=169470"
"57061","07:34:45.287521","166.104.142.150","ec2-52-78-59-78.ap-northeast-2.compute.amazonaws.com","TLSv1.2","130","[TCP ACKed unseen segment] , Application Data"
"57076","07:34:45.291874","ec2-52-78-59-78.ap-northeast-2.compute.amazonaws.com","166.104.142.150","TCP","66","https(443)  >  33900 [ACK] Seq=7853 Ack=4438 Win=27 Len=0 TSval=749287622 TSecr=169478"
"57090","07:34:45.293963","ec2-52-78-59-78.ap-northeast-2.compute.amazonaws.com","166.104.142.150","TLSv1.2","113","Application Data"
"57261","07:34:45.342777","166.104.142.150","ec2-52-78-59-78.ap-northeast-2.compute.amazonaws.com","TLSv1.2","468","Application Data"
"57293","07:34:45.348540","ec2-52-78-59-78.ap-northeast-2.compute.amazonaws.com","166.104.142.150","TLSv1.2","113","Application Data"
"57444","07:34:45.392751","166.104.142.150","ec2-52-78-59-78.ap-northeast-2.compute.amazonaws.com","TCP","66","33900  >  https(443) [ACK] Seq=4840 Ack=7947 Win=5215 Len=0 TSval=169489 TSecr=749287678"
"59937","07:34:46.074861","ec2-52-78-59-78.ap-northeast-2.compute.amazonaws.com","166.104.142.150","TLSv1.2","162","Application Data"
"60058","07:34:46.105127","166.104.142.150","ec2-52-78-59-78.ap-northeast-2.compute.amazonaws.com","TCP","66","33900  >  https(443) [ACK] Seq=4840 Ack=8043 Win=5215 Len=0 TSval=169559 TSecr=749288405"
"60075","07:34:46.108998","166.104.142.150","ec2-52-78-59-78.ap-northeast-2.compute.amazonaws.com","TLSv1.2","113","Application Data"
"60229","07:34:46.153392","ec2-52-78-59-78.ap-northeast-2.compute.amazonaws.com","166.104.142.150","TCP","66","https(443)  >  33900 [ACK] Seq=8043 Ack=4887 Win=27 Len=0 TSval=749288483 TSecr=169560"
"62608","07:34:46.803217","ec2-52-78-59-78.ap-northeast-2.compute.amazonaws.com","166.104.142.150","TLSv1.2","162","Application Data"
"62652","07:34:46.815947","166.104.142.150","ec2-52-78-59-78.ap-northeast-2.compute.amazonaws.com","TLSv1.2","113","Application Data"
"62672","07:34:46.820193","ec2-52-78-59-78.ap-northeast-2.compute.amazonaws.com","166.104.142.150","TCP","66","https(443)  >  33900 [ACK] Seq=8139 Ack=4934 Win=27 Len=0 TSval=749289150 TSecr=169630"
"64022","07:34:47.190978","ec2-52-78-59-78.ap-northeast-2.compute.amazonaws.com","166.104.142.150","TLSv1.2","167","Application Data"
"64900","07:34:47.391724","ec2-52-78-59-78.ap-northeast-2.compute.amazonaws.com","166.104.142.150","TCP","66","[TCP ACKed unseen segment] https(443)  >  33900 [ACK] Seq=8240 Ack=4981 Win=27 Len=0 TSval=749289721 TSecr=169688"
"64917","07:34:47.396481","ec2-52-78-59-78.ap-northeast-2.compute.amazonaws.com","166.104.142.150","TLSv1.2","147","[TCP ACKed unseen segment] , Application Data"
"65160","07:34:47.457607","166.104.142.150","ec2-52-78-59-78.ap-northeast-2.compute.amazonaws.com","TCP","66","[TCP Previous segment not captured] 33900  >  https(443) [ACK] Seq=4981 Ack=8321 Win=5215 Len=0 TSval=169694 TSecr=749289726"
"65225","07:34:47.473719","166.104.142.150","ec2-52-78-59-78.ap-northeast-2.compute.amazonaws.com","TLSv1.2","113","Application Data"
"65389","07:34:47.521299","ec2-52-78-59-78.ap-northeast-2.compute.amazonaws.com","166.104.142.150","TCP","66","[TCP ACKed unseen segment] https(443)  >  33900 [ACK] Seq=8321 Ack=5028 Win=27 Len=0 TSval=749289851 TSecr=169697"
"65417","07:34:47.528053","166.104.142.150","ec2-52-78-59-78.ap-northeast-2.compute.amazonaws.com","TLSv1.2","132","Application Data"
"65433","07:34:47.532243","ec2-52-78-59-78.ap-northeast-2.compute.amazonaws.com","166.104.142.150","TCP","66","https(443)  >  33900 [ACK] Seq=8321 Ack=5094 Win=27 Len=0 TSval=749289862 TSecr=169702"
"65437","07:34:47.533601","ec2-52-78-59-78.ap-northeast-2.compute.amazonaws.com","166.104.142.150","TLSv1.2","113","Application Data"
"65467","07:34:47.539129","166.104.142.150","ec2-52-78-59-78.ap-northeast-2.compute.amazonaws.com","TCP","66","33900  >  https(443) [ACK] Seq=5094 Ack=8368 Win=5215 Len=0 TSval=169703 TSecr=749289863"
"67458","07:34:48.080028","ec2-52-78-59-78.ap-northeast-2.compute.amazonaws.com","166.104.142.150","TLSv1.2","146","Application Data"
"67474","07:34:48.083725","166.104.142.150","ec2-52-78-59-78.ap-northeast-2.compute.amazonaws.com","TCP","66","33900  >  https(443) [ACK] Seq=5094 Ack=8448 Win=5215 Len=0 TSval=169758 TSecr=749290409"
"67491","07:34:48.089606","166.104.142.150","ec2-52-78-59-78.ap-northeast-2.compute.amazonaws.com","TLSv1.2","113","Application Data"
"71093","07:34:49.075019","ec2-52-78-59-78.ap-northeast-2.compute.amazonaws.com","166.104.142.150","TLSv1.2","159","Application Data"
"71231","07:34:49.108359","166.104.142.150","ec2-52-78-59-78.ap-northeast-2.compute.amazonaws.com","TLSv1.2","113","Application Data"
"71249","07:34:49.112682","ec2-52-78-59-78.ap-northeast-2.compute.amazonaws.com","166.104.142.150","TCP","66","https(443)  >  33900 [ACK] Seq=8541 Ack=5188 Win=27 Len=0 TSval=749291442 TSecr=169860"
"73780","07:34:49.803781","ec2-52-78-59-78.ap-northeast-2.compute.amazonaws.com","166.104.142.150","TLSv1.2","159","Application Data"
"73824","07:34:49.819979","ec2-52-78-59-78.ap-northeast-2.compute.amazonaws.com","166.104.142.150","TCP","66","[TCP ACKed unseen segment] https(443)  >  33900 [ACK] Seq=8634 Ack=5235 Win=27 Len=0 TSval=749292149 TSecr=169931"
"74788","07:34:50.079828","ec2-52-78-59-78.ap-northeast-2.compute.amazonaws.com","166.104.142.150","TLSv1.2","151","[TCP ACKed unseen segment] , Application Data"
"75001","07:34:50.137149","166.104.142.150","ec2-52-78-59-78.ap-northeast-2.compute.amazonaws.com","TLSv1.2","113","[TCP Previous segment not captured] , Application Data"
"75022","07:34:50.141407","ec2-52-78-59-78.ap-northeast-2.compute.amazonaws.com","166.104.142.150","TCP","66","[TCP ACKed unseen segment] https(443)  >  33900 [ACK] Seq=8719 Ack=5282 Win=27 Len=0 TSval=749292471 TSecr=169963"
"78447","07:34:51.080269","ec2-52-78-59-78.ap-northeast-2.compute.amazonaws.com","166.104.142.150","TLSv1.2","142","Application Data"
"78978","07:34:51.226921","166.104.142.150","ec2-52-78-59-78.ap-northeast-2.compute.amazonaws.com","TLSv1.2","113","Application Data"
"78994","07:34:51.231448","ec2-52-78-59-78.ap-northeast-2.compute.amazonaws.com","166.104.142.150","TCP","66","https(443)  >  33900 [ACK] Seq=8795 Ack=5329 Win=27 Len=0 TSval=749293561 TSecr=170072"
"79010","07:34:51.236489","166.104.142.150","ec2-52-78-59-78.ap-northeast-2.compute.amazonaws.com","TLSv1.2","259","Application Data"
"79026","07:34:51.240691","ec2-52-78-59-78.ap-northeast-2.compute.amazonaws.com","166.104.142.150","TCP","66","https(443)  >  33900 [ACK] Seq=8795 Ack=5522 Win=27 Len=0 TSval=749293570 TSecr=170073"
"81279","07:34:51.857928","166.104.142.150","ec2-52-78-59-78.ap-northeast-2.compute.amazonaws.com","TLSv1.2","259","Application Data"
"81296","07:34:51.862477","ec2-52-78-59-78.ap-northeast-2.compute.amazonaws.com","166.104.142.150","TCP","66","https(443)  >  33900 [ACK] Seq=8795 Ack=5715 Win=27 Len=0 TSval=749294192 TSecr=170135"
"82054","07:34:52.075342","ec2-52-78-59-78.ap-northeast-2.compute.amazonaws.com","166.104.142.150","TLSv1.2","143","Application Data"
"82253","07:34:52.128626","ec2-52-78-59-78.ap-northeast-2.compute.amazonaws.com","166.104.142.150","TCP","66","[TCP ACKed unseen segment] https(443)  >  33900 [ACK] Seq=8872 Ack=5762 Win=27 Len=0 TSval=749294458 TSecr=170162"
"82395","07:34:52.165019","166.104.142.150","ec2-52-78-59-78.ap-northeast-2.compute.amazonaws.com","TLSv1.2","145","[TCP Previous segment not captured] , Application Data"
"82411","07:34:52.169470","ec2-52-78-59-78.ap-northeast-2.compute.amazonaws.com","166.104.142.150","TCP","66","[TCP ACKed unseen segment] https(443)  >  33900 [ACK] Seq=8872 Ack=5841 Win=27 Len=0 TSval=749294499 TSecr=170166"
"82424","07:34:52.170964","ec2-52-78-59-78.ap-northeast-2.compute.amazonaws.com","166.104.142.150","TLSv1.2","113","Application Data"
"82457","07:34:52.180960","166.104.142.150","ec2-52-78-59-78.ap-northeast-2.compute.amazonaws.com","TCP","66","33900  >  https(443) [ACK] Seq=5841 Ack=8919 Win=5215 Len=0 TSval=170167 TSecr=749294500"
"82593","07:34:52.219928","ec2-52-78-59-78.ap-northeast-2.compute.amazonaws.com","166.104.142.150","TLSv1.2","448","Application Data"
"82621","07:34:52.225772","166.104.142.150","ec2-52-78-59-78.ap-northeast-2.compute.amazonaws.com","TCP","66","33900  >  https(443) [ACK] Seq=5841 Ack=9301 Win=5215 Len=0 TSval=170172 TSecr=749294549"
"82652","07:34:52.233915","166.104.142.150","ec2-52-78-59-78.ap-northeast-2.compute.amazonaws.com","TLSv1.2","113","Application Data"
"82675","07:34:52.239737","ec2-52-78-59-78.ap-northeast-2.compute.amazonaws.com","166.104.142.150","TLSv1.2","400","Application Data"
"82875","07:34:52.295515","166.104.142.150","ec2-52-78-59-78.ap-northeast-2.compute.amazonaws.com","TCP","66","33900  >  https(443) [ACK] Seq=5888 Ack=9635 Win=5215 Len=0 TSval=170179 TSecr=749294569"
"83053","07:34:52.344192","166.104.142.150","ec2-52-78-59-78.ap-northeast-2.compute.amazonaws.com","TLSv1.2","113","Application Data"
"83070","07:34:52.350062","ec2-52-78-59-78.ap-northeast-2.compute.amazonaws.com","166.104.142.150","TLSv1.2","764","Application Data"
"83355","07:34:52.432196","166.104.142.150","ec2-52-78-59-78.ap-northeast-2.compute.amazonaws.com","TLSv1.2","113","Application Data"
"83517","07:34:52.477473","ec2-52-78-59-78.ap-northeast-2.compute.amazonaws.com","166.104.142.150","TCP","66","https(443)  >  33900 [ACK] Seq=10333 Ack=5982 Win=27 Len=0 TSval=749294807 TSecr=170192"
"84720","07:34:52.803869","ec2-52-78-59-78.ap-northeast-2.compute.amazonaws.com","166.104.142.150","TLSv1.2","143","Application Data"
"84867","07:34:52.841162","166.104.142.150","ec2-52-78-59-78.ap-northeast-2.compute.amazonaws.com","TCP","66","33900  >  https(443) [ACK] Seq=5982 Ack=10410 Win=5215 Len=0 TSval=170233 TSecr=749295133"
"84902","07:34:52.850411","166.104.142.150","ec2-52-78-59-78.ap-northeast-2.compute.amazonaws.com","TLSv1.2","113","Application Data"
"84921","07:34:52.854567","ec2-52-78-59-78.ap-northeast-2.compute.amazonaws.com","166.104.142.150","TCP","66","https(443)  >  33900 [ACK] Seq=10410 Ack=6029 Win=27 Len=0 TSval=749295184 TSecr=170234"
"85743","07:34:53.080094","ec2-52-78-59-78.ap-northeast-2.compute.amazonaws.com","166.104.142.150","TLSv1.2","162","Application Data"
"85808","07:34:53.098060","166.104.142.150","ec2-52-78-59-78.ap-northeast-2.compute.amazonaws.com","TLSv1.2","113","Application Data"
"85824","07:34:53.102277","ec2-52-78-59-78.ap-northeast-2.compute.amazonaws.com","166.104.142.150","TCP","66","https(443)  >  33900 [ACK] Seq=10506 Ack=6076 Win=27 Len=0 TSval=749295432 TSecr=170259"
"89384","07:34:54.080274","ec2-52-78-59-78.ap-northeast-2.compute.amazonaws.com","166.104.142.150","TLSv1.2","147","Application Data"
"89444","07:34:54.099118","166.104.142.150","ec2-52-78-59-78.ap-northeast-2.compute.amazonaws.com","TLSv1.2","113","Application Data"
"89459","07:34:54.103511","ec2-52-78-59-78.ap-northeast-2.compute.amazonaws.com","166.104.142.150","TCP","66","https(443)  >  33900 [ACK] Seq=10587 Ack=6123 Win=27 Len=0 TSval=749296433 TSecr=170358"
"92989","07:34:55.075814","ec2-52-78-59-78.ap-northeast-2.compute.amazonaws.com","166.104.142.150","TLSv1.2","146","Application Data"
"93101","07:34:55.103491","166.104.142.150","ec2-52-78-59-78.ap-northeast-2.compute.amazonaws.com","TLSv1.2","113","Application Data"
"93118","07:34:55.107722","ec2-52-78-59-78.ap-northeast-2.compute.amazonaws.com","166.104.142.150","TCP","66","https(443)  >  33900 [ACK] Seq=10667 Ack=6170 Win=27 Len=0 TSval=749297437 TSecr=170460"
"95696","07:34:55.804852","ec2-52-78-59-78.ap-northeast-2.compute.amazonaws.com","166.104.142.150","TLSv1.2","146","Application Data"
"96172","07:34:55.941720","ec2-52-78-59-78.ap-northeast-2.compute.amazonaws.com","166.104.142.150","TCP","66","[TCP ACKed unseen segment] https(443)  >  33900 [ACK] Seq=10747 Ack=6217 Win=27 Len=0 TSval=749298271 TSecr=170543"
"96688","07:34:56.080402","ec2-52-78-59-78.ap-northeast-2.compute.amazonaws.com","166.104.142.150","TLSv1.2","159","[TCP ACKed unseen segment] , Application Data"
"96719","07:34:56.088940","166.104.142.150","ec2-52-78-59-78.ap-northeast-2.compute.amazonaws.com","TLSv1.2","113","[TCP Previous segment not captured] , Application Data"
"96735","07:34:56.092997","ec2-52-78-59-78.ap-northeast-2.compute.amazonaws.com","166.104.142.150","TCP","66","[TCP ACKed unseen segment] https(443)  >  33900 [ACK] Seq=10840 Ack=6264 Win=27 Len=0 TSval=749298423 TSecr=170558"
"100266","07:34:57.060415","ec2-52-78-59-78.ap-northeast-2.compute.amazonaws.com","166.104.142.150","TLSv1.2","151","Application Data"
"100696","07:34:57.178742","166.104.142.150","ec2-52-78-59-78.ap-northeast-2.compute.amazonaws.com","TLSv1.2","113","Application Data"
"100718","07:34:57.183142","ec2-52-78-59-78.ap-northeast-2.compute.amazonaws.com","166.104.142.150","TCP","66","https(443)  >  33900 [ACK] Seq=10925 Ack=6311 Win=27 Len=0 TSval=749299512 TSecr=170667"
"103995","07:34:58.085335","166.104.142.150","ec2-52-78-59-78.ap-northeast-2.compute.amazonaws.com","TLSv1.2","113","[TCP ACKed unseen segment] , Application Data"
"104011","07:34:58.089553","ec2-52-78-59-78.ap-northeast-2.compute.amazonaws.com","166.104.142.150","TCP","66","[TCP Previous segment not captured] https(443)  >  33900 [ACK] Seq=11001 Ack=6358 Win=27 Len=0 TSval=749300419 TSecr=170758"
"104475","07:34:58.215772","166.104.142.150","ec2-52-78-59-78.ap-northeast-2.compute.amazonaws.com","TLSv1.2","259","[TCP ACKed unseen segment] , Application Data"
"104493","07:34:58.220314","ec2-52-78-59-78.ap-northeast-2.compute.amazonaws.com","166.104.142.150","TCP","66","https(443)  >  33900 [ACK] Seq=11001 Ack=6551 Win=27 Len=0 TSval=749300550 TSecr=170771"
"106629","07:34:58.804393","ec2-52-78-59-78.ap-northeast-2.compute.amazonaws.com","166.104.142.150","TLSv1.2","142","Application Data"
"107062","07:34:58.923264","166.104.142.150","ec2-52-78-59-78.ap-northeast-2.compute.amazonaws.com","TLSv1.2","113","Application Data"
"107079","07:34:58.927705","ec2-52-78-59-78.ap-northeast-2.compute.amazonaws.com","166.104.142.150","TCP","66","https(443)  >  33900 [ACK] Seq=11077 Ack=6598 Win=27 Len=0 TSval=749301257 TSecr=170842"
"107641","07:34:59.080698","ec2-52-78-59-78.ap-northeast-2.compute.amazonaws.com","166.104.142.150","TLSv1.2","143","Application Data"
"107678","07:34:59.091166","166.104.142.150","ec2-52-78-59-78.ap-northeast-2.compute.amazonaws.com","TLSv1.2","113","Application Data"
"107695","07:34:59.095540","ec2-52-78-59-78.ap-northeast-2.compute.amazonaws.com","166.104.142.150","TCP","66","https(443)  >  33900 [ACK] Seq=11154 Ack=6645 Win=27 Len=0 TSval=749301425 TSecr=170858"
"111213","07:35:00.060753","ec2-52-78-59-78.ap-northeast-2.compute.amazonaws.com","166.104.142.150","TLSv1.2","162","Application Data"
"111907","07:35:00.250787","166.104.142.150","ec2-52-78-59-78.ap-northeast-2.compute.amazonaws.com","TLSv1.2","113","Application Data"
"111924","07:35:00.255150","ec2-52-78-59-78.ap-northeast-2.compute.amazonaws.com","166.104.142.150","TCP","66","https(443)  >  33900 [ACK] Seq=11250 Ack=6692 Win=27 Len=0 TSval=749302584 TSecr=170973"
"114913","07:35:01.076115","ec2-52-78-59-78.ap-northeast-2.compute.amazonaws.com","166.104.142.150","TLSv1.2","147","Application Data"
"114958","07:35:01.091272","166.104.142.150","ec2-52-78-59-78.ap-northeast-2.compute.amazonaws.com","TLSv1.2","113","Application Data"
"114974","07:35:01.095553","ec2-52-78-59-78.ap-northeast-2.compute.amazonaws.com","166.104.142.150","TCP","66","https(443)  >  33900 [ACK] Seq=11331 Ack=6739 Win=27 Len=0 TSval=749303425 TSecr=171058"
"117548","07:35:01.804743","ec2-52-78-59-78.ap-northeast-2.compute.amazonaws.com","166.104.142.150","TLSv1.2","147","Application Data"
"117593","07:35:01.815384","166.104.142.150","ec2-52-78-59-78.ap-northeast-2.compute.amazonaws.com","TLSv1.2","113","Application Data"
"117639","07:35:01.826358","ec2-52-78-59-78.ap-northeast-2.compute.amazonaws.com","166.104.142.150","TCP","66","https(443)  >  33900 [ACK] Seq=11412 Ack=6786 Win=27 Len=0 TSval=749304155 TSecr=171131"
"118558","07:35:02.080969","ec2-52-78-59-78.ap-northeast-2.compute.amazonaws.com","166.104.142.150","TLSv1.2","146","Application Data"
"119121","07:35:02.232482","166.104.142.150","ec2-52-78-59-78.ap-northeast-2.compute.amazonaws.com","TLSv1.2","113","Application Data"
"122145","07:35:03.061026","ec2-52-78-59-78.ap-northeast-2.compute.amazonaws.com","166.104.142.150","TLSv1.2","159","Application Data"
"122207","07:35:03.077347","166.104.142.150","ec2-52-78-59-78.ap-northeast-2.compute.amazonaws.com","TLSv1.2","113","Application Data"
"122224","07:35:03.081663","ec2-52-78-59-78.ap-northeast-2.compute.amazonaws.com","166.104.142.150","TCP","66","https(443)  >  33900 [ACK] Seq=11585 Ack=6880 Win=27 Len=0 TSval=749305411 TSecr=171256"
"125987","07:35:04.105476","ec2-52-78-59-78.ap-northeast-2.compute.amazonaws.com","166.104.142.150","TCP","66","[TCP Keep-Alive] https(443)  >  33900 [ACK] Seq=11584 Ack=6880 Win=27 Len=0 TSval=749306435 TSecr=171256"
"126003","07:35:04.108034","166.104.142.150","ec2-52-78-59-78.ap-northeast-2.compute.amazonaws.com","TCP","66","[TCP Keep-Alive ACK] 33900  >  https(443) [ACK] Seq=6880 Ack=11585 Win=5215 Len=0 TSval=171360 TSecr=749305411"
"126214","07:35:04.167426","166.104.142.150","ec2-52-78-59-78.ap-northeast-2.compute.amazonaws.com","TLSv1.2","259","Application Data"
"126231","07:35:04.171799","ec2-52-78-59-78.ap-northeast-2.compute.amazonaws.com","166.104.142.150","TCP","66","https(443)  >  33900 [ACK] Seq=11585 Ack=7073 Win=27 Len=0 TSval=749306501 TSecr=171366"
"129514","07:35:05.081296","ec2-52-78-59-78.ap-northeast-2.compute.amazonaws.com","166.104.142.150","TLSv1.2","142","Application Data"
"129647","07:35:05.113541","166.104.142.150","ec2-52-78-59-78.ap-northeast-2.compute.amazonaws.com","TLSv1.2","113","Application Data"
"129663","07:35:05.117877","ec2-52-78-59-78.ap-northeast-2.compute.amazonaws.com","166.104.142.150","TCP","66","https(443)  >  33900 [ACK] Seq=11661 Ack=7120 Win=27 Len=0 TSval=749307447 TSecr=171460"
"133030","07:35:06.061385","ec2-52-78-59-78.ap-northeast-2.compute.amazonaws.com","166.104.142.150","TLSv1.2","143","Application Data"
"133119","07:35:06.083457","166.104.142.150","ec2-52-78-59-78.ap-northeast-2.compute.amazonaws.com","TLSv1.2","113","Application Data"
"133134","07:35:06.087732","ec2-52-78-59-78.ap-northeast-2.compute.amazonaws.com","166.104.142.150","TCP","66","https(443)  >  33900 [ACK] Seq=11738 Ack=7167 Win=27 Len=0 TSval=749308417 TSecr=171557"
"140240","07:35:08.081612","ec2-52-78-59-78.ap-northeast-2.compute.amazonaws.com","166.104.142.150","TLSv1.2","147","Application Data"
"140786","07:35:08.231449","166.104.142.150","ec2-52-78-59-78.ap-northeast-2.compute.amazonaws.com","TLSv1.2","113","Application Data"
"140803","07:35:08.235880","ec2-52-78-59-78.ap-northeast-2.compute.amazonaws.com","166.104.142.150","TCP","66","https(443)  >  33900 [ACK] Seq=11819 Ack=7214 Win=27 Len=0 TSval=749310565 TSecr=171772"
"142954","07:35:08.827295","ec2-52-78-59-78.ap-northeast-2.compute.amazonaws.com","166.104.142.150","TLSv1.2","330","Application Data"
"142999","07:35:08.838848","166.104.142.150","ec2-52-78-59-78.ap-northeast-2.compute.amazonaws.com","TLSv1.2","113","Application Data"
"143017","07:35:08.843286","ec2-52-78-59-78.ap-northeast-2.compute.amazonaws.com","166.104.142.150","TCP","66","https(443)  >  33900 [ACK] Seq=12083 Ack=7261 Win=27 Len=0 TSval=749311172 TSecr=171833"
"143497","07:35:08.972487","166.104.142.150","ec2-52-78-59-78.ap-northeast-2.compute.amazonaws.com","TLSv1.2","461","Application Data"
"143513","07:35:08.976706","ec2-52-78-59-78.ap-northeast-2.compute.amazonaws.com","166.104.142.150","TCP","66","https(443)  >  33900 [ACK] Seq=12083 Ack=7656 Win=27 Len=0 TSval=749311306 TSecr=171846"
"143515","07:35:08.978081","ec2-52-78-59-78.ap-northeast-2.compute.amazonaws.com","166.104.142.150","TLSv1.2","113","Application Data"
"143699","07:35:09.026928","166.104.142.150","ec2-52-78-59-78.ap-northeast-2.compute.amazonaws.com","TCP","66","33900  >  https(443) [ACK] Seq=7656 Ack=12130 Win=5215 Len=0 TSval=171852 TSecr=749311307"
"143822","07:35:09.061592","ec2-52-78-59-78.ap-northeast-2.compute.amazonaws.com","166.104.142.150","TLSv1.2","146","Application Data"
"143826","07:35:09.064925","166.104.142.150","ec2-52-78-59-78.ap-northeast-2.compute.amazonaws.com","TCP","66","33900  >  https(443) [ACK] Seq=7656 Ack=12210 Win=5215 Len=0 TSval=171856 TSecr=749311391"
"143870","07:35:09.074577","166.104.142.150","ec2-52-78-59-78.ap-northeast-2.compute.amazonaws.com","TLSv1.2","113","Application Data"
"144034","07:35:09.121391","ec2-52-78-59-78.ap-northeast-2.compute.amazonaws.com","166.104.142.150","TCP","66","https(443)  >  33900 [ACK] Seq=12210 Ack=7703 Win=27 Len=0 TSval=749311450 TSecr=171856"
"147090","07:35:09.965770","ec2-52-78-59-78.ap-northeast-2.compute.amazonaws.com","166.104.142.150","TLSv1.2","327","Application Data"
"147125","07:35:09.974730","166.104.142.150","ec2-52-78-59-78.ap-northeast-2.compute.amazonaws.com","TLSv1.2","113","Application Data"
"147141","07:35:09.979103","ec2-52-78-59-78.ap-northeast-2.compute.amazonaws.com","166.104.142.150","TCP","66","https(443)  >  33900 [ACK] Seq=12471 Ack=7750 Win=27 Len=0 TSval=749312308 TSecr=171946"
"149399","07:35:10.593197","166.104.142.150","ec2-52-78-59-78.ap-northeast-2.compute.amazonaws.com","TLSv1.2","467","Application Data"
"149416","07:35:10.597648","ec2-52-78-59-78.ap-northeast-2.compute.amazonaws.com","166.104.142.150","TCP","66","https(443)  >  33900 [ACK] Seq=12471 Ack=8151 Win=27 Len=0 TSval=749312927 TSecr=172006"
"149420","07:35:10.599151","ec2-52-78-59-78.ap-northeast-2.compute.amazonaws.com","166.104.142.150","TLSv1.2","113","Application Data"
"149580","07:35:10.645032","166.104.142.150","ec2-52-78-59-78.ap-northeast-2.compute.amazonaws.com","TCP","66","33900  >  https(443) [ACK] Seq=8151 Ack=12518 Win=5215 Len=0 TSval=172014 TSecr=749312928"
"150743","07:35:10.966817","ec2-52-78-59-78.ap-northeast-2.compute.amazonaws.com","166.104.142.150","TLSv1.2","113","[TCP ACKed unseen segment] , Application Data"
"150773","07:35:10.974026","166.104.142.150","ec2-52-78-59-78.ap-northeast-2.compute.amazonaws.com","TCP","66","[TCP Previous segment not captured] 33900  >  https(443) [ACK] Seq=8556 Ack=12565 Win=5215 Len=0 TSval=172047 TSecr=749313296"
"151072","07:35:11.055522","ec2-52-78-59-78.ap-northeast-2.compute.amazonaws.com","166.104.142.150","TLSv1.2","331","[TCP ACKed unseen segment] , Application Data"
"151137","07:35:11.072920","166.104.142.150","ec2-52-78-59-78.ap-northeast-2.compute.amazonaws.com","TCP","66","33900  >  https(443) [ACK] Seq=8556 Ack=12830 Win=5215 Len=0 TSval=172056 TSecr=749313384"
"151344","07:35:11.130847","166.104.142.150","ec2-52-78-59-78.ap-northeast-2.compute.amazonaws.com","TLSv1.2","113","Application Data"
"151513","07:35:11.177276","ec2-52-78-59-78.ap-northeast-2.compute.amazonaws.com","166.104.142.150","TCP","66","https(443)  >  33900 [ACK] Seq=12830 Ack=8603 Win=27 Len=0 TSval=749313506 TSecr=172057"
"151677","07:35:11.224094","166.104.142.150","ec2-52-78-59-78.ap-northeast-2.compute.amazonaws.com","TLSv1.2","462","Application Data"
"151693","07:35:11.228256","ec2-52-78-59-78.ap-northeast-2.compute.amazonaws.com","166.104.142.150","TCP","66","https(443)  >  33900 [ACK] Seq=12830 Ack=8999 Win=27 Len=0 TSval=749313557 TSecr=172071"
"154486","07:35:11.994182","ec2-52-78-59-78.ap-northeast-2.compute.amazonaws.com","166.104.142.150","TLSv1.2","113","Application Data"
"154691","07:35:12.048999","166.104.142.150","ec2-52-78-59-78.ap-northeast-2.compute.amazonaws.com","TCP","66","33900  >  https(443) [ACK] Seq=8999 Ack=12877 Win=5215 Len=0 TSval=172154 TSecr=749314323"
"154721","07:35:12.061699","ec2-52-78-59-78.ap-northeast-2.compute.amazonaws.com","166.104.142.150","TLSv1.2","142","Application Data"
"154776","07:35:12.075434","166.104.142.150","ec2-52-78-59-78.ap-northeast-2.compute.amazonaws.com","TCP","66","33900  >  https(443) [ACK] Seq=8999 Ack=12953 Win=5215 Len=0 TSval=172156 TSecr=749314391"
"154860","07:35:12.096904","166.104.142.150","ec2-52-78-59-78.ap-northeast-2.compute.amazonaws.com","TLSv1.2","113","Application Data"
"154877","07:35:12.101107","ec2-52-78-59-78.ap-northeast-2.compute.amazonaws.com","166.104.142.150","TCP","66","https(443)  >  33900 [ACK] Seq=12953 Ack=9046 Win=27 Len=0 TSval=749314430 TSecr=172159"
"154880","07:35:12.102428","ec2-52-78-59-78.ap-northeast-2.compute.amazonaws.com","166.104.142.150","TLSv1.2","151","Application Data"
"155075","07:35:12.156098","166.104.142.150","ec2-52-78-59-78.ap-northeast-2.compute.amazonaws.com","TCP","66","33900  >  https(443) [ACK] Seq=9046 Ack=13038 Win=5215 Len=0 TSval=172165 TSecr=749314431"
"155109","07:35:12.163833","166.104.142.150","ec2-52-78-59-78.ap-northeast-2.compute.amazonaws.com","TLSv1.2","113","Application Data"
"155270","07:35:12.209374","ec2-52-78-59-78.ap-northeast-2.compute.amazonaws.com","166.104.142.150","TCP","66","https(443)  >  33900 [ACK] Seq=13038 Ack=9093 Win=27 Len=0 TSval=749314538 TSecr=172166"
"156169","07:35:12.454775","ec2-52-78-59-78.ap-northeast-2.compute.amazonaws.com","166.104.142.150","TLSv1.2","326","Application Data"
"156404","07:35:12.524322","166.104.142.150","ec2-52-78-59-78.ap-northeast-2.compute.amazonaws.com","TCP","66","33900  >  https(443) [ACK] Seq=9093 Ack=13298 Win=5215 Len=0 TSval=172201 TSecr=749314784"
"156420","07:35:12.527801","166.104.142.150","ec2-52-78-59-78.ap-northeast-2.compute.amazonaws.com","TLSv1.2","113","Application Data"
"156436","07:35:12.532330","ec2-52-78-59-78.ap-northeast-2.compute.amazonaws.com","166.104.142.150","TCP","66","https(443)  >  33900 [ACK] Seq=13298 Ack=9140 Win=27 Len=0 TSval=749314861 TSecr=172202"
"158753","07:35:13.171902","166.104.142.150","ec2-52-78-59-78.ap-northeast-2.compute.amazonaws.com","TLSv1.2","470","Application Data"
"158776","07:35:13.176576","ec2-52-78-59-78.ap-northeast-2.compute.amazonaws.com","166.104.142.150","TCP","66","https(443)  >  33900 [ACK] Seq=13298 Ack=9544 Win=27 Len=0 TSval=749315505 TSecr=172266"
"158784","07:35:13.178034","ec2-52-78-59-78.ap-northeast-2.compute.amazonaws.com","166.104.142.150","TLSv1.2","113","Application Data"
"158964","07:35:13.228548","166.104.142.150","ec2-52-78-59-78.ap-northeast-2.compute.amazonaws.com","TCP","66","33900  >  https(443) [ACK] Seq=9544 Ack=13345 Win=5215 Len=0 TSval=172272 TSecr=749315507"
"158997","07:35:13.236653","166.104.142.150","ec2-52-78-59-78.ap-northeast-2.compute.amazonaws.com","TLSv1.2","468","Application Data"
"159025","07:35:13.242649","ec2-52-78-59-78.ap-northeast-2.compute.amazonaws.com","166.104.142.150","TLSv1.2","113","Application Data"
"159041","07:35:13.248074","166.104.142.150","ec2-52-78-59-78.ap-northeast-2.compute.amazonaws.com","TCP","66","33900  >  https(443) [ACK] Seq=9946 Ack=13392 Win=5215 Len=0 TSval=172274 TSecr=749315571"
"161663","07:35:13.969816","ec2-52-78-59-78.ap-northeast-2.compute.amazonaws.com","166.104.142.150","TLSv1.2","332","Application Data"
"162465","07:35:14.182463","166.104.142.150","ec2-52-78-59-78.ap-northeast-2.compute.amazonaws.com","TCP","66","33900  >  https(443) [ACK] Seq=9946 Ack=13658 Win=5215 Len=0 TSval=172367 TSecr=749316299"
"162481","07:35:14.186802","166.104.142.150","ec2-52-78-59-78.ap-northeast-2.compute.amazonaws.com","TLSv1.2","113","Application Data"
"162644","07:35:14.233187","ec2-52-78-59-78.ap-northeast-2.compute.amazonaws.com","166.104.142.150","TCP","66","https(443)  >  33900 [ACK] Seq=13658 Ack=9993 Win=27 Len=0 TSval=749316562 TSecr=172368"
"162920","07:35:14.306125","166.104.142.150","ec2-52-78-59-78.ap-northeast-2.compute.amazonaws.com","TLSv1.2","462","Application Data"
"163146","07:35:14.373250","166.104.142.150","ec2-52-78-59-78.ap-northeast-2.compute.amazonaws.com","TCP","66","[TCP ACKed unseen segment] 33900  >  https(443) [ACK] Seq=10389 Ack=13705 Win=5215 Len=0 TSval=172387 TSecr=749316641"
"165649","07:35:15.062013","ec2-52-78-59-78.ap-northeast-2.compute.amazonaws.com","166.104.142.150","TLSv1.2","147","[TCP Previous segment not captured] , Application Data"
"166105","07:35:15.186744","166.104.142.150","ec2-52-78-59-78.ap-northeast-2.compute.amazonaws.com","TCP","66","[TCP ACKed unseen segment] 33900  >  https(443) [ACK] Seq=10389 Ack=13786 Win=5215 Len=0 TSval=172467 TSecr=749317391"
"166136","07:35:15.194364","166.104.142.150","ec2-52-78-59-78.ap-northeast-2.compute.amazonaws.com","TLSv1.2","113","Application Data"
"166155","07:35:15.200201","ec2-52-78-59-78.ap-northeast-2.compute.amazonaws.com","166.104.142.150","TLSv1.2","162","Application Data"
"166214","07:35:15.213682","166.104.142.150","ec2-52-78-59-78.ap-northeast-2.compute.amazonaws.com","TLSv1.2","113","Application Data"
"166380","07:35:15.261357","ec2-52-78-59-78.ap-northeast-2.compute.amazonaws.com","166.104.142.150","TCP","66","https(443)  >  33900 [ACK] Seq=13882 Ack=10483 Win=27 Len=0 TSval=749317590 TSecr=172470"
"167537","07:35:15.579177","ec2-52-78-59-78.ap-northeast-2.compute.amazonaws.com","166.104.142.150","TLSv1.2","328","Application Data"
"167624","07:35:15.600006","166.104.142.150","ec2-52-78-59-78.ap-northeast-2.compute.amazonaws.com","TLSv1.2","113","Application Data"
"167640","07:35:15.604376","ec2-52-78-59-78.ap-northeast-2.compute.amazonaws.com","166.104.142.150","TCP","66","https(443)  >  33900 [ACK] Seq=14144 Ack=10530 Win=27 Len=0 TSval=749317933 TSecr=172509"
"169705","07:35:16.194298","166.104.142.150","ec2-52-78-59-78.ap-northeast-2.compute.amazonaws.com","TLSv1.2","469","Application Data"
"169725","07:35:16.198613","ec2-52-78-59-78.ap-northeast-2.compute.amazonaws.com","166.104.142.150","TCP","66","https(443)  >  33900 [ACK] Seq=14144 Ack=10933 Win=27 Len=0 TSval=749318528 TSecr=172568"
"169730","07:35:16.200046","ec2-52-78-59-78.ap-northeast-2.compute.amazonaws.com","166.104.142.150","TLSv1.2","113","Application Data"
"169879","07:35:16.244834","166.104.142.150","ec2-52-78-59-78.ap-northeast-2.compute.amazonaws.com","TCP","66","33900  >  https(443) [ACK] Seq=10933 Ack=14191 Win=5215 Len=0 TSval=172574 TSecr=749318529"
"170123","07:35:16.312925","166.104.142.150","ec2-52-78-59-78.ap-northeast-2.compute.amazonaws.com","TLSv1.2","470","Application Data"
"170143","07:35:16.318606","ec2-52-78-59-78.ap-northeast-2.compute.amazonaws.com","166.104.142.150","TLSv1.2","113","Application Data"
"170169","07:35:16.323702","166.104.142.150","ec2-52-78-59-78.ap-northeast-2.compute.amazonaws.com","TCP","66","33900  >  https(443) [ACK] Seq=11337 Ack=14238 Win=5215 Len=0 TSval=172581 TSecr=749318648"
"172000","07:35:16.864323","ec2-52-78-59-78.ap-northeast-2.compute.amazonaws.com","166.104.142.150","TLSv1.2","332","Application Data"
"172014","07:35:16.867346","166.104.142.150","ec2-52-78-59-78.ap-northeast-2.compute.amazonaws.com","TCP","66","33900  >  https(443) [ACK] Seq=11337 Ack=14504 Win=5215 Len=0 TSval=172636 TSecr=749319193"
"172044","07:35:16.873756","166.104.142.150","ec2-52-78-59-78.ap-northeast-2.compute.amazonaws.com","TLSv1.2","113","Application Data"
"172195","07:35:16.921421","ec2-52-78-59-78.ap-northeast-2.compute.amazonaws.com","166.104.142.150","TCP","66","https(443)  >  33900 [ACK] Seq=14504 Ack=11384 Win=27 Len=0 TSval=749319250 TSecr=172636"
"172396","07:35:16.976009","166.104.142.150","ec2-52-78-59-78.ap-northeast-2.compute.amazonaws.com","TLSv1.2","462","Application Data"
"172406","07:35:16.981871","ec2-52-78-59-78.ap-northeast-2.compute.amazonaws.com","166.104.142.150","TLSv1.2","113","Application Data"
"172595","07:35:17.033417","166.104.142.150","ec2-52-78-59-78.ap-northeast-2.compute.amazonaws.com","TCP","66","33900  >  https(443) [ACK] Seq=11780 Ack=14551 Win=5215 Len=0 TSval=172653 TSecr=749319311"
"175522","07:35:17.875143","ec2-52-78-59-78.ap-northeast-2.compute.amazonaws.com","166.104.142.150","TLSv1.2","327","Application Data"
"175985","07:35:18.008293","166.104.142.150","ec2-52-78-59-78.ap-northeast-2.compute.amazonaws.com","TCP","66","33900  >  https(443) [ACK] Seq=11780 Ack=14812 Win=5215 Len=0 TSval=172750 TSecr=749320204"
"176001","07:35:18.013768","166.104.142.150","ec2-52-78-59-78.ap-northeast-2.compute.amazonaws.com","TLSv1.2","113","Application Data"
"176184","07:35:18.061291","ec2-52-78-59-78.ap-northeast-2.compute.amazonaws.com","166.104.142.150","TCP","66","https(443)  >  33900 [ACK] Seq=14812 Ack=11827 Win=27 Len=0 TSval=749320390 TSecr=172750"
"176215","07:35:18.074247","166.104.142.150","ec2-52-78-59-78.ap-northeast-2.compute.amazonaws.com","TLSv1.2","113","[TCP ACKed unseen segment] , Application Data"
"176231","07:35:18.078746","ec2-52-78-59-78.ap-northeast-2.compute.amazonaws.com","166.104.142.150","TCP","66","[TCP Previous segment not captured] https(443)  >  33900 [ACK] Seq=14905 Ack=11874 Win=27 Len=0 TSval=749320407 TSecr=172757"
"176322","07:35:18.101232","166.104.142.150","ec2-52-78-59-78.ap-northeast-2.compute.amazonaws.com","TLSv1.2","259","[TCP ACKed unseen segment] , Application Data"
"176338","07:35:18.105768","ec2-52-78-59-78.ap-northeast-2.compute.amazonaws.com","166.104.142.150","TCP","66","https(443)  >  33900 [ACK] Seq=14905 Ack=12067 Win=27 Len=0 TSval=749320434 TSecr=172758"
"178166","07:35:18.618685","166.104.142.150","ec2-52-78-59-78.ap-northeast-2.compute.amazonaws.com","TLSv1.2","468","Application Data"
"178181","07:35:18.623271","ec2-52-78-59-78.ap-northeast-2.compute.amazonaws.com","166.104.142.150","TCP","66","https(443)  >  33900 [ACK] Seq=14905 Ack=12469 Win=27 Len=0 TSval=749320952 TSecr=172811"
"178183","07:35:18.624609","ec2-52-78-59-78.ap-northeast-2.compute.amazonaws.com","166.104.142.150","TLSv1.2","113","Application Data"
"178360","07:35:18.674842","166.104.142.150","ec2-52-78-59-78.ap-northeast-2.compute.amazonaws.com","TCP","66","33900  >  https(443) [ACK] Seq=12469 Ack=14952 Win=5215 Len=0 TSval=172817 TSecr=749320953"
"179406","07:35:18.973896","166.104.142.150","ec2-52-78-59-78.ap-northeast-2.compute.amazonaws.com","TLSv1.2","470","Application Data"
"179434","07:35:18.979594","ec2-52-78-59-78.ap-northeast-2.compute.amazonaws.com","166.104.142.150","TLSv1.2","113","Application Data"
"179443","07:35:18.982112","166.104.142.150","ec2-52-78-59-78.ap-northeast-2.compute.amazonaws.com","TCP","66","33900  >  https(443) [ACK] Seq=12873 Ack=14999 Win=5215 Len=0 TSval=172847 TSecr=749321308"
"186863","07:35:21.065408","ec2-52-78-59-78.ap-northeast-2.compute.amazonaws.com","166.104.142.150","TLSv1.2","143","Application Data"
"186995","07:35:21.102132","166.104.142.150","ec2-52-78-59-78.ap-northeast-2.compute.amazonaws.com","TCP","66","33900  >  https(443) [ACK] Seq=12873 Ack=15076 Win=5215 Len=0 TSval=173059 TSecr=749323394"
"187000","07:35:21.103707","166.104.142.150","ec2-52-78-59-78.ap-northeast-2.compute.amazonaws.com","TLSv1.2","113","Application Data"
"187182","07:35:21.157281","ec2-52-78-59-78.ap-northeast-2.compute.amazonaws.com","166.104.142.150","TCP","66","https(443)  >  33900 [ACK] Seq=15076 Ack=12920 Win=27 Len=0 TSval=749323486 TSecr=173060"
"195894","07:35:23.587504","166.104.142.150","ec2-52-78-59-78.ap-northeast-2.compute.amazonaws.com","TLSv1.2","115","Application Data"
"195913","07:35:23.591983","ec2-52-78-59-78.ap-northeast-2.compute.amazonaws.com","166.104.142.150","TCP","66","https(443)  >  33900 [ACK] Seq=15076 Ack=12969 Win=27 Len=0 TSval=749325921 TSecr=173308"
"195919","07:35:23.593128","ec2-52-78-59-78.ap-northeast-2.compute.amazonaws.com","166.104.142.150","TLSv1.2","121","Application Data"
"196114","07:35:23.646588","166.104.142.150","ec2-52-78-59-78.ap-northeast-2.compute.amazonaws.com","TCP","66","33900  >  https(443) [ACK] Seq=12969 Ack=15131 Win=5215 Len=0 TSval=173314 TSecr=749325922"
"197624","07:35:24.065630","ec2-52-78-59-78.ap-northeast-2.compute.amazonaws.com","166.104.142.150","TLSv1.2","146","Application Data"
"197638","07:35:24.069863","166.104.142.150","ec2-52-78-59-78.ap-northeast-2.compute.amazonaws.com","TCP","66","33900  >  https(443) [ACK] Seq=12969 Ack=15211 Win=5215 Len=0 TSval=173356 TSecr=749326394"
"197671","07:35:24.075441","166.104.142.150","ec2-52-78-59-78.ap-northeast-2.compute.amazonaws.com","TLSv1.2","113","Application Data"
"197825","07:35:24.121416","ec2-52-78-59-78.ap-northeast-2.compute.amazonaws.com","166.104.142.150","TCP","66","https(443)  >  33900 [ACK] Seq=15211 Ack=13016 Win=27 Len=0 TSval=749326450 TSecr=173357"
"197997","07:35:24.170913","ec2-52-78-59-78.ap-northeast-2.compute.amazonaws.com","166.104.142.150","TLSv1.2","331","Application Data"
"198058","07:35:24.185082","166.104.142.150","ec2-52-78-59-78.ap-northeast-2.compute.amazonaws.com","TLSv1.2","113","Application Data"
"198077","07:35:24.189287","ec2-52-78-59-78.ap-northeast-2.compute.amazonaws.com","166.104.142.150","TCP","66","https(443)  >  33900 [ACK] Seq=15476 Ack=13063 Win=27 Len=0 TSval=749326518 TSecr=173367"
"198420","07:35:24.287080","166.104.142.150","ec2-52-78-59-78.ap-northeast-2.compute.amazonaws.com","TLSv1.2","462","Application Data"
"198439","07:35:24.291509","ec2-52-78-59-78.ap-northeast-2.compute.amazonaws.com","166.104.142.150","TCP","66","https(443)  >  33900 [ACK] Seq=15476 Ack=13459 Win=27 Len=0 TSval=749326620 TSecr=173378"
"198450","07:35:24.292852","ec2-52-78-59-78.ap-northeast-2.compute.amazonaws.com","166.104.142.150","TLSv1.2","113","Application Data"
"198625","07:35:24.343405","166.104.142.150","ec2-52-78-59-78.ap-northeast-2.compute.amazonaws.com","TCP","66","33900  >  https(443) [ACK] Seq=13459 Ack=15523 Win=5215 Len=0 TSval=173384 TSecr=749326622"
"203848","07:35:25.829733","ec2-52-78-59-78.ap-northeast-2.compute.amazonaws.com","166.104.142.150","TCP","66","[TCP Keep-Alive] https(443)  >  33900 [ACK] Seq=15522 Ack=13459 Win=27 Len=0 TSval=749328158 TSecr=173384"
"204592","07:35:26.041174","166.104.142.150","ec2-52-78-59-78.ap-northeast-2.compute.amazonaws.com","TCP","66","[TCP Keep-Alive ACK] 33900  >  https(443) [ACK] Seq=13459 Ack=15523 Win=5215 Len=0 TSval=173553 TSecr=749326622"
"205346","07:35:26.259325","166.104.142.150","ec2-52-78-59-78.ap-northeast-2.compute.amazonaws.com","TLSv1.2","471","Application Data"
"205373","07:35:26.264915","ec2-52-78-59-78.ap-northeast-2.compute.amazonaws.com","166.104.142.150","TLSv1.2","113","Application Data"
"205389","07:35:26.270087","166.104.142.150","ec2-52-78-59-78.ap-northeast-2.compute.amazonaws.com","TCP","66","33900  >  https(443) [ACK] Seq=13864 Ack=15570 Win=5215 Len=0 TSval=173576 TSecr=749328594"
"206305","07:35:26.530842","ec2-52-78-59-78.ap-northeast-2.compute.amazonaws.com","166.104.142.150","TLSv1.2","332","Application Data"
"206334","07:35:26.536929","166.104.142.150","ec2-52-78-59-78.ap-northeast-2.compute.amazonaws.com","TCP","66","33900  >  https(443) [ACK] Seq=13864 Ack=15836 Win=5215 Len=0 TSval=173603 TSecr=749328859"
"206365","07:35:26.546833","166.104.142.150","ec2-52-78-59-78.ap-northeast-2.compute.amazonaws.com","TLSv1.2","113","Application Data"
"206529","07:35:26.593333","ec2-52-78-59-78.ap-northeast-2.compute.amazonaws.com","166.104.142.150","TCP","66","https(443)  >  33900 [ACK] Seq=15836 Ack=13911 Win=27 Len=0 TSval=749328922 TSecr=173604"
"206690","07:35:26.641709","166.104.142.150","ec2-52-78-59-78.ap-northeast-2.compute.amazonaws.com","TLSv1.2","462","Application Data"
"206705","07:35:26.646030","ec2-52-78-59-78.ap-northeast-2.compute.amazonaws.com","166.104.142.150","TCP","66","https(443)  >  33900 [ACK] Seq=15836 Ack=14307 Win=27 Len=0 TSval=749328975 TSecr=173613"
"206710","07:35:26.647320","ec2-52-78-59-78.ap-northeast-2.compute.amazonaws.com","166.104.142.150","TLSv1.2","113","Application Data"
"206903","07:35:26.702170","166.104.142.150","ec2-52-78-59-78.ap-northeast-2.compute.amazonaws.com","TCP","66","33900  >  https(443) [ACK] Seq=14307 Ack=15883 Win=5215 Len=0 TSval=173620 TSecr=749328976"
"208205","07:35:27.065811","ec2-52-78-59-78.ap-northeast-2.compute.amazonaws.com","166.104.142.150","TLSv1.2","142","Application Data"
"208944","07:35:27.269969","166.104.142.150","ec2-52-78-59-78.ap-northeast-2.compute.amazonaws.com","TCP","66","33900  >  https(443) [ACK] Seq=14307 Ack=15959 Win=5215 Len=0 TSval=173676 TSecr=749329394"
"209014","07:35:27.292524","166.104.142.150","ec2-52-78-59-78.ap-northeast-2.compute.amazonaws.com","TLSv1.2","113","Application Data"
"209035","07:35:27.298042","ec2-52-78-59-78.ap-northeast-2.compute.amazonaws.com","166.104.142.150","TLSv1.2","151","Application Data"
"209211","07:35:27.342145","166.104.142.150","ec2-52-78-59-78.ap-northeast-2.compute.amazonaws.com","TCP","66","33900  >  https(443) [ACK] Seq=14354 Ack=16044 Win=5215 Len=0 TSval=173684 TSecr=749329627"
"209236","07:35:27.354144","166.104.142.150","ec2-52-78-59-78.ap-northeast-2.compute.amazonaws.com","TLSv1.2","113","Application Data"
"209424","07:35:27.401254","ec2-52-78-59-78.ap-northeast-2.compute.amazonaws.com","166.104.142.150","TCP","66","https(443)  >  33900 [ACK] Seq=16044 Ack=14401 Win=27 Len=0 TSval=749329730 TSecr=173685"
"213805","07:35:28.628005","166.104.142.150","ec2-52-78-59-78.ap-northeast-2.compute.amazonaws.com","TLSv1.2","472","Application Data"
"213822","07:35:28.632325","ec2-52-78-59-78.ap-northeast-2.compute.amazonaws.com","166.104.142.150","TCP","66","https(443)  >  33900 [ACK] Seq=16044 Ack=14807 Win=27 Len=0 TSval=749330961 TSecr=173812"
"213825","07:35:28.633773","ec2-52-78-59-78.ap-northeast-2.compute.amazonaws.com","166.104.142.150","TLSv1.2","113","Application Data"
"213855","07:35:28.641867","166.104.142.150","ec2-52-78-59-78.ap-northeast-2.compute.amazonaws.com","TCP","66","33900  >  https(443) [ACK] Seq=14807 Ack=16091 Win=5215 Len=0 TSval=173813 TSecr=749330962"
"218927","07:35:30.072790","166.104.142.150","ec2-52-78-59-78.ap-northeast-2.compute.amazonaws.com","TCP","66","[TCP ACKed unseen segment] 33900  >  https(443) [ACK] Seq=14807 Ack=16172 Win=5215 Len=0 TSval=173957 TSecr=749332395"
"218944","07:35:30.077864","166.104.142.150","ec2-52-78-59-78.ap-northeast-2.compute.amazonaws.com","TLSv1.2","113","[TCP ACKed unseen segment] , Application Data"
"219004","07:35:30.090941","ec2-52-78-59-78.ap-northeast-2.compute.amazonaws.com","166.104.142.150","TLSv1.2","162","[TCP Previous segment not captured] , Application Data"
"219099","07:35:30.114971","166.104.142.150","ec2-52-78-59-78.ap-northeast-2.compute.amazonaws.com","TLSv1.2","113","[TCP ACKed unseen segment] , Application Data"
"219304","07:35:30.173325","ec2-52-78-59-78.ap-northeast-2.compute.amazonaws.com","166.104.142.150","TCP","66","https(443)  >  33900 [ACK] Seq=16268 Ack=14901 Win=27 Len=0 TSval=749332502 TSecr=173960"
"229636","07:35:33.091244","ec2-52-78-59-78.ap-northeast-2.compute.amazonaws.com","166.104.142.150","TLSv1.2","159","Application Data"
"230078","07:35:33.216978","ec2-52-78-59-78.ap-northeast-2.compute.amazonaws.com","166.104.142.150","TCP","66","[TCP ACKed unseen segment] https(443)  >  33900 [ACK] Seq=16361 Ack=14948 Win=27 Len=0 TSval=749335546 TSecr=174271"
"230172","07:35:33.241247","166.104.142.150","ec2-52-78-59-78.ap-northeast-2.compute.amazonaws.com","TLSv1.2","259","[TCP Previous segment not captured] , Application Data"
"230188","07:35:33.245486","ec2-52-78-59-78.ap-northeast-2.compute.amazonaws.com","166.104.142.150","TCP","66","[TCP ACKed unseen segment] https(443)  >  33900 [ACK] Seq=16361 Ack=15141 Win=27 Len=0 TSval=749335574 TSecr=174274"
