"No.","Time","Source","Destination","Protocol","Length","Info"
"8","07:20:52.152510","166.104.142.150","ec2-52-78-59-78.ap-northeast-2.compute.amazonaws.com","TCP","66","33900  >  https(443) [ACK] Seq=1 Ack=1 Win=5215 Len=0 TSval=86127 TSecr=748454435"
"10","07:20:52.155540","166.104.142.150","ec2-52-78-59-78.ap-northeast-2.compute.amazonaws.com","TLSv1.2","113","Application Data"
"11","07:20:52.159960","ec2-52-78-59-78.ap-northeast-2.compute.amazonaws.com","166.104.142.150","TCP","66","https(443)  >  33900 [ACK] Seq=1 Ack=48 Win=27 Len=0 TSval=748454511 TSecr=86128"
"26","07:20:53.067477","ec2-52-78-59-78.ap-northeast-2.compute.amazonaws.com","166.104.142.150","TLSv1.2","143","Application Data"
"29","07:20:53.108856","166.104.142.150","ec2-52-78-59-78.ap-northeast-2.compute.amazonaws.com","TLSv1.2","113","Application Data"
"32","07:20:53.113132","ec2-52-78-59-78.ap-northeast-2.compute.amazonaws.com","166.104.142.150","TCP","66","https(443)  >  33900 [ACK] Seq=78 Ack=95 Win=27 Len=0 TSval=748455464 TSecr=86223"
"72","07:20:54.067636","ec2-52-78-59-78.ap-northeast-2.compute.amazonaws.com","166.104.142.150","TLSv1.2","162","Application Data"
"74","07:20:54.080238","166.104.142.150","ec2-52-78-59-78.ap-northeast-2.compute.amazonaws.com","TLSv1.2","113","Application Data"
"75","07:20:54.084608","ec2-52-78-59-78.ap-northeast-2.compute.amazonaws.com","166.104.142.150","TCP","66","https(443)  >  33900 [ACK] Seq=174 Ack=142 Win=27 Len=0 TSval=748456436 TSecr=86320"
"97","07:20:54.514066","Galaxy-Note10-5G-lan.local","api.smartthings.com","TLSv1.2","448","Application Data"
"98","07:20:54.521367","api.smartthings.com","Galaxy-Note10-5G-lan.local","TLSv1.2","291","Application Data"
"99","07:20:54.530189","Galaxy-Note10-5G-lan.local","api.smartthings.com","TCP","66","33158  >  https(443) [ACK] Seq=383 Ack=226 Win=422 Len=0 TSval=1328687860 TSecr=3009994542"
"148","07:20:55.739245","ec2-52-78-59-78.ap-northeast-2.compute.amazonaws.com","166.104.142.150","TLSv1.2","147","Application Data"
"153","07:20:55.847696","166.104.142.150","ec2-52-78-59-78.ap-northeast-2.compute.amazonaws.com","TLSv1.2","113","Application Data"
"154","07:20:55.852050","ec2-52-78-59-78.ap-northeast-2.compute.amazonaws.com","166.104.142.150","TCP","66","https(443)  >  33900 [ACK] Seq=255 Ack=189 Win=27 Len=0 TSval=748458203 TSecr=86497"
"156","07:20:55.906853","Galaxy-Note10-5G-lan.local","api.smartthings.com","TLSv1.2","705","Application Data"
"157","07:20:55.908132","Galaxy-Note10-5G-lan.local","api.smartthings.com","TLSv1.2","1253","Application Data"
"158","07:20:55.910563","api.smartthings.com","Galaxy-Note10-5G-lan.local","TCP","66","https(443)  >  47746 [ACK] Seq=1 Ack=640 Win=151 Len=0 TSval=1274099933 TSecr=2601095727"
"159","07:20:55.912268","api.smartthings.com","Galaxy-Note10-5G-lan.local","TCP","66","https(443)  >  47730 [ACK] Seq=1 Ack=1188 Win=190 Len=0 TSval=1274099934 TSecr=2601095727"
"160","07:20:56.067973","ec2-52-78-59-78.ap-northeast-2.compute.amazonaws.com","166.104.142.150","TLSv1.2","146","Application Data"
"162","07:20:56.107490","166.104.142.150","ec2-52-78-59-78.ap-northeast-2.compute.amazonaws.com","TLSv1.2","113","Application Data"
"163","07:20:56.112025","ec2-52-78-59-78.ap-northeast-2.compute.amazonaws.com","166.104.142.150","TCP","66","https(443)  >  33900 [ACK] Seq=335 Ack=236 Win=27 Len=0 TSval=748458463 TSecr=86523"
"165","07:20:56.143868","api.smartthings.com","Galaxy-Note10-5G-lan.local","TCP","1514","https(443)  >  47746 [ACK] Seq=1 Ack=640 Win=151 Len=1448 TSval=1274100166 TSecr=2601095727 [TCP segment of a reassembled PDU]"
"166","07:20:56.143872","api.smartthings.com","Galaxy-Note10-5G-lan.local","TLSv1.2","787","Application Data"
"167","07:20:56.149247","Galaxy-Note10-5G-lan.local","api.smartthings.com","TCP","66","47746  >  https(443) [ACK] Seq=640 Ack=1449 Win=444 Len=0 TSval=2601095972 TSecr=1274100166"
"168","07:20:56.149317","Galaxy-Note10-5G-lan.local","api.smartthings.com","TCP","66","47746  >  https(443) [ACK] Seq=640 Ack=2170 Win=456 Len=0 TSval=2601095972 TSecr=1274100166"
"170","07:20:56.179145","Galaxy-Note10-5G-lan.local","api.smartthings.com","TLSv1.2","792","Application Data"
"171","07:20:56.182982","api.smartthings.com","Galaxy-Note10-5G-lan.local","TCP","66","https(443)  >  47746 [ACK] Seq=2170 Ack=1366 Win=160 Len=0 TSval=1274100205 TSecr=2601095990"
"174","07:20:56.235679","api.smartthings.com","Galaxy-Note10-5G-lan.local","TLSv1.2","1111","Application Data"
"176","07:20:56.243060","Galaxy-Note10-5G-lan.local","api.smartthings.com","TCP","66","47730  >  https(443) [ACK] Seq=1188 Ack=1046 Win=512 Len=0 TSval=2601096066 TSecr=1274100257"
"177","07:20:56.274294","ec2-52-78-59-78.ap-northeast-2.compute.amazonaws.com","166.104.142.150","TLSv1.2","128","Application Data"
"188","07:20:56.303814","166.104.142.150","ec2-52-78-59-78.ap-northeast-2.compute.amazonaws.com","TLSv1.2","113","Application Data"
"189","07:20:56.308329","ec2-52-78-59-78.ap-northeast-2.compute.amazonaws.com","166.104.142.150","TCP","66","https(443)  >  33900 [ACK] Seq=397 Ack=283 Win=27 Len=0 TSval=748458660 TSecr=86540"
"190","07:20:56.309437","ec2-52-78-59-78.ap-northeast-2.compute.amazonaws.com","166.104.142.150","TLSv1.2","113","Application Data"
"218","07:20:56.319726","166.104.142.150","ec2-52-78-59-78.ap-northeast-2.compute.amazonaws.com","TLSv1.2","113","Application Data"
"219","07:20:56.325503","ec2-52-78-59-78.ap-northeast-2.compute.amazonaws.com","166.104.142.150","TLSv1.2","275","Application Data"
"222","07:20:56.364149","api.smartthings.com","Galaxy-Note10-5G-lan.local","TLSv1.2","511","Application Data"
"223","07:20:56.371292","166.104.142.150","ec2-52-78-59-78.ap-northeast-2.compute.amazonaws.com","TCP","66","33900  >  https(443) [ACK] Seq=330 Ack=653 Win=5215 Len=0 TSval=86550 TSecr=748458677"
"224","07:20:56.371369","166.104.142.150","ec2-52-78-59-78.ap-northeast-2.compute.amazonaws.com","TLSv1.2","113","Application Data"
"225","07:20:56.376974","ec2-52-78-59-78.ap-northeast-2.compute.amazonaws.com","166.104.142.150","TLSv1.2","151","Application Data"
"226","07:20:56.381301","166.104.142.150","ec2-52-78-59-78.ap-northeast-2.compute.amazonaws.com","TCP","66","33900  >  https(443) [ACK] Seq=377 Ack=738 Win=5215 Len=0 TSval=86550 TSecr=748458728"
"228","07:20:56.418288","Galaxy-Note10-5G-lan.local","api.smartthings.com","TCP","66","47746  >  https(443) [ACK] Seq=1366 Ack=2615 Win=467 Len=0 TSval=2601096242 TSecr=1274100386"
"237","07:20:56.541633","166.104.142.150","ec2-52-78-59-78.ap-northeast-2.compute.amazonaws.com","TLSv1.2","113","Application Data"
"239","07:20:56.589069","ec2-52-78-59-78.ap-northeast-2.compute.amazonaws.com","166.104.142.150","TCP","66","https(443)  >  33900 [ACK] Seq=738 Ack=424 Win=27 Len=0 TSval=748458940 TSecr=86566"
"244","07:20:57.068003","ec2-52-78-59-78.ap-northeast-2.compute.amazonaws.com","166.104.142.150","TLSv1.2","159","Application Data"
"246","07:20:57.076115","166.104.142.150","ec2-52-78-59-78.ap-northeast-2.compute.amazonaws.com","TCP","66","33900  >  https(443) [ACK] Seq=424 Ack=831 Win=5215 Len=0 TSval=86619 TSecr=748459419"
"248","07:20:57.080922","166.104.142.150","ec2-52-78-59-78.ap-northeast-2.compute.amazonaws.com","TLSv1.2","113","Application Data"
"249","07:20:57.085483","ec2-52-78-59-78.ap-northeast-2.compute.amazonaws.com","166.104.142.150","TCP","66","https(443)  >  33900 [ACK] Seq=831 Ack=471 Win=27 Len=0 TSval=748459437 TSecr=86620"
"251","07:20:57.113042","166.104.142.150","ec2-52-78-59-78.ap-northeast-2.compute.amazonaws.com","TLSv1.2","113","Application Data"
"252","07:20:57.117322","ec2-52-78-59-78.ap-northeast-2.compute.amazonaws.com","166.104.142.150","TCP","66","https(443)  >  33900 [ACK] Seq=831 Ack=518 Win=27 Len=0 TSval=748459469 TSecr=86624"
"594","07:20:58.182812","166.104.142.150","ec2-52-78-59-78.ap-northeast-2.compute.amazonaws.com","TLSv1.2","259","Application Data"
"595","07:20:58.187096","ec2-52-78-59-78.ap-northeast-2.compute.amazonaws.com","166.104.142.150","TCP","66","https(443)  >  33900 [ACK] Seq=831 Ack=711 Win=27 Len=0 TSval=748460538 TSecr=86730"
"779","07:20:59.068280","ec2-52-78-59-78.ap-northeast-2.compute.amazonaws.com","166.104.142.150","TLSv1.2","142","Application Data"
"782","07:20:59.081651","166.104.142.150","ec2-52-78-59-78.ap-northeast-2.compute.amazonaws.com","TLSv1.2","113","Application Data"
"783","07:20:59.085956","ec2-52-78-59-78.ap-northeast-2.compute.amazonaws.com","166.104.142.150","TCP","66","https(443)  >  33900 [ACK] Seq=907 Ack=758 Win=27 Len=0 TSval=748461437 TSecr=86821"
"785","07:20:59.243328","166.104.142.150","ec2-52-78-59-78.ap-northeast-2.compute.amazonaws.com","TLSv1.2","205","Application Data"
"786","07:20:59.247764","ec2-52-78-59-78.ap-northeast-2.compute.amazonaws.com","166.104.142.150","TCP","66","https(443)  >  33900 [ACK] Seq=907 Ack=897 Win=27 Len=0 TSval=748461599 TSecr=86836"
"787","07:20:59.249229","ec2-52-78-59-78.ap-northeast-2.compute.amazonaws.com","166.104.142.150","TLSv1.2","113","Application Data"
"788","07:20:59.253667","166.104.142.150","ec2-52-78-59-78.ap-northeast-2.compute.amazonaws.com","TLSv1.2","397","Application Data"
"789","07:20:59.259694","ec2-52-78-59-78.ap-northeast-2.compute.amazonaws.com","166.104.142.150","TLSv1.2","113","Application Data"
"790","07:20:59.262461","166.104.142.150","ec2-52-78-59-78.ap-northeast-2.compute.amazonaws.com","TCP","66","33900  >  https(443) [ACK] Seq=1228 Ack=1001 Win=5215 Len=0 TSval=86839 TSecr=748461600"
"791","07:20:59.355381","ec2-52-78-59-78.ap-northeast-2.compute.amazonaws.com","166.104.142.150","TLSv1.2","162","Application Data"
"793","07:20:59.366770","166.104.142.150","ec2-52-78-59-78.ap-northeast-2.compute.amazonaws.com","TLSv1.2","113","Application Data"
"869","07:20:59.412735","ec2-52-78-59-78.ap-northeast-2.compute.amazonaws.com","166.104.142.150","TCP","66","https(443)  >  33900 [ACK] Seq=1097 Ack=1275 Win=27 Len=0 TSval=748461764 TSecr=86849"
"1014","07:21:00.068086","ec2-52-78-59-78.ap-northeast-2.compute.amazonaws.com","166.104.142.150","TLSv1.2","143","Application Data"
"1016","07:21:00.142631","166.104.142.150","ec2-52-78-59-78.ap-northeast-2.compute.amazonaws.com","TLSv1.2","113","Application Data"
"1019","07:21:00.147065","ec2-52-78-59-78.ap-northeast-2.compute.amazonaws.com","166.104.142.150","TCP","66","https(443)  >  33900 [ACK] Seq=1174 Ack=1322 Win=27 Len=0 TSval=748462498 TSecr=86926"
"1253","07:21:00.799823","ec2-52-78-59-78.ap-northeast-2.compute.amazonaws.com","166.104.142.150","TLSv1.2","447","Application Data"
"1254","07:21:00.957432","166.104.142.150","ec2-52-78-59-78.ap-northeast-2.compute.amazonaws.com","TLSv1.2","113","Application Data"
"1255","07:21:00.961562","ec2-52-78-59-78.ap-northeast-2.compute.amazonaws.com","166.104.142.150","TCP","66","https(443)  >  33900 [ACK] Seq=1555 Ack=1369 Win=27 Len=0 TSval=748463313 TSecr=87008"
"1256","07:21:00.962986","ec2-52-78-59-78.ap-northeast-2.compute.amazonaws.com","166.104.142.150","TLSv1.2","401","Application Data"
"1257","07:21:00.970883","ec2-52-79-232-168.ap-northeast-2.compute.amazonaws.com","Galaxy-Note10-5G-lan.local","TLSv1.2","296","Application Data"
"1258","07:21:00.987961","166.104.142.150","ec2-52-78-59-78.ap-northeast-2.compute.amazonaws.com","TLSv1.2","113","Application Data"
"1259","07:21:00.993520","ec2-52-78-59-78.ap-northeast-2.compute.amazonaws.com","166.104.142.150","TLSv1.2","625","Application Data"
"1260","07:21:01.014120","166.104.142.150","ec2-52-78-59-78.ap-northeast-2.compute.amazonaws.com","TLSv1.2","113","Application Data"
"1261","07:21:01.019897","ec2-52-78-59-78.ap-northeast-2.compute.amazonaws.com","166.104.142.150","TLSv1.2","448","Application Data"
"1262","07:21:01.037359","ec2-13-124-31-195.ap-northeast-2.compute.amazonaws.com","Galaxy-Note10-5G-lan.local","TLSv1.2","430","Application Data"
"1263","07:21:01.052867","ec2-52-79-232-168.ap-northeast-2.compute.amazonaws.com","Galaxy-Note10-5G-lan.local","TLSv1.2","196","Application Data"
"1264","07:21:01.069059","166.104.142.150","ec2-52-78-59-78.ap-northeast-2.compute.amazonaws.com","TCP","66","33900  >  https(443) [ACK] Seq=1463 Ack=2831 Win=5215 Len=0 TSval=87020 TSecr=748463371"
"1265","07:21:01.080190","Galaxy-Note10-5G-lan.local","ec2-52-79-232-168.ap-northeast-2.compute.amazonaws.com","TCP","66","40292  >  https(443) [ACK] Seq=1 Ack=231 Win=603 Len=0 TSval=1182897022 TSecr=1936059536"
"1266","07:21:01.080348","Galaxy-Note10-5G-lan.local","ec2-13-124-31-195.ap-northeast-2.compute.amazonaws.com","TCP","66","52236  >  https(443) [ACK] Seq=1 Ack=365 Win=411 Len=0 TSval=1404213846 TSecr=230187099"
"1267","07:21:01.084189","Galaxy-Note10-5G-lan.local","ec2-52-79-232-168.ap-northeast-2.compute.amazonaws.com","TCP","66","40292  >  https(443) [ACK] Seq=1 Ack=361 Win=603 Len=0 TSval=1182897029 TSecr=1936059556"
"1268","07:21:01.119816","166.104.142.150","ec2-52-78-59-78.ap-northeast-2.compute.amazonaws.com","TLSv1.2","113","Application Data"
"1269","07:21:01.125409","ec2-52-78-59-78.ap-northeast-2.compute.amazonaws.com","166.104.142.150","TLSv1.2","399","Application Data"
"1270","07:21:01.128105","166.104.142.150","ec2-52-78-59-78.ap-northeast-2.compute.amazonaws.com","TCP","66","33900  >  https(443) [ACK] Seq=1510 Ack=3164 Win=5215 Len=0 TSval=87025 TSecr=748463477"
"1274","07:21:01.220806","ec2-13-124-31-195.ap-northeast-2.compute.amazonaws.com","Galaxy-Note10-5G-lan.local","TLSv1.2","433","Application Data"
"1275","07:21:01.227846","Galaxy-Note10-5G-lan.local","ec2-13-124-31-195.ap-northeast-2.compute.amazonaws.com","TCP","66","52236  >  https(443) [ACK] Seq=1 Ack=732 Win=422 Len=0 TSval=1404213997 TSecr=230187145"
"1277","07:21:01.301572","ec2-52-79-232-168.ap-northeast-2.compute.amazonaws.com","Galaxy-Note10-5G-lan.local","TLSv1.2","296","Application Data"
"1278","07:21:01.307341","Galaxy-Note10-5G-lan.local","ec2-52-79-232-168.ap-northeast-2.compute.amazonaws.com","TCP","66","40292  >  https(443) [ACK] Seq=1 Ack=591 Win=614 Len=0 TSval=1182897252 TSecr=1936059618"
"1279","07:21:01.308052","166.104.142.150","ec2-52-78-59-78.ap-northeast-2.compute.amazonaws.com","TLSv1.2","113","Application Data"
"1280","07:21:01.314456","ec2-52-78-59-78.ap-northeast-2.compute.amazonaws.com","166.104.142.150","TLSv1.2","624","Application Data"
"1281","07:21:01.319142","166.104.142.150","ec2-52-78-59-78.ap-northeast-2.compute.amazonaws.com","TCP","66","33900  >  https(443) [ACK] Seq=1557 Ack=3722 Win=5215 Len=0 TSval=87045 TSecr=748463665"
"1282","07:21:01.352106","166.104.142.150","ec2-52-78-59-78.ap-northeast-2.compute.amazonaws.com","TLSv1.2","113","Application Data"
"1283","07:21:01.358013","ec2-52-78-59-78.ap-northeast-2.compute.amazonaws.com","166.104.142.150","TLSv1.2","146","Application Data"
"1285","07:21:01.410201","166.104.142.150","ec2-52-78-59-78.ap-northeast-2.compute.amazonaws.com","TCP","66","33900  >  https(443) [ACK] Seq=1604 Ack=3802 Win=5215 Len=0 TSval=87054 TSecr=748463709"
"1384","07:21:01.496645","166.104.142.150","ec2-52-78-59-78.ap-northeast-2.compute.amazonaws.com","TLSv1.2","113","Application Data"
"1523","07:21:01.548884","ec2-52-78-59-78.ap-northeast-2.compute.amazonaws.com","166.104.142.150","TCP","66","https(443)  >  33900 [ACK] Seq=3802 Ack=1651 Win=27 Len=0 TSval=748463900 TSecr=87062"
"1524","07:21:01.696232","166.104.142.150","ec2-52-78-59-78.ap-northeast-2.compute.amazonaws.com","TLSv1.2","463","Application Data"
"1525","07:21:01.708319","ec2-52-78-59-78.ap-northeast-2.compute.amazonaws.com","166.104.142.150","TCP","66","https(443)  >  33900 [ACK] Seq=3802 Ack=2048 Win=27 Len=0 TSval=748464059 TSecr=87082"
"1526","07:21:01.709661","ec2-52-78-59-78.ap-northeast-2.compute.amazonaws.com","166.104.142.150","TLSv1.2","113","Application Data"
"1527","07:21:01.715450","166.104.142.150","ec2-52-78-59-78.ap-northeast-2.compute.amazonaws.com","TCP","66","33900  >  https(443) [ACK] Seq=2048 Ack=3849 Win=5215 Len=0 TSval=87084 TSecr=748464061"
"1530","07:21:02.068641","ec2-52-78-59-78.ap-northeast-2.compute.amazonaws.com","166.104.142.150","TLSv1.2","147","Application Data"
"1531","07:21:02.185667","166.104.142.150","ec2-52-78-59-78.ap-northeast-2.compute.amazonaws.com","TCP","66","33900  >  https(443) [ACK] Seq=2048 Ack=3930 Win=5215 Len=0 TSval=87131 TSecr=748464420"
"1533","07:21:02.195185","166.104.142.150","ec2-52-78-59-78.ap-northeast-2.compute.amazonaws.com","TLSv1.2","113","Application Data"
"1534","07:21:02.241067","ec2-52-78-59-78.ap-northeast-2.compute.amazonaws.com","166.104.142.150","TCP","66","https(443)  >  33900 [ACK] Seq=3930 Ack=2095 Win=27 Len=0 TSval=748464592 TSecr=87132"
"1538","07:21:02.355474","ec2-52-78-59-78.ap-northeast-2.compute.amazonaws.com","166.104.142.150","TLSv1.2","159","Application Data"
"1542","07:21:02.366637","166.104.142.150","ec2-52-78-59-78.ap-northeast-2.compute.amazonaws.com","TLSv1.2","113","Application Data"
"1543","07:21:02.371362","ec2-52-78-59-78.ap-northeast-2.compute.amazonaws.com","166.104.142.150","TCP","66","https(443)  >  33900 [ACK] Seq=4023 Ack=2142 Win=27 Len=0 TSval=748464722 TSecr=87149"
"3518","07:21:03.068422","ec2-52-78-59-78.ap-northeast-2.compute.amazonaws.com","166.104.142.150","TLSv1.2","146","Application Data"
"3590","07:21:03.088517","166.104.142.150","ec2-52-78-59-78.ap-northeast-2.compute.amazonaws.com","TLSv1.2","113","Application Data"
"3605","07:21:03.092950","ec2-52-78-59-78.ap-northeast-2.compute.amazonaws.com","166.104.142.150","TCP","66","https(443)  >  33900 [ACK] Seq=4103 Ack=2189 Win=27 Len=0 TSval=748465444 TSecr=87220"
"3869","07:21:03.166603","ec2-52-78-59-78.ap-northeast-2.compute.amazonaws.com","166.104.142.150","TLSv1.2","146","Application Data"
"3912","07:21:03.178457","166.104.142.150","ec2-52-78-59-78.ap-northeast-2.compute.amazonaws.com","TLSv1.2","113","Application Data"
"3927","07:21:03.182561","ec2-52-78-59-78.ap-northeast-2.compute.amazonaws.com","166.104.142.150","TCP","66","https(443)  >  33900 [ACK] Seq=4183 Ack=2236 Win=27 Len=0 TSval=748465534 TSecr=87230"
"4408","07:21:03.315475","Galaxy-Note10-5G-lan.local","ec2-52-79-232-168.ap-northeast-2.compute.amazonaws.com","TLSv1.2","132","Application Data"
"4437","07:21:03.325760","166.104.142.150","ec2-52-78-59-78.ap-northeast-2.compute.amazonaws.com","TLSv1.2","468","Application Data"
"4453","07:21:03.329947","ec2-52-78-59-78.ap-northeast-2.compute.amazonaws.com","166.104.142.150","TCP","66","https(443)  >  33900 [ACK] Seq=4183 Ack=2638 Win=27 Len=0 TSval=748465681 TSecr=87245"
"4461","07:21:03.331273","ec2-52-78-59-78.ap-northeast-2.compute.amazonaws.com","166.104.142.150","TLSv1.2","113","Application Data"
"4527","07:21:03.348878","ec2-52-79-232-168.ap-northeast-2.compute.amazonaws.com","Galaxy-Note10-5G-lan.local","TLSv1.2","1403","Application Data"
"4543","07:21:03.354634","Galaxy-Note10-5G-lan.local","ec2-52-79-232-168.ap-northeast-2.compute.amazonaws.com","TCP","66","40292  >  https(443) [ACK] Seq=67 Ack=1928 Win=625 Len=0 TSval=1182899300 TSecr=1936060130"
"4628","07:21:03.378557","Galaxy-Note10-5G-lan.local","ec2-52-79-232-168.ap-northeast-2.compute.amazonaws.com","TLSv1.2","124","Application Data"
"4656","07:21:03.384080","166.104.142.150","ec2-52-78-59-78.ap-northeast-2.compute.amazonaws.com","TCP","66","33900  >  https(443) [ACK] Seq=2638 Ack=4230 Win=5215 Len=0 TSval=87251 TSecr=748465682"
"4672","07:21:03.390334","ec2-52-79-232-168.ap-northeast-2.compute.amazonaws.com","Galaxy-Note10-5G-lan.local","TLSv1.2","249","Application Data"
"4701","07:21:03.398358","Galaxy-Note10-5G-lan.local","ec2-52-79-232-168.ap-northeast-2.compute.amazonaws.com","TLSv1.2","132","Application Data"
"4761","07:21:03.414472","ec2-52-79-232-168.ap-northeast-2.compute.amazonaws.com","Galaxy-Note10-5G-lan.local","TLSv1.2","147","Application Data"
"4776","07:21:03.418872","Galaxy-Note10-5G-lan.local","ec2-52-79-232-168.ap-northeast-2.compute.amazonaws.com","TLSv1.2","161","Application Data"
"4952","07:21:03.466302","ec2-52-79-232-168.ap-northeast-2.compute.amazonaws.com","Galaxy-Note10-5G-lan.local","TCP","66","https(443)  >  40292 [ACK] Seq=2192 Ack=286 Win=159 Len=0 TSval=1936060160 TSecr=1182899364"
"6372","07:21:03.851429","ec2-52-79-232-168.ap-northeast-2.compute.amazonaws.com","Galaxy-Note10-5G-lan.local","TCP","1514","https(443)  >  40292 [ACK] Seq=2192 Ack=286 Win=159 Len=1448 TSval=1936060256 TSecr=1182899364 [TCP segment of a reassembled PDU]"
"6373","07:21:03.851434","ec2-52-79-232-168.ap-northeast-2.compute.amazonaws.com","Galaxy-Note10-5G-lan.local","TCP","1514","https(443)  >  40292 [ACK] Seq=3640 Ack=286 Win=159 Len=1448 TSval=1936060256 TSecr=1182899364 [TCP segment of a reassembled PDU]"
"6374","07:21:03.851438","ec2-52-79-232-168.ap-northeast-2.compute.amazonaws.com","Galaxy-Note10-5G-lan.local","TCP","1514","https(443)  >  40292 [ACK] Seq=5088 Ack=286 Win=159 Len=1448 TSval=1936060256 TSecr=1182899364 [TCP segment of a reassembled PDU]"
"6375","07:21:03.851440","ec2-52-79-232-168.ap-northeast-2.compute.amazonaws.com","Galaxy-Note10-5G-lan.local","TLSv1.2","167","Application Data"
"6560","07:21:03.902219","ec2-52-79-232-168.ap-northeast-2.compute.amazonaws.com","Galaxy-Note10-5G-lan.local","TCP","167","[TCP Retransmission] https(443)  >  40292 [PSH, ACK] Seq=6536 Ack=286 Win=159 Len=101 TSval=1936060269 TSecr=1182899364"
"6677","07:21:03.931344","Galaxy-Note10-5G-lan.local","ec2-52-79-232-168.ap-northeast-2.compute.amazonaws.com","TCP","66","40292  >  https(443) [ACK] Seq=286 Ack=5088 Win=659 Len=0 TSval=1182899875 TSecr=1936060256"
"6678","07:21:03.931431","Galaxy-Note10-5G-lan.local","ec2-52-79-232-168.ap-northeast-2.compute.amazonaws.com","TCP","66","40292  >  https(443) [ACK] Seq=286 Ack=6637 Win=671 Len=0 TSval=1182899875 TSecr=1936060256"
"6679","07:21:03.934000","Galaxy-Note10-5G-lan.local","ec2-52-79-232-168.ap-northeast-2.compute.amazonaws.com","TCP","78","[TCP Dup ACK 6678#1] 40292  >  https(443) [ACK] Seq=286 Ack=6637 Win=671 Len=0 TSval=1182899881 TSecr=1936060269 SLE=6536 SRE=6637"
"6695","07:21:03.935836","Galaxy-Note10-5G-lan.local","ec2-52-79-232-168.ap-northeast-2.compute.amazonaws.com","TLSv1.2","175","Application Data"
"6711","07:21:03.939805","ec2-52-79-232-168.ap-northeast-2.compute.amazonaws.com","Galaxy-Note10-5G-lan.local","TCP","66","https(443)  >  40292 [ACK] Seq=6637 Ack=395 Win=159 Len=0 TSval=1936060278 TSecr=1182899882"
"6726","07:21:03.943111","Galaxy-Note10-5G-lan.local","ec2-52-79-232-168.ap-northeast-2.compute.amazonaws.com","TLSv1.2","1223","Application Data, Application Data, Application Data, Application Data, Application Data, Application Data, Application Data, Application Data, Application Data, Application Data"
"6741","07:21:03.947372","ec2-52-79-232-168.ap-northeast-2.compute.amazonaws.com","Galaxy-Note10-5G-lan.local","TCP","66","https(443)  >  40292 [ACK] Seq=6637 Ack=1552 Win=168 Len=0 TSval=1936060280 TSecr=1182899890"
"6757","07:21:03.953034","Galaxy-Note10-5G-lan.local","ec2-52-79-232-168.ap-northeast-2.compute.amazonaws.com","TLSv1.2","200","Application Data"
"6772","07:21:03.956847","ec2-52-79-232-168.ap-northeast-2.compute.amazonaws.com","Galaxy-Note10-5G-lan.local","TCP","66","https(443)  >  40292 [ACK] Seq=6637 Ack=1686 Win=177 Len=0 TSval=1936060282 TSecr=1182899899"
"6774","07:21:03.958617","Galaxy-Note10-5G-lan.local","api.smartthings.com","TLSv1.2","666","Application Data"
"6803","07:21:03.963379","api.smartthings.com","Galaxy-Note10-5G-lan.local","TCP","66","https(443)  >  33146 [ACK] Seq=1 Ack=601 Win=144 Len=0 TSval=3010003984 TSecr=1328697288"
"6804","07:21:03.966283","Galaxy-Note10-5G-lan.local","api.smartthings.com","TLSv1.2","1201","Application Data"
"6819","07:21:03.967215","Galaxy-Note10-5G-lan.local","api.smartthings.com","TLSv1.2","666","Application Data"
"6820","07:21:03.968940","Galaxy-Note10-5G-lan.local","api.smartthings.com","TLSv1.2","666","Application Data"
"6821","07:21:03.969164","Galaxy-Note10-5G-lan.local","api.smartthings.com","TLSv1.2","666","Application Data"
"6822","07:21:03.969195","Galaxy-Note10-5G-lan.local","api.smartthings.com","TLSv1.2","824","Application Data"
"6823","07:21:03.969223","Galaxy-Note10-5G-lan.local","api.smartthings.com","TLSv1.2","627","Application Data"
"6824","07:21:03.970403","api.smartthings.com","Galaxy-Note10-5G-lan.local","TCP","66","https(443)  >  47730 [ACK] Seq=1046 Ack=2323 Win=199 Len=0 TSval=1274107992 TSecr=2601103789"
"6837","07:21:03.971554","api.smartthings.com","Galaxy-Note10-5G-lan.local","TCP","66","https(443)  >  33178 [ACK] Seq=1 Ack=601 Win=129 Len=0 TSval=3010003993 TSecr=1328697296"
"6839","07:21:03.972957","api.smartthings.com","Galaxy-Note10-5G-lan.local","TCP","66","https(443)  >  33174 [ACK] Seq=1 Ack=601 Win=119 Len=0 TSval=3010003994 TSecr=1328697298"
"6840","07:21:03.973271","api.smartthings.com","Galaxy-Note10-5G-lan.local","TCP","66","https(443)  >  53794 [ACK] Seq=1 Ack=562 Win=121 Len=0 TSval=3825975476 TSecr=469384083"
"6841","07:21:03.973720","api.smartthings.com","Galaxy-Note10-5G-lan.local","TCP","66","https(443)  >  33176 [ACK] Seq=1 Ack=601 Win=119 Len=0 TSval=3010003995 TSecr=1328697298"
"6842","07:21:03.974062","api.smartthings.com","Galaxy-Note10-5G-lan.local","TCP","66","https(443)  >  53786 [ACK] Seq=1 Ack=759 Win=120 Len=0 TSval=3825975477 TSecr=469384083"
"6872","07:21:03.979547","ec2-52-79-232-168.ap-northeast-2.compute.amazonaws.com","Galaxy-Note10-5G-lan.local","TCP","1514","https(443)  >  40292 [ACK] Seq=6637 Ack=1686 Win=177 Len=1448 TSval=1936060288 TSecr=1182899899 [TCP segment of a reassembled PDU]"
"6873","07:21:03.979550","ec2-52-79-232-168.ap-northeast-2.compute.amazonaws.com","Galaxy-Note10-5G-lan.local","TLSv1.2","74","Application Data"
"6888","07:21:03.983528","Galaxy-Note10-5G-lan.local","ec2-54-180-164-51.ap-northeast-2.compute.amazonaws.com","TLSv1.2","123","Application Data"
"6889","07:21:03.984561","Galaxy-Note10-5G-lan.local","ec2-52-79-232-168.ap-northeast-2.compute.amazonaws.com","TCP","66","40292  >  https(443) [ACK] Seq=1686 Ack=8093 Win=682 Len=0 TSval=1182899931 TSecr=1936060288"
"6903","07:21:03.987727","Galaxy-Note10-5G-lan.local","api.smartthings.com","TLSv1.2","627","Application Data"
"6904","07:21:03.987724","ec2-54-180-164-51.ap-northeast-2.compute.amazonaws.com","Galaxy-Note10-5G-lan.local","TCP","66","https(443)  >  34038 [ACK] Seq=1 Ack=58 Win=122 Len=0 TSval=419360089 TSecr=1468104640"
"6921","07:21:03.992509","api.smartthings.com","Galaxy-Note10-5G-lan.local","TCP","66","https(443)  >  33182 [ACK] Seq=1 Ack=562 Win=124 Len=0 TSval=3010004013 TSecr=1328697317"
"7007","07:21:04.015220","ec2-52-79-232-168.ap-northeast-2.compute.amazonaws.com","Galaxy-Note10-5G-lan.local","TLSv1.2","532","Application Data"
"7008","07:21:04.015898","ec2-52-79-232-168.ap-northeast-2.compute.amazonaws.com","Galaxy-Note10-5G-lan.local","TLSv1.2","698","Application Data"
"7051","07:21:04.026416","Galaxy-Note10-5G-lan.local","ec2-52-79-232-168.ap-northeast-2.compute.amazonaws.com","TLSv1.2","161","Application Data"
"7097","07:21:04.040890","ec2-52-79-232-168.ap-northeast-2.compute.amazonaws.com","Galaxy-Note10-5G-lan.local","TLSv1.2","1499","Application Data"
"7123","07:21:04.045401","ec2-54-180-164-51.ap-northeast-2.compute.amazonaws.com","Galaxy-Note10-5G-lan.local","TLSv1.2","255","Application Data"
"7126","07:21:04.045666","ec2-54-180-164-51.ap-northeast-2.compute.amazonaws.com","Galaxy-Note10-5G-lan.local","TLSv1.2","104","Application Data"
"7128","07:21:04.048699","Galaxy-Note10-5G-lan.local","ec2-52-79-232-168.ap-northeast-2.compute.amazonaws.com","TLSv1.2","159","Application Data"
"7142","07:21:04.051757","Galaxy-Note10-5G-lan.local","ec2-54-180-164-51.ap-northeast-2.compute.amazonaws.com","TCP","66","34038  >  https(443) [ACK] Seq=58 Ack=228 Win=456 Len=0 TSval=1468104709 TSecr=419360104"
"7160","07:21:04.057206","Galaxy-Note10-5G-lan.local","api.smartthings.com","TLSv1.2","748","Application Data"
"7175","07:21:04.061222","api.smartthings.com","Galaxy-Note10-5G-lan.local","TCP","66","https(443)  >  47746 [ACK] Seq=2615 Ack=2048 Win=169 Len=0 TSval=1274108083 TSecr=2601103880"
"7251","07:21:04.080747","api.smartthings.com","Galaxy-Note10-5G-lan.local","TLSv1.2","1375","Application Data"
"7308","07:21:04.094195","ec2-52-79-232-168.ap-northeast-2.compute.amazonaws.com","Galaxy-Note10-5G-lan.local","TCP","66","https(443)  >  40292 [ACK] Seq=10624 Ack=1874 Win=177 Len=0 TSval=1936060317 TSecr=1182899995"
"7324","07:21:04.099753","Galaxy-Note10-5G-lan.local","api.smartthings.com","TLSv1.2","712","Application Data"
"7339","07:21:04.101034","Galaxy-Note10-5G-lan.local","ec2-52-79-232-168.ap-northeast-2.compute.amazonaws.com","TLSv1.2","296","Application Data, Application Data"
"7354","07:21:04.104679","api.smartthings.com","Galaxy-Note10-5G-lan.local","TCP","66","https(443)  >  33182 [ACK] Seq=1310 Ack=1208 Win=129 Len=0 TSval=3010004126 TSecr=1328697422"
"7355","07:21:04.104962","ec2-52-79-232-168.ap-northeast-2.compute.amazonaws.com","Galaxy-Note10-5G-lan.local","TCP","66","https(443)  >  40292 [ACK] Seq=10624 Ack=2104 Win=186 Len=0 TSval=1936060319 TSecr=1182900044"
"7401","07:21:04.119669","api.smartthings.com","Galaxy-Note10-5G-lan.local","TLSv1.2","1328","Application Data"
"7540","07:21:04.155347","Galaxy-Note10-5G-lan.local","api.smartthings.com","TCP","66","53794  >  https(443) [ACK] Seq=562 Ack=1263 Win=399 Len=0 TSval=469384240 TSecr=3825975623"
"7542","07:21:04.157485","ec2-52-79-232-168.ap-northeast-2.compute.amazonaws.com","Galaxy-Note10-5G-lan.local","TLSv1.2","270","Application Data"
"7613","07:21:04.176194","api.smartthings.com","Galaxy-Note10-5G-lan.local","TLSv1.2","1097","Application Data"
"7629","07:21:04.180963","Galaxy-Note10-5G-lan.local","api.smartthings.com","TCP","66","47730  >  https(443) [ACK] Seq=2323 Ack=2077 Win=524 Len=0 TSval=2601104005 TSecr=1274108198"
"7661","07:21:04.189913","api.smartthings.com","Galaxy-Note10-5G-lan.local","TLSv1.2","766","Application Data"
"7662","07:21:04.190046","api.smartthings.com","Galaxy-Note10-5G-lan.local","TLSv1.2","100","Application Data"
"7677","07:21:04.193968","ec2-52-79-232-168.ap-northeast-2.compute.amazonaws.com","Galaxy-Note10-5G-lan.local","TLSv1.2","175","Application Data"
"7690","07:21:04.194586","ec2-52-78-59-78.ap-northeast-2.compute.amazonaws.com","166.104.142.150","TLSv1.2","448","Application Data"
"7706","07:21:04.198572","166.104.142.150","ec2-52-78-59-78.ap-northeast-2.compute.amazonaws.com","TCP","66","33900  >  https(443) [ACK] Seq=2638 Ack=4612 Win=5215 Len=0 TSval=87333 TSecr=748466545"
"7707","07:21:04.198782","Galaxy-Note10-5G-lan.local","ec2-52-79-232-168.ap-northeast-2.compute.amazonaws.com","TCP","66","40292  >  https(443) [ACK] Seq=2104 Ack=10937 Win=727 Len=0 TSval=1182900145 TSecr=1936060332"
"7709","07:21:04.200505","Galaxy-Note10-5G-lan.local","api.smartthings.com","TCP","66","33182  >  https(443) [ACK] Seq=1208 Ack=2044 Win=422 Len=0 TSval=1328697529 TSecr=3010004211"
"7711","07:21:04.201683","Galaxy-Note10-5G-lan.local","api.smartthings.com","TLSv1.2","1253","Application Data"
"7727","07:21:04.206003","api.smartthings.com","Galaxy-Note10-5G-lan.local","TCP","66","https(443)  >  47730 [ACK] Seq=2077 Ack=3510 Win=209 Len=0 TSval=1274108228 TSecr=2601104025"
"7740","07:21:04.208790","166.104.142.150","ec2-52-78-59-78.ap-northeast-2.compute.amazonaws.com","TLSv1.2","113","Application Data"
"7757","07:21:04.213594","Galaxy-Note10-5G-lan.local","ec2-52-79-232-168.ap-northeast-2.compute.amazonaws.com","TLSv1.2","165","Application Data"
"7771","07:21:04.214623","ec2-52-78-59-78.ap-northeast-2.compute.amazonaws.com","166.104.142.150","TLSv1.2","400","Application Data"
"7772","07:21:04.215529","ec2-52-79-232-168.ap-northeast-2.compute.amazonaws.com","Galaxy-Note10-5G-lan.local","TLSv1.2","105","Application Data"
"7773","07:21:04.217508","ec2-52-79-232-168.ap-northeast-2.compute.amazonaws.com","Galaxy-Note10-5G-lan.local","TCP","66","https(443)  >  40292 [ACK] Seq=10976 Ack=2203 Win=186 Len=0 TSval=1936060347 TSecr=1182900157"
"7824","07:21:04.229996","api.smartthings.com","Galaxy-Note10-5G-lan.local","TLSv1.2","862","Application Data"
"7875","07:21:04.243096","ec2-52-79-232-168.ap-northeast-2.compute.amazonaws.com","Galaxy-Note10-5G-lan.local","TLSv1.2","175","Application Data"
"7876","07:21:04.243206","api.smartthings.com","Galaxy-Note10-5G-lan.local","TLSv1.2","865","Application Data"
"7877","07:21:04.243707","api.smartthings.com","Galaxy-Note10-5G-lan.local","TLSv1.2","860","Application Data"
"7890","07:21:04.245813","api.smartthings.com","Galaxy-Note10-5G-lan.local","TLSv1.2","866","Application Data"
"7893","07:21:04.246156","ec2-52-79-232-168.ap-northeast-2.compute.amazonaws.com","Galaxy-Note10-5G-lan.local","TLSv1.2","175","Application Data"
"7894","07:21:04.246346","ec2-52-79-232-168.ap-northeast-2.compute.amazonaws.com","Galaxy-Note10-5G-lan.local","TLSv1.2","175","Application Data"
"7895","07:21:04.247847","Galaxy-Note10-5G-lan.local","ec2-52-79-232-168.ap-northeast-2.compute.amazonaws.com","TCP","66","40292  >  https(443) [ACK] Seq=2203 Ack=11085 Win=727 Len=0 TSval=1182900193 TSecr=1936060347"
"7897","07:21:04.247956","Galaxy-Note10-5G-lan.local","api.smartthings.com","TCP","66","33174  >  https(443) [ACK] Seq=601 Ack=795 Win=399 Len=0 TSval=1328697577 TSecr=3010004265"
"7911","07:21:04.251666","Galaxy-Note10-5G-lan.local","ec2-52-79-232-168.ap-northeast-2.compute.amazonaws.com","TCP","66","40292  >  https(443) [ACK] Seq=2203 Ack=11303 Win=727 Len=0 TSval=1182900198 TSecr=1936060355"
"7943","07:21:04.261190","Galaxy-Note10-5G-lan.local","ec2-52-79-232-168.ap-northeast-2.compute.amazonaws.com","TLSv1.2","173","Application Data"
"7957","07:21:04.264505","166.104.142.150","ec2-52-78-59-78.ap-northeast-2.compute.amazonaws.com","TLSv1.2","113","Application Data"
"7972","07:21:04.268498","Galaxy-Note10-5G-lan.local","api.smartthings.com","TLSv1.2","674","Application Data"
"7986","07:21:04.272172","Galaxy-Note10-5G-lan.local","ec2-54-180-164-51.ap-northeast-2.compute.amazonaws.com","TLSv1.2","123","Application Data"
"7987","07:21:04.272271","Galaxy-Note10-5G-lan.local","api.smartthings.com","TLSv1.2","431","Application Data"
"7995","07:21:04.273266","api.smartthings.com","Galaxy-Note10-5G-lan.local","TCP","66","https(443)  >  33146 [ACK] Seq=801 Ack=1209 Win=149 Len=0 TSval=3010004294 TSecr=1328697595"
"8003","07:21:04.275529","ec2-52-78-59-78.ap-northeast-2.compute.amazonaws.com","166.104.142.150","TLSv1.2","710","Application Data"
"8005","07:21:04.276361","api.smartthings.com","Galaxy-Note10-5G-lan.local","TCP","66","https(443)  >  33190 [ACK] Seq=1 Ack=366 Win=118 Len=0 TSval=3010004297 TSecr=1328697601"
"8008","07:21:04.276553","ec2-54-180-164-51.ap-northeast-2.compute.amazonaws.com","Galaxy-Note10-5G-lan.local","TCP","66","https(443)  >  34038 [ACK] Seq=228 Ack=115 Win=122 Len=0 TSval=419360162 TSecr=1468104928"
"8035","07:21:04.281895","Galaxy-Note10-5G-lan.local","api.smartthings.com","TLSv1.2","627","Application Data"
"8049","07:21:04.285947","api.smartthings.com","Galaxy-Note10-5G-lan.local","TCP","66","https(443)  >  33178 [ACK] Seq=797 Ack=1162 Win=134 Len=0 TSval=3010004307 TSecr=1328697603"
"8066","07:21:04.292787","Galaxy-Note10-5G-lan.local","api.smartthings.com","TCP","66","33176  >  https(443) [ACK] Seq=601 Ack=800 Win=399 Len=0 TSval=1328697620 TSecr=3010004264"
"8122","07:21:04.306388","ec2-52-79-232-168.ap-northeast-2.compute.amazonaws.com","Galaxy-Note10-5G-lan.local","TCP","66","https(443)  >  40292 [ACK] Seq=11303 Ack=2310 Win=186 Len=0 TSval=1936060370 TSecr=1182900206"
"8136","07:21:04.308764","api.smartthings.com","Galaxy-Note10-5G-lan.local","TLSv1.2","511","Application Data"
"8137","07:21:04.308973","Galaxy-Note10-5G-lan.local","ec2-52-79-232-168.ap-northeast-2.compute.amazonaws.com","TLSv1.2","741","Application Data, Application Data, Application Data, Application Data, Application Data, Application Data"
"8141","07:21:04.311439","ec2-52-79-232-168.ap-northeast-2.compute.amazonaws.com","Galaxy-Note10-5G-lan.local","TLSv1.2","175","Application Data"
"8154","07:21:04.313288","ec2-52-79-232-168.ap-northeast-2.compute.amazonaws.com","Galaxy-Note10-5G-lan.local","TCP","66","https(443)  >  40292 [ACK] Seq=11412 Ack=2985 Win=195 Len=0 TSval=1936060371 TSecr=1182900256"
"8155","07:21:04.315231","166.104.142.150","ec2-52-78-59-78.ap-northeast-2.compute.amazonaws.com","TLSv1.2","113","Application Data"
"8158","07:21:04.316323","Galaxy-Note10-5G-lan.local","api.smartthings.com","TCP","66","47746  >  https(443) [ACK] Seq=2048 Ack=3060 Win=478 Len=0 TSval=2601104137 TSecr=1274108330"
"8186","07:21:04.321106","Galaxy-Note10-5G-lan.local","api.smartthings.com","TLSv1.2","431","Application Data"
"8201","07:21:04.325809","api.smartthings.com","Galaxy-Note10-5G-lan.local","TCP","66","https(443)  >  33192 [ACK] Seq=1 Ack=366 Win=118 Len=0 TSval=3010004347 TSecr=1328697651"
"8244","07:21:04.337307","ec2-52-79-232-168.ap-northeast-2.compute.amazonaws.com","Galaxy-Note10-5G-lan.local","TLSv1.2","187","Application Data"
"8245","07:21:04.337693","ec2-52-79-232-168.ap-northeast-2.compute.amazonaws.com","Galaxy-Note10-5G-lan.local","TLSv1.2","105","Application Data"
"8261","07:21:04.343185","Galaxy-Note10-5G-lan.local","ec2-52-79-232-168.ap-northeast-2.compute.amazonaws.com","TCP","66","40292  >  https(443) [ACK] Seq=2985 Ack=11572 Win=727 Len=0 TSval=1182900288 TSecr=1936060371"
"8275","07:21:04.345932","ec2-54-180-164-51.ap-northeast-2.compute.amazonaws.com","Galaxy-Note10-5G-lan.local","TLSv1.2","255","Application Data"
"8276","07:21:04.346016","ec2-54-180-164-51.ap-northeast-2.compute.amazonaws.com","Galaxy-Note10-5G-lan.local","TLSv1.2","104","Application Data"
"8306","07:21:04.355148","Galaxy-Note10-5G-lan.local","ec2-54-180-164-51.ap-northeast-2.compute.amazonaws.com","TCP","66","34038  >  https(443) [ACK] Seq=115 Ack=455 Win=467 Len=0 TSval=1468105010 TSecr=419360179"
"8335","07:21:04.360984","ec2-52-78-59-78.ap-northeast-2.compute.amazonaws.com","166.104.142.150","TCP","66","https(443)  >  33900 [ACK] Seq=5590 Ack=2779 Win=27 Len=0 TSval=748466712 TSecr=87344"
"8378","07:21:04.372042","ec2-52-79-232-168.ap-northeast-2.compute.amazonaws.com","Galaxy-Note10-5G-lan.local","TLSv1.2","236","Application Data"
"8380","07:21:04.374998","api.smartthings.com","Galaxy-Note10-5G-lan.local","TLSv1.2","1375","Application Data"
"8393","07:21:04.376274","ec2-52-79-232-168.ap-northeast-2.compute.amazonaws.com","Galaxy-Note10-5G-lan.local","TLSv1.2","248","Application Data"
"8411","07:21:04.379660","Galaxy-Note10-5G-lan.local","ec2-52-79-232-168.ap-northeast-2.compute.amazonaws.com","TLSv1.2","180","Application Data"
"8427","07:21:04.386631","Galaxy-Note10-5G-lan.local","api.smartthings.com","TLSv1.2","712","Application Data"
"8443","07:21:04.390919","api.smartthings.com","Galaxy-Note10-5G-lan.local","TCP","66","https(443)  >  33178 [ACK] Seq=2106 Ack=1808 Win=139 Len=0 TSval=3010004412 TSecr=1328697714"
"8541","07:21:04.415024","ec2-52-79-232-168.ap-northeast-2.compute.amazonaws.com","Galaxy-Note10-5G-lan.local","TLSv1.2","425","Application Data"
"8542","07:21:04.416135","ec2-52-79-232-168.ap-northeast-2.compute.amazonaws.com","Galaxy-Note10-5G-lan.local","TLSv1.2","105","Application Data"
"8631","07:21:04.440320","ec2-52-79-232-168.ap-northeast-2.compute.amazonaws.com","Galaxy-Note10-5G-lan.local","TLSv1.2","105","Application Data"
"8643","07:21:04.441590","Galaxy-Note10-5G-lan.local","ec2-52-79-232-168.ap-northeast-2.compute.amazonaws.com","TCP","66","40292  >  https(443) [ACK] Seq=3099 Ack=12322 Win=761 Len=0 TSval=1182900369 TSecr=1936060397"
"8787","07:21:04.481349","api.smartthings.com","Galaxy-Note10-5G-lan.local","TLSv1.2","752","Application Data"
"8831","07:21:04.494234","Galaxy-Note10-5G-lan.local","ec2-52-79-232-168.ap-northeast-2.compute.amazonaws.com","TCP","66","40292  >  https(443) [ACK] Seq=3099 Ack=12361 Win=761 Len=0 TSval=1182900433 TSecr=1936060403"
"8860","07:21:04.501068","ec2-52-79-232-168.ap-northeast-2.compute.amazonaws.com","Galaxy-Note10-5G-lan.local","TLSv1.2","177","Application Data"
