"No.","Time","Source","Destination","Protocol","Length","Info"
"198","07:26:16.120723","ec2-52-78-59-78.ap-northeast-2.compute.amazonaws.com","166.104.142.150","TLSv1.2","128","Application Data"
"199","07:26:16.126376","166.104.142.150","ec2-52-78-59-78.ap-northeast-2.compute.amazonaws.com","TLSv1.2","113","Application Data"
"200","07:26:16.130734","ec2-52-78-59-78.ap-northeast-2.compute.amazonaws.com","166.104.142.150","TCP","66","https(443)  >  33900 [ACK] Seq=63 Ack=48 Win=27 Len=0 TSval=748778474 TSecr=118540"
"201","07:26:16.132089","ec2-52-78-59-78.ap-northeast-2.compute.amazonaws.com","166.104.142.150","TLSv1.2","113","Application Data"
"202","07:26:16.141841","166.104.142.150","ec2-52-78-59-78.ap-northeast-2.compute.amazonaws.com","TLSv1.2","113","Application Data"
"203","07:26:16.148470","ec2-52-78-59-78.ap-northeast-2.compute.amazonaws.com","166.104.142.150","TLSv1.2","275","Application Data"
"204","07:26:16.156595","166.104.142.150","ec2-52-78-59-78.ap-northeast-2.compute.amazonaws.com","TLSv1.2","113","Application Data"
"213","07:26:16.196721","ec2-52-78-59-78.ap-northeast-2.compute.amazonaws.com","166.104.142.150","TLSv1.2","151","Application Data"
"216","07:26:16.223734","166.104.142.150","ec2-52-78-59-78.ap-northeast-2.compute.amazonaws.com","TLSv1.2","113","Application Data"
"219","07:26:16.269126","ec2-52-78-59-78.ap-northeast-2.compute.amazonaws.com","166.104.142.150","TCP","66","https(443)  >  33900 [ACK] Seq=404 Ack=189 Win=27 Len=0 TSval=748778612 TSecr=118550"
"267","07:26:16.653891","166.104.142.150","ec2-52-78-59-78.ap-northeast-2.compute.amazonaws.com","TLSv1.2","131","Application Data"
"268","07:26:16.658506","ec2-52-78-59-78.ap-northeast-2.compute.amazonaws.com","166.104.142.150","TCP","66","https(443)  >  33900 [ACK] Seq=404 Ack=254 Win=27 Len=0 TSval=748779001 TSecr=118593"
"269","07:26:16.660009","ec2-52-78-59-78.ap-northeast-2.compute.amazonaws.com","166.104.142.150","TLSv1.2","113","Application Data"
"270","07:26:16.663810","166.104.142.150","ec2-52-78-59-78.ap-northeast-2.compute.amazonaws.com","TLSv1.2","308","Application Data"
"271","07:26:16.669929","ec2-52-78-59-78.ap-northeast-2.compute.amazonaws.com","166.104.142.150","TLSv1.2","113","Application Data"
"272","07:26:16.689705","166.104.142.150","ec2-52-78-59-78.ap-northeast-2.compute.amazonaws.com","TCP","66","33900  >  https(443) [ACK] Seq=496 Ack=498 Win=5215 Len=0 TSval=118596 TSecr=748779003"
"274","07:26:16.809701","166.104.142.150","ec2-52-78-59-78.ap-northeast-2.compute.amazonaws.com","TLSv1.2","113","Application Data"
"275","07:26:16.857177","ec2-52-78-59-78.ap-northeast-2.compute.amazonaws.com","166.104.142.150","TCP","66","https(443)  >  33900 [ACK] Seq=498 Ack=543 Win=27 Len=0 TSval=748779200 TSecr=118609"
"758","07:26:18.561536","166.104.142.150","ec2-52-78-59-78.ap-northeast-2.compute.amazonaws.com","TLSv1.2","205","Application Data"
"759","07:26:18.565833","ec2-52-78-59-78.ap-northeast-2.compute.amazonaws.com","166.104.142.150","TCP","66","https(443)  >  33900 [ACK] Seq=498 Ack=682 Win=27 Len=0 TSval=748780909 TSecr=118784"
"760","07:26:18.567438","ec2-52-78-59-78.ap-northeast-2.compute.amazonaws.com","166.104.142.150","TLSv1.2","113","Application Data"
"761","07:26:18.570077","166.104.142.150","ec2-52-78-59-78.ap-northeast-2.compute.amazonaws.com","TLSv1.2","397","Application Data"
"762","07:26:18.575964","ec2-52-78-59-78.ap-northeast-2.compute.amazonaws.com","166.104.142.150","TLSv1.2","113","Application Data"
"763","07:26:18.580016","166.104.142.150","ec2-52-78-59-78.ap-northeast-2.compute.amazonaws.com","TCP","66","33900  >  https(443) [ACK] Seq=1013 Ack=592 Win=5215 Len=0 TSval=118786 TSecr=748780910"
"913","07:26:18.628825","ec2-52-78-59-78.ap-northeast-2.compute.amazonaws.com","166.104.142.150","TLSv1.2","400","Application Data"
"964","07:26:18.637618","166.104.142.150","ec2-52-78-59-78.ap-northeast-2.compute.amazonaws.com","TLSv1.2","113","Application Data"
"972","07:26:18.643060","ec2-52-78-59-78.ap-northeast-2.compute.amazonaws.com","166.104.142.150","TLSv1.2","447","Application Data"
"973","07:26:18.666520","166.104.142.150","ec2-52-78-59-78.ap-northeast-2.compute.amazonaws.com","TLSv1.2","113","Application Data"
"974","07:26:18.711215","ec2-52-78-59-78.ap-northeast-2.compute.amazonaws.com","166.104.142.150","TLSv1.2","730","Application Data"
"976","07:26:18.721163","166.104.142.150","ec2-52-78-59-78.ap-northeast-2.compute.amazonaws.com","TLSv1.2","113","Application Data"
"977","07:26:18.756622","ec2-52-78-59-78.ap-northeast-2.compute.amazonaws.com","166.104.142.150","TLSv1.2","146","Application Data"
"978","07:26:18.764340","166.104.142.150","ec2-52-78-59-78.ap-northeast-2.compute.amazonaws.com","TLSv1.2","113","Application Data"
"981","07:26:18.809200","ec2-52-78-59-78.ap-northeast-2.compute.amazonaws.com","166.104.142.150","TCP","66","https(443)  >  33900 [ACK] Seq=2051 Ack=1201 Win=27 Len=0 TSval=748781152 TSecr=118804"
"988","07:26:18.850562","166.104.142.150","ec2-52-78-59-78.ap-northeast-2.compute.amazonaws.com","TLSv1.2","464","Application Data"
"989","07:26:18.854800","ec2-52-78-59-78.ap-northeast-2.compute.amazonaws.com","166.104.142.150","TCP","66","https(443)  >  33900 [ACK] Seq=2051 Ack=1599 Win=27 Len=0 TSval=748781198 TSecr=118813"
"990","07:26:18.856409","ec2-52-78-59-78.ap-northeast-2.compute.amazonaws.com","166.104.142.150","TLSv1.2","113","Application Data"
"996","07:26:18.908032","166.104.142.150","ec2-52-78-59-78.ap-northeast-2.compute.amazonaws.com","TCP","66","33900  >  https(443) [ACK] Seq=1599 Ack=2098 Win=5215 Len=0 TSval=118819 TSecr=748781199"
"1005","07:26:19.151704","ec2-52-78-59-78.ap-northeast-2.compute.amazonaws.com","166.104.142.150","TLSv1.2","448","Application Data"
"1008","07:26:19.166756","166.104.142.150","ec2-52-78-59-78.ap-northeast-2.compute.amazonaws.com","TCP","66","33900  >  https(443) [ACK] Seq=1599 Ack=2480 Win=5215 Len=0 TSval=118843 TSecr=748781494"
"1009","07:26:19.166888","166.104.142.150","ec2-52-78-59-78.ap-northeast-2.compute.amazonaws.com","TLSv1.2","113","Application Data"
"1010","07:26:19.173096","ec2-52-78-59-78.ap-northeast-2.compute.amazonaws.com","166.104.142.150","TLSv1.2","400","Application Data"
"1011","07:26:19.191095","166.104.142.150","ec2-52-78-59-78.ap-northeast-2.compute.amazonaws.com","TLSv1.2","113","Application Data"
"1012","07:26:19.197266","ec2-52-78-59-78.ap-northeast-2.compute.amazonaws.com","166.104.142.150","TLSv1.2","162","Application Data"
"1014","07:26:19.216707","166.104.142.150","ec2-52-78-59-78.ap-northeast-2.compute.amazonaws.com","TLSv1.2","113","Application Data"
"1016","07:26:19.233058","ec2-52-78-59-78.ap-northeast-2.compute.amazonaws.com","166.104.142.150","TLSv1.2","739","Application Data"
"1017","07:26:19.247133","166.104.142.150","ec2-52-78-59-78.ap-northeast-2.compute.amazonaws.com","TLSv1.2","113","Application Data"
"1020","07:26:19.293180","ec2-52-78-59-78.ap-northeast-2.compute.amazonaws.com","166.104.142.150","TCP","66","https(443)  >  33900 [ACK] Seq=3583 Ack=1787 Win=27 Len=0 TSval=748781636 TSecr=118852"
"1429","07:26:20.756755","ec2-52-78-59-78.ap-northeast-2.compute.amazonaws.com","166.104.142.150","TLSv1.2","146","Application Data"
"1490","07:26:20.771005","166.104.142.150","ec2-52-78-59-78.ap-northeast-2.compute.amazonaws.com","TLSv1.2","113","Application Data"
"1491","07:26:20.775434","ec2-52-78-59-78.ap-northeast-2.compute.amazonaws.com","166.104.142.150","TCP","66","https(443)  >  33900 [ACK] Seq=3663 Ack=1834 Win=27 Len=0 TSval=748783118 TSecr=119005"
"1516","07:26:20.849418","166.104.142.150","ec2-52-78-59-78.ap-northeast-2.compute.amazonaws.com","TLSv1.2","469","Application Data"
"1517","07:26:20.854000","ec2-52-78-59-78.ap-northeast-2.compute.amazonaws.com","166.104.142.150","TCP","66","https(443)  >  33900 [ACK] Seq=3663 Ack=2237 Win=27 Len=0 TSval=748783196 TSecr=119013"
"1518","07:26:20.855285","ec2-52-78-59-78.ap-northeast-2.compute.amazonaws.com","166.104.142.150","TLSv1.2","113","Application Data"
"1523","07:26:20.915718","166.104.142.150","ec2-52-78-59-78.ap-northeast-2.compute.amazonaws.com","TCP","66","33900  >  https(443) [ACK] Seq=2237 Ack=3710 Win=5215 Len=0 TSval=119019 TSecr=748783198"
"1538","07:26:21.554055","ec2-52-78-59-78.ap-northeast-2.compute.amazonaws.com","166.104.142.150","TLSv1.2","449","Application Data"
"1725","07:26:21.673954","166.104.142.150","ec2-52-78-59-78.ap-northeast-2.compute.amazonaws.com","TCP","66","33900  >  https(443) [ACK] Seq=2237 Ack=4093 Win=5215 Len=0 TSval=119095 TSecr=748783897"
"1835","07:26:21.701936","166.104.142.150","ec2-52-78-59-78.ap-northeast-2.compute.amazonaws.com","TLSv1.2","113","Application Data"
"1863","07:26:21.707687","ec2-52-78-59-78.ap-northeast-2.compute.amazonaws.com","166.104.142.150","TLSv1.2","400","Application Data"
"2074","07:26:21.760042","166.104.142.150","ec2-52-78-59-78.ap-northeast-2.compute.amazonaws.com","TCP","66","33900  >  https(443) [ACK] Seq=2284 Ack=4427 Win=5215 Len=0 TSval=119104 TSecr=748784050"
"2736","07:26:21.920578","166.104.142.150","ec2-52-78-59-78.ap-northeast-2.compute.amazonaws.com","TLSv1.2","113","Application Data"
"2765","07:26:21.926458","ec2-52-78-59-78.ap-northeast-2.compute.amazonaws.com","166.104.142.150","TLSv1.2","748","Application Data"
"2785","07:26:21.932423","166.104.142.150","ec2-52-78-59-78.ap-northeast-2.compute.amazonaws.com","TCP","66","33900  >  https(443) [ACK] Seq=2331 Ack=5109 Win=5215 Len=0 TSval=119121 TSecr=748784269"
"2951","07:26:21.969660","166.104.142.150","ec2-52-78-59-78.ap-northeast-2.compute.amazonaws.com","TLSv1.2","113","Application Data"
"3147","07:26:22.017284","ec2-52-78-59-78.ap-northeast-2.compute.amazonaws.com","166.104.142.150","TCP","66","https(443)  >  33900 [ACK] Seq=5109 Ack=2378 Win=27 Len=0 TSval=748784360 TSecr=119125"
"3898","07:26:22.197475","ec2-52-78-59-78.ap-northeast-2.compute.amazonaws.com","166.104.142.150","TLSv1.2","159","Application Data"
"3911","07:26:22.201026","166.104.142.150","ec2-52-78-59-78.ap-northeast-2.compute.amazonaws.com","TCP","66","33900  >  https(443) [ACK] Seq=2378 Ack=5202 Win=5215 Len=0 TSval=119148 TSecr=748784540"
"3938","07:26:22.208311","166.104.142.150","ec2-52-78-59-78.ap-northeast-2.compute.amazonaws.com","TLSv1.2","113","Application Data"
"3960","07:26:22.213090","ec2-52-78-59-78.ap-northeast-2.compute.amazonaws.com","166.104.142.150","TCP","66","https(443)  >  33900 [ACK] Seq=5202 Ack=2425 Win=27 Len=0 TSval=748784556 TSecr=119149"
"4014","07:26:22.227144","166.104.142.150","ec2-52-78-59-78.ap-northeast-2.compute.amazonaws.com","TLSv1.2","259","Application Data"
"4031","07:26:22.231788","ec2-52-78-59-78.ap-northeast-2.compute.amazonaws.com","166.104.142.150","TCP","66","https(443)  >  33900 [ACK] Seq=5202 Ack=2618 Win=27 Len=0 TSval=748784574 TSecr=119151"
"6026","07:26:22.757232","ec2-52-78-59-78.ap-northeast-2.compute.amazonaws.com","166.104.142.150","TLSv1.2","146","Application Data"
"6590","07:26:22.905303","166.104.142.150","ec2-52-78-59-78.ap-northeast-2.compute.amazonaws.com","TLSv1.2","113","Application Data"
"6605","07:26:22.909612","ec2-52-78-59-78.ap-northeast-2.compute.amazonaws.com","166.104.142.150","TCP","66","https(443)  >  33900 [ACK] Seq=5282 Ack=2665 Win=27 Len=0 TSval=748785252 TSecr=119218"
"7011","07:26:23.016435","166.104.142.150","ec2-52-78-59-78.ap-northeast-2.compute.amazonaws.com","TLSv1.2","472","Application Data"
"7031","07:26:23.020732","ec2-52-78-59-78.ap-northeast-2.compute.amazonaws.com","166.104.142.150","TCP","66","https(443)  >  33900 [ACK] Seq=5282 Ack=3071 Win=27 Len=0 TSval=748785363 TSecr=119229"
"7039","07:26:23.022048","ec2-52-78-59-78.ap-northeast-2.compute.amazonaws.com","166.104.142.150","TLSv1.2","113","Application Data"
"7250","07:26:23.079216","166.104.142.150","ec2-52-78-59-78.ap-northeast-2.compute.amazonaws.com","TCP","66","33900  >  https(443) [ACK] Seq=3071 Ack=5329 Win=5215 Len=0 TSval=119236 TSecr=748785365"
"7618","07:26:23.173240","ec2-52-78-59-78.ap-northeast-2.compute.amazonaws.com","166.104.142.150","TLSv1.2","151","Application Data"
"7633","07:26:23.178828","166.104.142.150","ec2-52-78-59-78.ap-northeast-2.compute.amazonaws.com","TCP","66","33900  >  https(443) [ACK] Seq=3071 Ack=5414 Win=5215 Len=0 TSval=119246 TSecr=748785516"
"7664","07:26:23.186666","166.104.142.150","ec2-52-78-59-78.ap-northeast-2.compute.amazonaws.com","TLSv1.2","113","Application Data"
"7843","07:26:23.233209","ec2-52-78-59-78.ap-northeast-2.compute.amazonaws.com","166.104.142.150","TCP","66","https(443)  >  33900 [ACK] Seq=5414 Ack=3118 Win=27 Len=0 TSval=748785576 TSecr=119247"
"8193","07:26:23.326738","ec2-52-78-59-78.ap-northeast-2.compute.amazonaws.com","166.104.142.150","TLSv1.2","127","Application Data"
"8221","07:26:23.334037","166.104.142.150","ec2-52-78-59-78.ap-northeast-2.compute.amazonaws.com","TLSv1.2","113","Application Data"
"8238","07:26:23.338341","ec2-52-78-59-78.ap-northeast-2.compute.amazonaws.com","166.104.142.150","TCP","66","https(443)  >  33900 [ACK] Seq=5475 Ack=3165 Win=27 Len=0 TSval=748785681 TSecr=119261"
"8252","07:26:23.339720","ec2-52-78-59-78.ap-northeast-2.compute.amazonaws.com","166.104.142.150","TLSv1.2","113","Application Data"
"8270","07:26:23.346634","166.104.142.150","ec2-52-78-59-78.ap-northeast-2.compute.amazonaws.com","TLSv1.2","113","Application Data"
"8298","07:26:23.352080","ec2-52-78-59-78.ap-northeast-2.compute.amazonaws.com","166.104.142.150","TLSv1.2","275","Application Data"
"8327","07:26:23.361016","166.104.142.150","ec2-52-78-59-78.ap-northeast-2.compute.amazonaws.com","TLSv1.2","113","Application Data"
"8515","07:26:23.409320","ec2-52-78-59-78.ap-northeast-2.compute.amazonaws.com","166.104.142.150","TCP","66","https(443)  >  33900 [ACK] Seq=5731 Ack=3259 Win=27 Len=0 TSval=748785752 TSecr=119264"
"8516","07:26:23.411044","ec2-52-78-59-78.ap-northeast-2.compute.amazonaws.com","166.104.142.150","TLSv1.2","151","Application Data"
"8575","07:26:23.425052","166.104.142.150","ec2-52-78-59-78.ap-northeast-2.compute.amazonaws.com","TLSv1.2","113","Application Data"
"8592","07:26:23.429733","ec2-52-78-59-78.ap-northeast-2.compute.amazonaws.com","166.104.142.150","TCP","66","https(443)  >  33900 [ACK] Seq=5816 Ack=3306 Win=27 Len=0 TSval=748785772 TSecr=119270"
"8608","07:26:23.433422","166.104.142.150","ec2-52-78-59-78.ap-northeast-2.compute.amazonaws.com","TLSv1.2","113","Application Data"
"8624","07:26:23.437914","ec2-52-78-59-78.ap-northeast-2.compute.amazonaws.com","166.104.142.150","TCP","66","https(443)  >  33900 [ACK] Seq=5816 Ack=3353 Win=27 Len=0 TSval=748785781 TSecr=119271"
"12465","07:26:24.457143","ec2-52-78-59-78.ap-northeast-2.compute.amazonaws.com","166.104.142.150","TCP","66","[TCP Keep-Alive] https(443)  >  33900 [ACK] Seq=5815 Ack=3353 Win=27 Len=0 TSval=748786800 TSecr=119271"
"12798","07:26:24.544779","166.104.142.150","ec2-52-78-59-78.ap-northeast-2.compute.amazonaws.com","TCP","66","[TCP Keep-Alive ACK] 33900  >  https(443) [ACK] Seq=3353 Ack=5816 Win=5215 Len=0 TSval=119382 TSecr=748785781"
"13595","07:26:24.757440","ec2-52-78-59-78.ap-northeast-2.compute.amazonaws.com","166.104.142.150","TLSv1.2","166","Application Data"
"13625","07:26:24.765489","166.104.142.150","ec2-52-78-59-78.ap-northeast-2.compute.amazonaws.com","TLSv1.2","113","Application Data"
"13643","07:26:24.769796","ec2-52-78-59-78.ap-northeast-2.compute.amazonaws.com","166.104.142.150","TCP","66","https(443)  >  33900 [ACK] Seq=5916 Ack=3400 Win=27 Len=0 TSval=748787112 TSecr=119404"
"13947","07:26:24.850702","166.104.142.150","ec2-52-78-59-78.ap-northeast-2.compute.amazonaws.com","TLSv1.2","130","Application Data"
"13965","07:26:24.854901","ec2-52-78-59-78.ap-northeast-2.compute.amazonaws.com","166.104.142.150","TCP","66","https(443)  >  33900 [ACK] Seq=5916 Ack=3464 Win=27 Len=0 TSval=748787198 TSecr=119413"
"13980","07:26:24.856375","ec2-52-78-59-78.ap-northeast-2.compute.amazonaws.com","166.104.142.150","TLSv1.2","113","Application Data"
"14161","07:26:24.904132","166.104.142.150","ec2-52-78-59-78.ap-northeast-2.compute.amazonaws.com","TCP","66","33900  >  https(443) [ACK] Seq=3464 Ack=5963 Win=5215 Len=0 TSval=119419 TSecr=748787199"
"14208","07:26:24.917802","166.104.142.150","ec2-52-78-59-78.ap-northeast-2.compute.amazonaws.com","TLSv1.2","463","Application Data"
"14226","07:26:24.923623","ec2-52-78-59-78.ap-northeast-2.compute.amazonaws.com","166.104.142.150","TLSv1.2","113","Application Data"
"14242","07:26:24.928078","166.104.142.150","ec2-52-78-59-78.ap-northeast-2.compute.amazonaws.com","TCP","66","33900  >  https(443) [ACK] Seq=3861 Ack=6010 Win=5215 Len=0 TSval=119421 TSecr=748787266"
"15288","07:26:25.197617","ec2-52-78-59-78.ap-northeast-2.compute.amazonaws.com","166.104.142.150","TLSv1.2","143","Application Data"
"15918","07:26:25.363810","166.104.142.150","ec2-52-78-59-78.ap-northeast-2.compute.amazonaws.com","TCP","66","33900  >  https(443) [ACK] Seq=3861 Ack=6087 Win=5215 Len=0 TSval=119464 TSecr=748787540"
"15975","07:26:25.377821","166.104.142.150","ec2-52-78-59-78.ap-northeast-2.compute.amazonaws.com","TLSv1.2","113","Application Data"
"16158","07:26:25.425191","ec2-52-78-59-78.ap-northeast-2.compute.amazonaws.com","166.104.142.150","TCP","66","https(443)  >  33900 [ACK] Seq=6087 Ack=3908 Win=27 Len=0 TSval=748787768 TSecr=119465"
"19138","07:26:26.173579","ec2-52-78-59-78.ap-northeast-2.compute.amazonaws.com","166.104.142.150","TLSv1.2","162","Application Data"
"19990","07:26:26.414416","166.104.142.150","ec2-52-78-59-78.ap-northeast-2.compute.amazonaws.com","TLSv1.2","113","Application Data"
"20006","07:26:26.418864","ec2-52-78-59-78.ap-northeast-2.compute.amazonaws.com","166.104.142.150","TCP","66","https(443)  >  33900 [ACK] Seq=6183 Ack=3955 Win=27 Len=0 TSval=748788761 TSecr=119570"
"20009","07:26:26.420163","ec2-52-78-59-78.ap-northeast-2.compute.amazonaws.com","166.104.142.150","TLSv1.2","162","Application Data"
"20204","07:26:26.475128","166.104.142.150","ec2-52-78-59-78.ap-northeast-2.compute.amazonaws.com","TCP","66","33900  >  https(443) [ACK] Seq=3955 Ack=6279 Win=5215 Len=0 TSval=119576 TSecr=748788763"
"20266","07:26:26.493329","166.104.142.150","ec2-52-78-59-78.ap-northeast-2.compute.amazonaws.com","TLSv1.2","113","Application Data"
"20433","07:26:26.541420","ec2-52-78-59-78.ap-northeast-2.compute.amazonaws.com","166.104.142.150","TCP","66","https(443)  >  33900 [ACK] Seq=6279 Ack=4002 Win=27 Len=0 TSval=748788884 TSecr=119578"
"21337","07:26:26.799938","166.104.142.150","ec2-52-78-59-78.ap-northeast-2.compute.amazonaws.com","TCP","66","[TCP ACKed unseen segment] 33900  >  https(443) [ACK] Seq=4002 Ack=6378 Win=5215 Len=0 TSval=119608 TSecr=748789100"
"21338","07:26:26.800073","166.104.142.150","ec2-52-78-59-78.ap-northeast-2.compute.amazonaws.com","TLSv1.2","113","[TCP ACKed unseen segment] , Application Data"
"21353","07:26:26.804357","ec2-52-78-59-78.ap-northeast-2.compute.amazonaws.com","166.104.142.150","TCP","66","[TCP Previous segment not captured] https(443)  >  33900 [ACK] Seq=6378 Ack=4049 Win=27 Len=0 TSval=748789147 TSecr=119608"
"21808","07:26:26.934886","ec2-52-78-59-78.ap-northeast-2.compute.amazonaws.com","166.104.142.150","TCP","66","[TCP ACKed unseen segment] https(443)  >  33900 [ACK] Seq=6378 Ack=4115 Win=27 Len=0 TSval=748789277 TSecr=119621"
"21810","07:26:26.936014","ec2-52-78-59-78.ap-northeast-2.compute.amazonaws.com","166.104.142.150","TLSv1.2","113","[TCP ACKed unseen segment] , Application Data"
"21987","07:26:26.983221","166.104.142.150","ec2-52-78-59-78.ap-northeast-2.compute.amazonaws.com","TCP","66","[TCP ACKed unseen segment] [TCP Previous segment not captured] 33900  >  https(443) [ACK] Seq=4115 Ack=6425 Win=5215 Len=0 TSval=119627 TSecr=748789279"
"26191","07:26:28.197953","ec2-52-78-59-78.ap-northeast-2.compute.amazonaws.com","166.104.142.150","TLSv1.2","146","[TCP ACKed unseen segment] , Application Data"
"26222","07:26:28.207170","166.104.142.150","ec2-52-78-59-78.ap-northeast-2.compute.amazonaws.com","TCP","66","33900  >  https(443) [ACK] Seq=4115 Ack=6505 Win=5215 Len=0 TSval=119748 TSecr=748790540"
"26236","07:26:28.208781","166.104.142.150","ec2-52-78-59-78.ap-northeast-2.compute.amazonaws.com","TLSv1.2","113","Application Data"
"26405","07:26:28.257181","ec2-52-78-59-78.ap-northeast-2.compute.amazonaws.com","166.104.142.150","TCP","66","https(443)  >  33900 [ACK] Seq=6505 Ack=4162 Win=27 Len=0 TSval=748790600 TSecr=119749"
"29314","07:26:29.095587","ec2-52-78-59-78.ap-northeast-2.compute.amazonaws.com","166.104.142.150","TLSv1.2","166","Application Data"
"29853","07:26:29.255374","166.104.142.150","ec2-52-78-59-78.ap-northeast-2.compute.amazonaws.com","TLSv1.2","113","Application Data"
"29878","07:26:29.259904","ec2-52-78-59-78.ap-northeast-2.compute.amazonaws.com","166.104.142.150","TCP","66","https(443)  >  33900 [ACK] Seq=6605 Ack=4209 Win=27 Len=0 TSval=748791602 TSecr=119854"
"29886","07:26:29.261188","ec2-52-78-59-78.ap-northeast-2.compute.amazonaws.com","166.104.142.150","TLSv1.2","159","Application Data"
"29992","07:26:29.289809","166.104.142.150","ec2-52-78-59-78.ap-northeast-2.compute.amazonaws.com","TLSv1.2","113","Application Data"
"30225","07:26:29.357150","ec2-52-78-59-78.ap-northeast-2.compute.amazonaws.com","166.104.142.150","TCP","66","https(443)  >  33900 [ACK] Seq=6698 Ack=4256 Win=27 Len=0 TSval=748791700 TSecr=119857"
"30331","07:26:29.390542","166.104.142.150","ec2-52-78-59-78.ap-northeast-2.compute.amazonaws.com","TLSv1.2","130","Application Data"
"30347","07:26:29.394800","ec2-52-78-59-78.ap-northeast-2.compute.amazonaws.com","166.104.142.150","TCP","66","https(443)  >  33900 [ACK] Seq=6698 Ack=4320 Win=27 Len=0 TSval=748791737 TSecr=119867"
"30361","07:26:29.396074","ec2-52-78-59-78.ap-northeast-2.compute.amazonaws.com","166.104.142.150","TLSv1.2","113","Application Data"
"30409","07:26:29.411446","ec2-52-78-59-78.ap-northeast-2.compute.amazonaws.com","166.104.142.150","TLSv1.2","159","Application Data"
"30496","07:26:29.436762","166.104.142.150","ec2-52-78-59-78.ap-northeast-2.compute.amazonaws.com","TCP","66","33900  >  https(443) [ACK] Seq=4320 Ack=6838 Win=5215 Len=0 TSval=119872 TSecr=748791739"
"30529","07:26:29.448083","166.104.142.150","ec2-52-78-59-78.ap-northeast-2.compute.amazonaws.com","TLSv1.2","113","Application Data"
"30692","07:26:29.493178","ec2-52-78-59-78.ap-northeast-2.compute.amazonaws.com","166.104.142.150","TCP","66","https(443)  >  33900 [ACK] Seq=6838 Ack=4367 Win=27 Len=0 TSval=748791836 TSecr=119873"
"30739","07:26:29.507894","166.104.142.150","ec2-52-78-59-78.ap-northeast-2.compute.amazonaws.com","TLSv1.2","468","Application Data"
"30756","07:26:29.512634","ec2-52-78-59-78.ap-northeast-2.compute.amazonaws.com","166.104.142.150","TCP","66","https(443)  >  33900 [ACK] Seq=6838 Ack=4769 Win=27 Len=0 TSval=748791855 TSecr=119878"
"30769","07:26:29.513778","ec2-52-78-59-78.ap-northeast-2.compute.amazonaws.com","166.104.142.150","TLSv1.2","113","Application Data"
"30943","07:26:29.565037","166.104.142.150","ec2-52-78-59-78.ap-northeast-2.compute.amazonaws.com","TCP","66","33900  >  https(443) [ACK] Seq=4769 Ack=6885 Win=5215 Len=0 TSval=119885 TSecr=748791856"
"32753","07:26:30.086242","ec2-52-78-59-78.ap-northeast-2.compute.amazonaws.com","166.104.142.150","TLSv1.2","151","Application Data"
"32771","07:26:30.092833","166.104.142.150","ec2-52-78-59-78.ap-northeast-2.compute.amazonaws.com","TCP","66","33900  >  https(443) [ACK] Seq=4769 Ack=6970 Win=5215 Len=0 TSval=119937 TSecr=748792429"
"32785","07:26:30.095676","166.104.142.150","ec2-52-78-59-78.ap-northeast-2.compute.amazonaws.com","TLSv1.2","113","Application Data"
"32959","07:26:30.145443","ec2-52-78-59-78.ap-northeast-2.compute.amazonaws.com","166.104.142.150","TCP","66","https(443)  >  33900 [ACK] Seq=6970 Ack=4816 Win=27 Len=0 TSval=748792488 TSecr=119938"
"36192","07:26:31.095816","ec2-52-78-59-78.ap-northeast-2.compute.amazonaws.com","166.104.142.150","TLSv1.2","167","Application Data"
"36224","07:26:31.102153","166.104.142.150","ec2-52-78-59-78.ap-northeast-2.compute.amazonaws.com","TLSv1.2","113","Application Data"
"36239","07:26:31.106742","ec2-52-78-59-78.ap-northeast-2.compute.amazonaws.com","166.104.142.150","TCP","66","https(443)  >  33900 [ACK] Seq=7071 Ack=4863 Win=27 Len=0 TSval=748793449 TSecr=120039"
"36531","07:26:31.191563","166.104.142.150","ec2-52-78-59-78.ap-northeast-2.compute.amazonaws.com","TLSv1.2","132","Application Data"
"36546","07:26:31.195829","ec2-52-78-59-78.ap-northeast-2.compute.amazonaws.com","166.104.142.150","TCP","66","https(443)  >  33900 [ACK] Seq=7071 Ack=4929 Win=27 Len=0 TSval=748793538 TSecr=120047"
"36559","07:26:31.204002","166.104.142.150","ec2-52-78-59-78.ap-northeast-2.compute.amazonaws.com","TCP","66","[TCP ACKed unseen segment] 33900  >  https(443) [ACK] Seq=4929 Ack=7194 Win=5215 Len=0 TSval=120049 TSecr=748793540"
"36587","07:26:31.210881","166.104.142.150","ec2-52-78-59-78.ap-northeast-2.compute.amazonaws.com","TLSv1.2","113","[TCP ACKed unseen segment] , Application Data"
"36762","07:26:31.261293","ec2-52-78-59-78.ap-northeast-2.compute.amazonaws.com","166.104.142.150","TCP","66","[TCP Previous segment not captured] https(443)  >  33900 [ACK] Seq=7194 Ack=4976 Win=27 Len=0 TSval=748793604 TSecr=120049"
"39930","07:26:32.174118","ec2-52-78-59-78.ap-northeast-2.compute.amazonaws.com","166.104.142.150","TLSv1.2","143","Application Data"
"40207","07:26:32.249254","166.104.142.150","ec2-52-78-59-78.ap-northeast-2.compute.amazonaws.com","TLSv1.2","113","[TCP ACKed unseen segment] , Application Data"
"40224","07:26:32.253386","ec2-52-78-59-78.ap-northeast-2.compute.amazonaws.com","166.104.142.150","TCP","66","https(443)  >  33900 [ACK] Seq=7271 Ack=5023 Win=27 Len=0 TSval=748794596 TSecr=120153"
"40391","07:26:32.302562","166.104.142.150","ec2-52-78-59-78.ap-northeast-2.compute.amazonaws.com","TLSv1.2","259","Application Data"
"40407","07:26:32.306803","ec2-52-78-59-78.ap-northeast-2.compute.amazonaws.com","166.104.142.150","TCP","66","https(443)  >  33900 [ACK] Seq=7271 Ack=5216 Win=27 Len=0 TSval=748794649 TSecr=120158"
"40781","07:26:32.411781","ec2-52-78-59-78.ap-northeast-2.compute.amazonaws.com","166.104.142.150","TLSv1.2","143","Application Data"
"40887","07:26:32.441615","166.104.142.150","ec2-52-78-59-78.ap-northeast-2.compute.amazonaws.com","TLSv1.2","113","Application Data"
"40976","07:26:32.470402","166.104.142.150","ec2-52-78-59-78.ap-northeast-2.compute.amazonaws.com","TLSv1.2","259","Application Data"
"40995","07:26:32.475057","ec2-52-78-59-78.ap-northeast-2.compute.amazonaws.com","166.104.142.150","TCP","66","https(443)  >  33900 [ACK] Seq=7348 Ack=5456 Win=27 Len=0 TSval=748794817 TSecr=120175"
"43138","07:26:33.086718","ec2-52-78-59-78.ap-northeast-2.compute.amazonaws.com","166.104.142.150","TLSv1.2","162","Application Data"
"43172","07:26:33.095734","166.104.142.150","ec2-52-78-59-78.ap-northeast-2.compute.amazonaws.com","TLSv1.2","113","Application Data"
"43185","07:26:33.100345","ec2-52-78-59-78.ap-northeast-2.compute.amazonaws.com","166.104.142.150","TCP","66","https(443)  >  33900 [ACK] Seq=7444 Ack=5503 Win=27 Len=0 TSval=748795443 TSecr=120238"
"47041","07:26:34.198704","ec2-52-78-59-78.ap-northeast-2.compute.amazonaws.com","166.104.142.150","TLSv1.2","147","Application Data"
"47095","07:26:34.214966","166.104.142.150","ec2-52-78-59-78.ap-northeast-2.compute.amazonaws.com","TLSv1.2","113","Application Data"
"47117","07:26:34.219119","ec2-52-78-59-78.ap-northeast-2.compute.amazonaws.com","166.104.142.150","TCP","66","https(443)  >  33900 [ACK] Seq=7525 Ack=5550 Win=27 Len=0 TSval=748796562 TSecr=120349"
"49701","07:26:34.963974","166.104.142.150","fw-update2.smartthings.com","TCP","74","36554  >  https(443) [SYN] Seq=0 Win=29200 Len=0 MSS=1460 SACK_PERM=1 TSval=120425 TSecr=0 WS=32"
"50480","07:26:35.187302","166.104.142.150","ec2-52-78-59-78.ap-northeast-2.compute.amazonaws.com","TLSv1.2","113","[TCP ACKed unseen segment] , Application Data"
"50494","07:26:35.191676","ec2-52-78-59-78.ap-northeast-2.compute.amazonaws.com","166.104.142.150","TCP","66","[TCP Previous segment not captured] https(443)  >  33900 [ACK] Seq=7605 Ack=5597 Win=27 Len=0 TSval=748797534 TSecr=120447"
"50526","07:26:35.202567","fw-update2.smartthings.com","166.104.142.150","TCP","74","https(443)  >  36554 [SYN, ACK] Seq=0 Ack=1 Win=26847 Len=0 MSS=1460 SACK_PERM=1 TSval=3529975794 TSecr=120425 WS=256"
"50574","07:26:35.214847","166.104.142.150","fw-update2.smartthings.com","TCP","66","36554  >  https(443) [ACK] Seq=1 Ack=1 Win=29216 Len=0 TSval=120450 TSecr=3529975794"
"50584","07:26:35.218785","166.104.142.150","fw-update2.smartthings.com","TLSv1.2","359","Client Hello"
"51285","07:26:35.422275","166.104.142.150","ec2-52-78-59-78.ap-northeast-2.compute.amazonaws.com","TLSv1.2","113","[TCP ACKed unseen segment] , Application Data"
"51301","07:26:35.426503","ec2-52-78-59-78.ap-northeast-2.compute.amazonaws.com","166.104.142.150","TCP","66","[TCP Previous segment not captured] https(443)  >  33900 [ACK] Seq=7685 Ack=5644 Win=27 Len=0 TSval=748797769 TSecr=120471"
"51421","07:26:35.457663","fw-update2.smartthings.com","166.104.142.150","TCP","66","https(443)  >  36554 [ACK] Seq=1 Ack=294 Win=28160 Len=0 TSval=3529976050 TSecr=120450"
"51422","07:26:35.458038","fw-update2.smartthings.com","166.104.142.150","TLSv1.2","289","[TCP Previous segment not captured] , Ignored Unknown Record"
"51424","07:26:35.458343","fw-update2.smartthings.com","166.104.142.150","TCP","1514","[TCP Out-Of-Order] https(443)  >  36554 [ACK] Seq=1 Ack=294 Win=28160 Len=1448 TSval=3529976050 TSecr=120450"
"51438","07:26:35.463425","166.104.142.150","fw-update2.smartthings.com","TCP","78","[TCP Window Update] 36554  >  https(443) [ACK] Seq=294 Ack=1 Win=30272 Len=0 TSval=120475 TSecr=3529976050 SLE=1449 SRE=1672"
"51451","07:26:35.466556","166.104.142.150","fw-update2.smartthings.com","TCP","66","36554  >  https(443) [ACK] Seq=294 Ack=1672 Win=33184 Len=0 TSval=120475 TSecr=3529976050"
"51482","07:26:35.479687","166.104.142.150","fw-update2.smartthings.com","TLSv1.2","192","Client Key Exchange, Change Cipher Spec, Encrypted Handshake Message"
"52341","07:26:35.718801","fw-update2.smartthings.com","166.104.142.150","TLSv1.2","117","Change Cipher Spec, Encrypted Handshake Message"
"52358","07:26:35.724345","166.104.142.150","fw-update2.smartthings.com","TLSv1.2","126","Application Data"
"53189","07:26:35.963334","fw-update2.smartthings.com","166.104.142.150","TLSv1.2","111","Application Data"
"53321","07:26:36.008887","166.104.142.150","fw-update2.smartthings.com","TCP","66","36554  >  https(443) [ACK] Seq=480 Ack=1768 Win=33184 Len=0 TSval=120530 TSecr=3529976555"
"53614","07:26:36.087051","ec2-52-78-59-78.ap-northeast-2.compute.amazonaws.com","166.104.142.150","TLSv1.2","159","Application Data"
"54476","07:26:36.333249","ec2-52-78-59-78.ap-northeast-2.compute.amazonaws.com","166.104.142.150","TCP","159","[TCP Retransmission] https(443)  >  33900 [PSH, ACK] Seq=7685 Ack=5644 Win=27 Len=93 TSval=748798675 TSecr=120471"
"54677","07:26:36.390748","166.104.142.150","ec2-52-78-59-78.ap-northeast-2.compute.amazonaws.com","TCP","78","[TCP ACKed unseen segment] 33900  >  https(443) [ACK] Seq=5644 Ack=7778 Win=5215 Len=0 TSval=120567 TSecr=748798675 SLE=7685 SRE=7778"
"54837","07:26:36.438021","166.104.142.150","ec2-52-78-59-78.ap-northeast-2.compute.amazonaws.com","TLSv1.2","113","Application Data"
"54850","07:26:36.442161","ec2-52-78-59-78.ap-northeast-2.compute.amazonaws.com","166.104.142.150","TCP","66","https(443)  >  33900 [ACK] Seq=7778 Ack=5691 Win=27 Len=0 TSval=748798784 TSecr=120572"
"54984","07:26:36.483582","166.104.142.150","ec2-52-78-59-78.ap-northeast-2.compute.amazonaws.com","TLSv1.2","259","Application Data"
"55000","07:26:36.487875","ec2-52-78-59-78.ap-northeast-2.compute.amazonaws.com","166.104.142.150","TCP","66","https(443)  >  33900 [ACK] Seq=7778 Ack=5884 Win=27 Len=0 TSval=748798830 TSecr=120577"
"57006","07:26:37.075282","166.104.142.150","ec2-52-78-59-78.ap-northeast-2.compute.amazonaws.com","TCP","66","[TCP ACKed unseen segment] 33900  >  https(443) [ACK] Seq=5884 Ack=7863 Win=5215 Len=0 TSval=120636 TSecr=748799411"
"57048","07:26:37.085533","166.104.142.150","ec2-52-78-59-78.ap-northeast-2.compute.amazonaws.com","TLSv1.2","113","[TCP ACKed unseen segment] , Application Data"
"57064","07:26:37.090281","ec2-52-78-59-78.ap-northeast-2.compute.amazonaws.com","166.104.142.150","TCP","66","[TCP Previous segment not captured] https(443)  >  33900 [ACK] Seq=7863 Ack=5931 Win=27 Len=0 TSval=748799432 TSecr=120637"
"58347","07:26:37.450859","166.104.142.150","fw-update2.smartthings.com","TLSv1.2","386","Application Data"
"59178","07:26:37.689936","fw-update2.smartthings.com","166.104.142.150","TLSv1.2","120","Application Data"
"59677","07:26:37.824226","166.104.142.150","ec2-52-78-59-78.ap-northeast-2.compute.amazonaws.com","TLSv1.2","145","[TCP ACKed unseen segment] , Application Data"
"59678","07:26:37.824431","166.104.142.150","fw-update2.smartthings.com","TCP","66","36554  >  https(443) [ACK] Seq=800 Ack=1822 Win=33184 Len=0 TSval=120711 TSecr=3529978282"
"59679","07:26:37.824463","166.104.142.150","fw-update2.smartthings.com","TLSv1.2","240","Application Data"
"59695","07:26:37.828429","ec2-52-78-59-78.ap-northeast-2.compute.amazonaws.com","166.104.142.150","TCP","66","https(443)  >  33900 [ACK] Seq=7863 Ack=6010 Win=27 Len=0 TSval=748800171 TSecr=120711"
"59696","07:26:37.830122","ec2-52-78-59-78.ap-northeast-2.compute.amazonaws.com","166.104.142.150","TLSv1.2","113","Application Data"
"59855","07:26:37.877725","166.104.142.150","ec2-52-78-59-78.ap-northeast-2.compute.amazonaws.com","TCP","66","33900  >  https(443) [ACK] Seq=6010 Ack=7910 Win=5215 Len=0 TSval=120717 TSecr=748800172"
"59981","07:26:37.912857","ec2-52-78-59-78.ap-northeast-2.compute.amazonaws.com","166.104.142.150","TLSv1.2","400","Application Data"
"59997","07:26:37.918074","166.104.142.150","ec2-52-78-59-78.ap-northeast-2.compute.amazonaws.com","TCP","66","33900  >  https(443) [ACK] Seq=6010 Ack=8244 Win=5215 Len=0 TSval=120720 TSecr=748800255"
"60016","07:26:37.923776","166.104.142.150","ec2-52-78-59-78.ap-northeast-2.compute.amazonaws.com","TLSv1.2","113","Application Data"
"60088","07:26:37.940586","ec2-52-78-59-78.ap-northeast-2.compute.amazonaws.com","166.104.142.150","TLSv1.2","448","Application Data"
"60162","07:26:37.963403","166.104.142.150","ec2-52-78-59-78.ap-northeast-2.compute.amazonaws.com","TLSv1.2","113","Application Data"
"60346","07:26:38.009106","ec2-52-78-59-78.ap-northeast-2.compute.amazonaws.com","166.104.142.150","TCP","66","https(443)  >  33900 [ACK] Seq=8626 Ack=6104 Win=27 Len=0 TSval=748800351 TSecr=120724"
"60394","07:26:38.028204","166.104.142.150","ec2-52-78-59-78.ap-northeast-2.compute.amazonaws.com","TLSv1.2","113","[TCP ACKed unseen segment] , Application Data"
"60409","07:26:38.032466","ec2-52-78-59-78.ap-northeast-2.compute.amazonaws.com","166.104.142.150","TCP","66","[TCP Previous segment not captured] https(443)  >  33900 [ACK] Seq=9350 Ack=6151 Win=27 Len=0 TSval=748800375 TSecr=120731"
"60532","07:26:38.063745","fw-update2.smartthings.com","166.104.142.150","TLSv1.2","103","Application Data"
"60545","07:26:38.068002","166.104.142.150","fw-update2.smartthings.com","TLSv1.2","536","Application Data"
"60917","07:26:38.174511","ec2-52-78-59-78.ap-northeast-2.compute.amazonaws.com","166.104.142.150","TLSv1.2","142","Application Data"
"60964","07:26:38.186712","166.104.142.150","ec2-52-78-59-78.ap-northeast-2.compute.amazonaws.com","TLSv1.2","113","[TCP ACKed unseen segment] , Application Data"
"60980","07:26:38.191024","ec2-52-78-59-78.ap-northeast-2.compute.amazonaws.com","166.104.142.150","TCP","66","https(443)  >  33900 [ACK] Seq=9426 Ack=6198 Win=27 Len=0 TSval=748800533 TSecr=120747"
"61375","07:26:38.306728","fw-update2.smartthings.com","166.104.142.150","TLSv1.2","141","Application Data"
"61391","07:26:38.310418","166.104.142.150","fw-update2.smartthings.com","TCP","66","36554  >  https(443) [FIN, ACK] Seq=1444 Ack=1934 Win=33184 Len=0 TSval=120760 TSecr=3529978899"
"61745","07:26:38.412260","ec2-52-78-59-78.ap-northeast-2.compute.amazonaws.com","166.104.142.150","TLSv1.2","142","Application Data"
"61810","07:26:38.430013","166.104.142.150","ec2-52-78-59-78.ap-northeast-2.compute.amazonaws.com","TLSv1.2","113","Application Data"
"61830","07:26:38.434260","ec2-52-78-59-78.ap-northeast-2.compute.amazonaws.com","166.104.142.150","TCP","66","https(443)  >  33900 [ACK] Seq=9502 Ack=6245 Win=27 Len=0 TSval=748800777 TSecr=120771"
"62238","07:26:38.549301","fw-update2.smartthings.com","166.104.142.150","TLSv1.2","97","Encrypted Alert"
"62239","07:26:38.549305","fw-update2.smartthings.com","166.104.142.150","TCP","66","https(443)  >  36554 [FIN, ACK] Seq=1965 Ack=1445 Win=31232 Len=0 TSval=3529979141 TSecr=120760"
"62253","07:26:38.552426","166.104.142.150","fw-update2.smartthings.com","TCP","54","36554  >  https(443) [RST] Seq=1445 Win=0 Len=0"
"62255","07:26:38.552551","166.104.142.150","fw-update2.smartthings.com","TCP","54","36554  >  https(443) [RST] Seq=1445 Win=0 Len=0"
"64415","07:26:39.187980","166.104.142.150","ec2-52-78-59-78.ap-northeast-2.compute.amazonaws.com","TLSv1.2","113","[TCP ACKed unseen segment] , Application Data"
"64433","07:26:39.192398","ec2-52-78-59-78.ap-northeast-2.compute.amazonaws.com","166.104.142.150","TCP","66","[TCP Previous segment not captured] https(443)  >  33900 [ACK] Seq=9579 Ack=6292 Win=27 Len=0 TSval=748801535 TSecr=120848"
"67429","07:26:40.068558","ec2-52-78-59-78.ap-northeast-2.compute.amazonaws.com","166.104.142.150","TLSv1.2","162","Application Data"
"67474","07:26:40.081209","166.104.142.150","ec2-52-78-59-78.ap-northeast-2.compute.amazonaws.com","TLSv1.2","113","[TCP ACKed unseen segment] , Application Data"
"67491","07:26:40.085460","ec2-52-78-59-78.ap-northeast-2.compute.amazonaws.com","166.104.142.150","TCP","66","https(443)  >  33900 [ACK] Seq=9675 Ack=6339 Win=27 Len=0 TSval=748802428 TSecr=120937"
"68093","07:26:40.257546","ec2-52-78-59-78.ap-northeast-2.compute.amazonaws.com","166.104.142.150","TLSv1.2","321","Application Data"
"68133","07:26:40.266723","166.104.142.150","ec2-52-78-59-78.ap-northeast-2.compute.amazonaws.com","TLSv1.2","113","Application Data"
"68149","07:26:40.271029","ec2-52-78-59-78.ap-northeast-2.compute.amazonaws.com","166.104.142.150","TCP","66","https(443)  >  33900 [ACK] Seq=9930 Ack=6386 Win=27 Len=0 TSval=748802613 TSecr=120956"
"68506","07:26:40.375178","166.104.142.150","ec2-52-78-59-78.ap-northeast-2.compute.amazonaws.com","TLSv1.2","462","Application Data"
"68523","07:26:40.379486","ec2-52-78-59-78.ap-northeast-2.compute.amazonaws.com","166.104.142.150","TCP","66","https(443)  >  33900 [ACK] Seq=9930 Ack=6782 Win=27 Len=0 TSval=748802722 TSecr=120966"
"68524","07:26:40.380937","ec2-52-78-59-78.ap-northeast-2.compute.amazonaws.com","166.104.142.150","TLSv1.2","113","Application Data"
"68687","07:26:40.428058","166.104.142.150","ec2-52-78-59-78.ap-northeast-2.compute.amazonaws.com","TCP","66","33900  >  https(443) [ACK] Seq=6782 Ack=9977 Win=5215 Len=0 TSval=120972 TSecr=748802723"
"71329","07:26:41.174895","ec2-52-78-59-78.ap-northeast-2.compute.amazonaws.com","166.104.142.150","TLSv1.2","147","Application Data"
"71344","07:26:41.177579","166.104.142.150","ec2-52-78-59-78.ap-northeast-2.compute.amazonaws.com","TCP","66","33900  >  https(443) [ACK] Seq=6782 Ack=10058 Win=5215 Len=0 TSval=121047 TSecr=748803517"
"71362","07:26:41.183872","166.104.142.150","ec2-52-78-59-78.ap-northeast-2.compute.amazonaws.com","TLSv1.2","113","Application Data"
"71518","07:26:41.229123","ec2-52-78-59-78.ap-northeast-2.compute.amazonaws.com","166.104.142.150","TCP","66","https(443)  >  33900 [ACK] Seq=10058 Ack=6829 Win=27 Len=0 TSval=748803571 TSecr=121047"
"72156","07:26:41.412526","ec2-52-78-59-78.ap-northeast-2.compute.amazonaws.com","166.104.142.150","TLSv1.2","147","Application Data"
"72249","07:26:41.435550","166.104.142.150","ec2-52-78-59-78.ap-northeast-2.compute.amazonaws.com","TLSv1.2","113","Application Data"
"72265","07:26:41.439874","ec2-52-78-59-78.ap-northeast-2.compute.amazonaws.com","166.104.142.150","TCP","66","https(443)  >  33900 [ACK] Seq=10139 Ack=6876 Win=27 Len=0 TSval=748803782 TSecr=121072"
"74547","07:26:42.087370","ec2-52-78-59-78.ap-northeast-2.compute.amazonaws.com","166.104.142.150","TLSv1.2","146","Application Data"
"74630","07:26:42.108300","166.104.142.150","ec2-52-78-59-78.ap-northeast-2.compute.amazonaws.com","TLSv1.2","113","Application Data"
"74647","07:26:42.112521","ec2-52-78-59-78.ap-northeast-2.compute.amazonaws.com","166.104.142.150","TCP","66","https(443)  >  33900 [ACK] Seq=10219 Ack=6923 Win=27 Len=0 TSval=748804455 TSecr=121139"
"75448","07:26:42.343918","166.104.142.150","api.smartthings.com","TCP","74","50884  >  https(443) [SYN] Seq=0 Win=29200 Len=0 MSS=1460 SACK_PERM=1 TSval=121163 TSecr=0 WS=32"
"75465","07:26:42.347161","api.smartthings.com","166.104.142.150","TCP","74","https(443)  >  50884 [SYN, ACK] Seq=0 Ack=1 Win=26847 Len=0 MSS=1460 SACK_PERM=1 TSval=1680670382 TSecr=121163 WS=256"
"75521","07:26:42.365705","166.104.142.150","api.smartthings.com","TCP","66","50884  >  https(443) [ACK] Seq=1 Ack=1 Win=29216 Len=0 TSval=121165 TSecr=1680670382"
"76420","07:26:42.624879","166.104.142.150","api.smartthings.com","TLSv1.2","303","Client Hello"
"76435","07:26:42.628621","api.smartthings.com","166.104.142.150","TCP","66","https(443)  >  50884 [ACK] Seq=1 Ack=238 Win=28160 Len=0 TSval=1680670663 TSecr=121191"
"76448","07:26:42.630390","api.smartthings.com","166.104.142.150","TLSv1.2","1514","Server Hello"
"76449","07:26:42.630571","api.smartthings.com","166.104.142.150","TCP","1514","https(443)  >  50884 [ACK] Seq=1449 Ack=238 Win=28160 Len=1448 TSval=1680670664 TSecr=121191 [TCP segment of a reassembled PDU]"
"76450","07:26:42.630697","api.smartthings.com","166.104.142.150","TLSv1.2","479","Certificate, Server Key Exchange, Server Hello Done"
"76454","07:26:42.633190","166.104.142.150","api.smartthings.com","TCP","66","50884  >  https(443) [ACK] Seq=238 Ack=1449 Win=32096 Len=0 TSval=121192 TSecr=1680670664"
"76455","07:26:42.633326","166.104.142.150","api.smartthings.com","TCP","66","50884  >  https(443) [ACK] Seq=238 Ack=2897 Win=35008 Len=0 TSval=121192 TSecr=1680670664"
"76456","07:26:42.633354","166.104.142.150","api.smartthings.com","TCP","66","50884  >  https(443) [ACK] Seq=238 Ack=3310 Win=37888 Len=0 TSval=121192 TSecr=1680670664"
"76552","07:26:42.660522","166.104.142.150","api.smartthings.com","TLSv1.2","141","Client Key Exchange"
"76553","07:26:42.660641","166.104.142.150","api.smartthings.com","TLSv1.2","72","Change Cipher Spec"
"76554","07:26:42.660668","166.104.142.150","api.smartthings.com","TLSv1.2","111","Encrypted Handshake Message"
"76585","07:26:42.666796","api.smartthings.com","166.104.142.150","TCP","66","https(443)  >  50884 [ACK] Seq=3310 Ack=364 Win=28160 Len=0 TSval=1680670701 TSecr=121195"
"76586","07:26:42.667149","api.smartthings.com","166.104.142.150","TLSv1.2","117","Change Cipher Spec, Encrypted Handshake Message"
"76661","07:26:42.688560","166.104.142.150","api.smartthings.com","TLSv1.2","197","Application Data"
"76675","07:26:42.692094","api.smartthings.com","166.104.142.150","TLSv1.2","265","Application Data"
"76691","07:26:42.696892","166.104.142.150","api.smartthings.com","TLSv1.2","97","Encrypted Alert"
"76707","07:26:42.699901","api.smartthings.com","166.104.142.150","TLSv1.2","97","Encrypted Alert"
"76708","07:26:42.700047","api.smartthings.com","166.104.142.150","TCP","66","https(443)  >  50884 [FIN, ACK] Seq=3591 Ack=526 Win=29184 Len=0 TSval=1680670735 TSecr=121199"
"76762","07:26:42.722062","166.104.142.150","api.smartthings.com","TCP","66","50884  >  https(443) [RST, ACK] Seq=526 Ack=3592 Win=40800 Len=0 TSval=121201 TSecr=1680670735"
"77940","07:26:43.068886","ec2-52-78-59-78.ap-northeast-2.compute.amazonaws.com","166.104.142.150","TLSv1.2","159","Application Data"
"78011","07:26:43.089112","166.104.142.150","ec2-52-78-59-78.ap-northeast-2.compute.amazonaws.com","TLSv1.2","113","Application Data"
"78028","07:26:43.093457","ec2-52-78-59-78.ap-northeast-2.compute.amazonaws.com","166.104.142.150","TCP","66","https(443)  >  33900 [ACK] Seq=10312 Ack=6970 Win=27 Len=0 TSval=748805436 TSecr=121237"
"78075","07:26:43.103550","166.104.142.150","ec2-52-78-59-78.ap-northeast-2.compute.amazonaws.com","TLSv1.2","259","Application Data"
"78088","07:26:43.108075","ec2-52-78-59-78.ap-northeast-2.compute.amazonaws.com","166.104.142.150","TCP","66","https(443)  >  33900 [ACK] Seq=10312 Ack=7163 Win=27 Len=0 TSval=748805450 TSecr=121239"
"81315","07:26:44.066955","ec2-52-78-59-78.ap-northeast-2.compute.amazonaws.com","166.104.142.150","TLSv1.2","151","Application Data"
"81706","07:26:44.181233","166.104.142.150","ec2-52-78-59-78.ap-northeast-2.compute.amazonaws.com","TLSv1.2","113","Application Data"
"81721","07:26:44.185464","ec2-52-78-59-78.ap-northeast-2.compute.amazonaws.com","166.104.142.150","TCP","66","https(443)  >  33900 [ACK] Seq=10397 Ack=7210 Win=27 Len=0 TSval=748806528 TSecr=121347"
"84749","07:26:45.087688","ec2-52-78-59-78.ap-northeast-2.compute.amazonaws.com","166.104.142.150","TLSv1.2","142","Application Data"
"84880","07:26:45.121238","166.104.142.150","ec2-52-78-59-78.ap-northeast-2.compute.amazonaws.com","TLSv1.2","113","Application Data"
"84896","07:26:45.125649","ec2-52-78-59-78.ap-northeast-2.compute.amazonaws.com","166.104.142.150","TCP","66","https(443)  >  33900 [ACK] Seq=10473 Ack=7257 Win=27 Len=0 TSval=748807468 TSecr=121439"
"88068","07:26:46.068989","ec2-52-78-59-78.ap-northeast-2.compute.amazonaws.com","166.104.142.150","TLSv1.2","143","Application Data"
"88115","07:26:46.081098","166.104.142.150","ec2-52-78-59-78.ap-northeast-2.compute.amazonaws.com","TLSv1.2","113","Application Data"
"88131","07:26:46.085366","ec2-52-78-59-78.ap-northeast-2.compute.amazonaws.com","166.104.142.150","TCP","66","https(443)  >  33900 [ACK] Seq=10550 Ack=7304 Win=27 Len=0 TSval=748808427 TSecr=121537"
"91489","07:26:47.067153","ec2-52-78-59-78.ap-northeast-2.compute.amazonaws.com","166.104.142.150","TLSv1.2","162","Application Data"
"91694","07:26:47.129788","166.104.142.150","ec2-52-78-59-78.ap-northeast-2.compute.amazonaws.com","TLSv1.2","113","Application Data"
"91715","07:26:47.134052","ec2-52-78-59-78.ap-northeast-2.compute.amazonaws.com","166.104.142.150","TCP","66","https(443)  >  33900 [ACK] Seq=10646 Ack=7351 Win=27 Len=0 TSval=748809476 TSecr=121642"
"95090","07:26:48.088047","ec2-52-78-59-78.ap-northeast-2.compute.amazonaws.com","166.104.142.150","TLSv1.2","147","Application Data"
"95173","07:26:48.110279","166.104.142.150","ec2-52-78-59-78.ap-northeast-2.compute.amazonaws.com","TLSv1.2","113","Application Data"
"95189","07:26:48.114485","ec2-52-78-59-78.ap-northeast-2.compute.amazonaws.com","166.104.142.150","TCP","66","https(443)  >  33900 [ACK] Seq=10727 Ack=7398 Win=27 Len=0 TSval=748810456 TSecr=121740"
"98559","07:26:49.069263","ec2-52-78-59-78.ap-northeast-2.compute.amazonaws.com","166.104.142.150","TLSv1.2","146","Application Data"
"98591","07:26:49.077817","166.104.142.150","ec2-52-78-59-78.ap-northeast-2.compute.amazonaws.com","TLSv1.2","113","Application Data"
"98607","07:26:49.082193","ec2-52-78-59-78.ap-northeast-2.compute.amazonaws.com","166.104.142.150","TCP","66","https(443)  >  33900 [ACK] Seq=10807 Ack=7445 Win=27 Len=0 TSval=748811424 TSecr=121837"
"101316","07:26:49.845546","ec2-52-78-59-78.ap-northeast-2.compute.amazonaws.com","166.104.142.150","TLSv1.2","322","Application Data"
"101344","07:26:49.853343","166.104.142.150","ec2-52-78-59-78.ap-northeast-2.compute.amazonaws.com","TLSv1.2","113","Application Data"
"101366","07:26:49.857988","ec2-52-78-59-78.ap-northeast-2.compute.amazonaws.com","166.104.142.150","TCP","66","https(443)  >  33900 [ACK] Seq=11063 Ack=7492 Win=27 Len=0 TSval=748812200 TSecr=121915"
"101793","07:26:49.982042","166.104.142.150","ec2-52-78-59-78.ap-northeast-2.compute.amazonaws.com","TLSv1.2","464","Application Data"
"101806","07:26:49.986358","ec2-52-78-59-78.ap-northeast-2.compute.amazonaws.com","166.104.142.150","TCP","66","https(443)  >  33900 [ACK] Seq=11063 Ack=7890 Win=27 Len=0 TSval=748812328 TSecr=121927"
"101822","07:26:49.987880","ec2-52-78-59-78.ap-northeast-2.compute.amazonaws.com","166.104.142.150","TLSv1.2","113","Application Data"
"102021","07:26:50.043566","166.104.142.150","ec2-52-78-59-78.ap-northeast-2.compute.amazonaws.com","TCP","66","33900  >  https(443) [ACK] Seq=7890 Ack=11110 Win=5215 Len=0 TSval=121934 TSecr=748812330"
"102094","07:26:50.067412","ec2-52-78-59-78.ap-northeast-2.compute.amazonaws.com","166.104.142.150","TLSv1.2","159","Application Data"
"102110","07:26:50.071618","166.104.142.150","ec2-52-78-59-78.ap-northeast-2.compute.amazonaws.com","TCP","66","33900  >  https(443) [ACK] Seq=7890 Ack=11203 Win=5215 Len=0 TSval=121936 TSecr=748812409"
"102161","07:26:50.086092","166.104.142.150","ec2-52-78-59-78.ap-northeast-2.compute.amazonaws.com","TLSv1.2","113","Application Data"
"102342","07:26:50.137158","ec2-52-78-59-78.ap-northeast-2.compute.amazonaws.com","166.104.142.150","TCP","66","https(443)  >  33900 [ACK] Seq=11203 Ack=7937 Win=27 Len=0 TSval=748812479 TSecr=121937"
"105634","07:26:51.093224","ec2-52-78-59-78.ap-northeast-2.compute.amazonaws.com","166.104.142.150","TCP","66","[TCP Keep-Alive] https(443)  >  33900 [ACK] Seq=11202 Ack=7937 Win=27 Len=0 TSval=748813435 TSecr=121937"
"105676","07:26:51.103555","166.104.142.150","ec2-52-78-59-78.ap-northeast-2.compute.amazonaws.com","TCP","66","[TCP Keep-Alive ACK] 33900  >  https(443) [ACK] Seq=7937 Ack=11203 Win=5215 Len=0 TSval=122039 TSecr=748812479"
"109055","07:26:52.069546","ec2-52-78-59-78.ap-northeast-2.compute.amazonaws.com","166.104.142.150","TLSv1.2","142","Application Data"
"109170","07:26:52.094521","166.104.142.150","ec2-52-78-59-78.ap-northeast-2.compute.amazonaws.com","TLSv1.2","113","Application Data"
"109185","07:26:52.098833","ec2-52-78-59-78.ap-northeast-2.compute.amazonaws.com","166.104.142.150","TCP","66","https(443)  >  33900 [ACK] Seq=11279 Ack=7984 Win=27 Len=0 TSval=748814441 TSecr=122139"
"109460","07:26:52.179381","166.104.142.150","ec2-52-78-59-78.ap-northeast-2.compute.amazonaws.com","TLSv1.2","259","Application Data"
"109476","07:26:52.183846","ec2-52-78-59-78.ap-northeast-2.compute.amazonaws.com","166.104.142.150","TCP","66","https(443)  >  33900 [ACK] Seq=11279 Ack=8177 Win=27 Len=0 TSval=748814526 TSecr=122147"
"112520","07:26:53.067663","ec2-52-78-59-78.ap-northeast-2.compute.amazonaws.com","166.104.142.150","TLSv1.2","143","Application Data"
"112566","07:26:53.077115","166.104.142.150","ec2-52-78-59-78.ap-northeast-2.compute.amazonaws.com","TLSv1.2","113","Application Data"
"112582","07:26:53.081274","ec2-52-78-59-78.ap-northeast-2.compute.amazonaws.com","166.104.142.150","TCP","66","https(443)  >  33900 [ACK] Seq=11356 Ack=8224 Win=27 Len=0 TSval=748815423 TSecr=122237"
"119471","07:26:55.069742","ec2-52-78-59-78.ap-northeast-2.compute.amazonaws.com","166.104.142.150","TLSv1.2","147","Application Data"
"119774","07:26:55.158718","166.104.142.150","ec2-52-78-59-78.ap-northeast-2.compute.amazonaws.com","TLSv1.2","113","Application Data"
"119789","07:26:55.163216","ec2-52-78-59-78.ap-northeast-2.compute.amazonaws.com","166.104.142.150","TCP","66","https(443)  >  33900 [ACK] Seq=11437 Ack=8271 Win=27 Len=0 TSval=748817505 TSecr=122438"
"122954","07:26:56.076914","166.104.142.150","ec2-52-78-59-78.ap-northeast-2.compute.amazonaws.com","TLSv1.2","113","[TCP ACKed unseen segment] , Application Data"
"122970","07:26:56.081036","ec2-52-78-59-78.ap-northeast-2.compute.amazonaws.com","166.104.142.150","TCP","66","[TCP Previous segment not captured] https(443)  >  33900 [ACK] Seq=11517 Ack=8318 Win=27 Len=0 TSval=748818423 TSecr=122537"
"133271","07:26:59.068314","ec2-52-78-59-78.ap-northeast-2.compute.amazonaws.com","166.104.142.150","TLSv1.2","142","Application Data"
"133319","07:26:59.082742","ec2-52-78-59-78.ap-northeast-2.compute.amazonaws.com","166.104.142.150","TCP","66","[TCP ACKed unseen segment] https(443)  >  33900 [ACK] Seq=11593 Ack=8365 Win=27 Len=0 TSval=748821424 TSecr=122838"
"133395","07:26:59.101957","ec2-52-78-59-78.ap-northeast-2.compute.amazonaws.com","166.104.142.150","TLSv1.2","151","[TCP ACKed unseen segment] , Application Data"
"133441","07:26:59.113766","166.104.142.150","ec2-52-78-59-78.ap-northeast-2.compute.amazonaws.com","TLSv1.2","113","[TCP ACKed unseen segment] [TCP Previous segment not captured] , Application Data"
"133595","07:26:59.161153","ec2-52-78-59-78.ap-northeast-2.compute.amazonaws.com","166.104.142.150","TCP","66","[TCP ACKed unseen segment] https(443)  >  33900 [ACK] Seq=11678 Ack=8412 Win=27 Len=0 TSval=748821503 TSecr=122841"
"143879","07:27:02.068638","ec2-52-78-59-78.ap-northeast-2.compute.amazonaws.com","166.104.142.150","TLSv1.2","147","Application Data"
"143993","07:27:02.101275","166.104.142.150","ec2-52-78-59-78.ap-northeast-2.compute.amazonaws.com","TLSv1.2","113","Application Data"
"144009","07:27:02.105454","ec2-52-78-59-78.ap-northeast-2.compute.amazonaws.com","166.104.142.150","TCP","66","https(443)  >  33900 [ACK] Seq=11759 Ack=8459 Win=27 Len=0 TSval=748824447 TSecr=123140"
"144010","07:27:02.106969","ec2-52-78-59-78.ap-northeast-2.compute.amazonaws.com","166.104.142.150","TLSv1.2","162","Application Data"
"144532","07:27:02.256828","166.104.142.150","ec2-52-78-59-78.ap-northeast-2.compute.amazonaws.com","TLSv1.2","113","Application Data"
"144718","07:27:02.305162","ec2-52-78-59-78.ap-northeast-2.compute.amazonaws.com","166.104.142.150","TCP","66","https(443)  >  33900 [ACK] Seq=11855 Ack=8506 Win=27 Len=0 TSval=748824647 TSecr=123145"
"152047","07:27:04.357785","166.104.142.150","ec2-52-78-59-78.ap-northeast-2.compute.amazonaws.com","TLSv1.2","464","Application Data"
"152068","07:27:04.362067","ec2-52-78-59-78.ap-northeast-2.compute.amazonaws.com","166.104.142.150","TCP","66","https(443)  >  33900 [ACK] Seq=11855 Ack=8904 Win=27 Len=0 TSval=748826704 TSecr=123366"
"152075","07:27:04.363625","ec2-52-78-59-78.ap-northeast-2.compute.amazonaws.com","166.104.142.150","TLSv1.2","113","Application Data"
"152267","07:27:04.418786","166.104.142.150","ec2-52-78-59-78.ap-northeast-2.compute.amazonaws.com","TCP","66","33900  >  https(443) [ACK] Seq=8904 Ack=11902 Win=5215 Len=0 TSval=123372 TSecr=748826705"
"154734","07:27:05.102307","ec2-52-78-59-78.ap-northeast-2.compute.amazonaws.com","166.104.142.150","TLSv1.2","159","Application Data"
"154750","07:27:05.106443","166.104.142.150","ec2-52-78-59-78.ap-northeast-2.compute.amazonaws.com","TCP","66","33900  >  https(443) [ACK] Seq=8904 Ack=11995 Win=5215 Len=0 TSval=123441 TSecr=748827444"
"154782","07:27:05.114277","166.104.142.150","ec2-52-78-59-78.ap-northeast-2.compute.amazonaws.com","TLSv1.2","113","Application Data"
"154944","07:27:05.161161","ec2-52-78-59-78.ap-northeast-2.compute.amazonaws.com","166.104.142.150","TCP","66","https(443)  >  33900 [ACK] Seq=11995 Ack=8951 Win=27 Len=0 TSval=748827503 TSecr=123441"
"158922","07:27:06.268999","166.104.142.150","ec2-52-78-59-78.ap-northeast-2.compute.amazonaws.com","TLSv1.2","259","Application Data"
"158940","07:27:06.273384","ec2-52-78-59-78.ap-northeast-2.compute.amazonaws.com","166.104.142.150","TCP","66","https(443)  >  33900 [ACK] Seq=11995 Ack=9144 Win=27 Len=0 TSval=748828615 TSecr=123557"
"165504","07:27:08.102735","ec2-52-78-59-78.ap-northeast-2.compute.amazonaws.com","166.104.142.150","TLSv1.2","143","Application Data"
"165548","07:27:08.111776","166.104.142.150","ec2-52-78-59-78.ap-northeast-2.compute.amazonaws.com","TLSv1.2","113","Application Data"
"165565","07:27:08.116110","ec2-52-78-59-78.ap-northeast-2.compute.amazonaws.com","166.104.142.150","TCP","66","https(443)  >  33900 [ACK] Seq=12072 Ack=9191 Win=27 Len=0 TSval=748830458 TSecr=123741"
"176354","07:27:11.103028","ec2-52-78-59-78.ap-northeast-2.compute.amazonaws.com","166.104.142.150","TLSv1.2","146","Application Data"
"176400","07:27:11.112992","166.104.142.150","ec2-52-78-59-78.ap-northeast-2.compute.amazonaws.com","TLSv1.2","113","Application Data"
"180510","07:27:12.261743","ec2-52-78-59-78.ap-northeast-2.compute.amazonaws.com","166.104.142.150","TCP","66","[TCP Keep-Alive] https(443)  >  33900 [ACK] Seq=12151 Ack=9238 Win=27 Len=0 TSval=748834603 TSecr=124042"
"181248","07:27:12.468654","166.104.142.150","ec2-52-78-59-78.ap-northeast-2.compute.amazonaws.com","TCP","66","[TCP Keep-Alive ACK] 33900  >  https(443) [ACK] Seq=9238 Ack=12152 Win=5215 Len=0 TSval=124177 TSecr=748833459"
"186994","07:27:14.064836","ec2-52-78-59-78.ap-northeast-2.compute.amazonaws.com","166.104.142.150","TLSv1.2","151","Application Data"
"187204","07:27:14.120257","166.104.142.150","ec2-52-78-59-78.ap-northeast-2.compute.amazonaws.com","TLSv1.2","113","Application Data"
"187217","07:27:14.124548","ec2-52-78-59-78.ap-northeast-2.compute.amazonaws.com","166.104.142.150","TCP","66","https(443)  >  33900 [ACK] Seq=12237 Ack=9285 Win=27 Len=0 TSval=748836466 TSecr=124338"
"187230","07:27:14.125815","ec2-52-78-59-78.ap-northeast-2.compute.amazonaws.com","166.104.142.150","TLSv1.2","142","Application Data"
"187282","07:27:14.137293","166.104.142.150","ec2-52-78-59-78.ap-northeast-2.compute.amazonaws.com","TLSv1.2","113","Application Data"
"187438","07:27:14.185118","ec2-52-78-59-78.ap-northeast-2.compute.amazonaws.com","166.104.142.150","TCP","66","https(443)  >  33900 [ACK] Seq=12313 Ack=9332 Win=27 Len=0 TSval=748836527 TSecr=124344"
